procurement_key,org,year,month,ada,issue_date,decision_type,subject,amount,amount_source,supplier_key,supplier_name,supplier_tax_id,signer,unit,url
proc:32ac10742bd2,50226,2020,1,ΩΗΧΓΟΡΗ9-ΤΥΞ,1579478400000,ΑΝΑΘΕΣΗ ΕΡΓΩΝ / ΠΡΟΜΗΘΕΙΩΝ / ΥΠΗΡΕΣΙΩΝ / ΜΕΛΕΤΩΝ,περί αναθέσεως προμήθειας και τοποθέτησης κιγκλιδωμάτων στο λιμενικό Φυλάκιο λιμένα Αγίου Κωνσταντίνου,200.0,detail:extraFieldValues.awardAmount.amount,tax:129356156,,129356156,124600,92806,https://diavgeia.gov.gr/doc/ΩΗΧΓΟΡΗ9-ΤΥΞ
proc:da063a2681a4,50226,2020,1,97ΛΝΟΡΗ9-4Θ1,2020-01-20,ΕΓΚΡΙΣΗ ΔΑΠΑΝΗΣ,"περί καταβολής στον Γεώργιο Προβόπουλο της 2ης πληρωμής της προμήθειας και εγκατάστασης ηλεκτροπαραγωγού ζεύγους στο λιμένα Στυλίδας, εκ ευρώ (5751,12) με το ΦΠΑ.",,,,,,,,https://diavgeia.gov.gr/doc/97ΛΝΟΡΗ9-4Θ1
proc:cb842d57fff8,50226,2020,1,9ΠΚΔΟΡΗ9-ΘΥ3,2020-01-20,ΕΓΚΡΙΣΗ ΔΑΠΑΝΗΣ,περί εγκρίσεως δαπάνης επισκευής του περιπολικού οχήματος του Β΄ Λ/Τ Αγίου Κωνσταντίνου ως και την προμήθεια των αντίστοιχων ανταλλακτικών,,,,,,,,https://diavgeia.gov.gr/doc/9ΠΚΔΟΡΗ9-ΘΥ3
proc:e66f0cf4c518,50226,2020,1,ΨΥΠΟΟΡΗ9-ΥΗΓ,2020-01-20,ΕΓΚΡΙΣΗ ΔΑΠΑΝΗΣ,περί εγκρίσεως δαπάνης προμήθειας και τοποθέτησης οικίσκου προστασίας του ηλεκτροπαραγωγού ζεύγους στο λιμένα Στυλίδας,,,,,,,,https://diavgeia.gov.gr/doc/ΨΥΠΟΟΡΗ9-ΥΗΓ
proc:55a49be6bb4d,50226,2020,1,Ω294ΟΡΗ9-Δ2Π,2020-01-20,ΕΓΚΡΙΣΗ ΔΑΠΑΝΗΣ,εξόφληση τιμολογίων,,,,,,,,https://diavgeia.gov.gr/doc/Ω294ΟΡΗ9-Δ2Π
proc:5e2d0ec81fcd,50226,2020,1,ΩΕΓΣΟΡΗ9-ΓΡ4,2020-01-20,ΕΓΚΡΙΣΗ ΔΑΠΑΝΗΣ,περί έγκρισης υπερωριακής εργασίας της υπαλλήλου του Λιμενικού Ταμείου Φθ/δας για το Α΄ εξάμηνο 2020 έτους.,,,,,,,,https://diavgeia.gov.gr/doc/ΩΕΓΣΟΡΗ9-ΓΡ4
proc:ed0ebe185f5d,50226,2020,1,ΩΛΦΑΟΡΗ9-ΔΥ1,2020-01-20,ΕΓΚΡΙΣΗ ΔΑΠΑΝΗΣ,"περί εγκρίσεως των εκάστοτε σταθερών και διαρκούς ή περιοδικού χαρακτήρα Της ανάληψης από τον Κ.Α.0000/0831 του Προϋπολογισμού χρήσης 2018 έτους της Υπηρεσίας του Λ.Τ.Φθ/δας, έως του ποσού των 500,00 ευρώ για την κάλυψη της πάσης φύσεως αλληλογραφίας για το έτος 20209.",500.0,subject:trusted_budget_phrase,,,,,,https://diavgeia.gov.gr/doc/ΩΛΦΑΟΡΗ9-ΔΥ1
proc:aa90550fcfc9,50226,2020,1,ΩΜΔΟΟΡΗ9-8ΟΗ,2020-01-20,ΕΓΚΡΙΣΗ ΔΑΠΑΝΗΣ,περί εγκρίσεως δαπάνης επισκευής αεροθαλάμου και ζωναριού του σκάφους του Λ/Χ Στυλίδας,,,,,,,,https://diavgeia.gov.gr/doc/ΩΜΔΟΟΡΗ9-8ΟΗ
proc:9c6ec54e24a3,50226,2020,1,ΨΘΟΝΟΡΗ9-Χ3Ε,2020-01-29,ΕΓΚΡΙΣΗ ΔΑΠΑΝΗΣ,Έγκριση δαπάνης για την προμήθεια διαφόρων μικροϋλικών ετησίως που θα καλύπτουν έκτακτες ανάγκες της Υπηρεσίας μας και δεν κατονομάζονται ειδικά,,,,,,,,https://diavgeia.gov.gr/doc/ΨΘΟΝΟΡΗ9-Χ3Ε
proc:47f1de85b31d,50226,2020,1,ΨΤΡΖΟΡΗ9-2ΓΞ,2020-01-29,ΕΓΚΡΙΣΗ ΔΑΠΑΝΗΣ,περί εγκρίσεως δαπάνης για την προετοιμασία του φακέλου για την διατήρηση πιστοποίησης κατά ISO 9001:2015 των εγκαταστάσεων του λιμένα Στυλίδας ως τερματικού σταθμού χύδην φορτίων,,,,,,,,https://diavgeia.gov.gr/doc/ΨΤΡΖΟΡΗ9-2ΓΞ
proc:03db3ab854cf,50226,2020,1,ΩΘΨΘΟΡΗ9-1Σ8,2020-01-29,ΕΓΚΡΙΣΗ ΔΑΠΑΝΗΣ,Δέσμευση πίστωσης για την προμήθεια φωτοτυπιών,,,,,,,,https://diavgeia.gov.gr/doc/ΩΘΨΘΟΡΗ9-1Σ8
proc:15fd10036092,50226,2020,1,ΩΡΘΞΟΡΗ9-6ΔΨ,2020-01-29,ΕΓΚΡΙΣΗ ΔΑΠΑΝΗΣ,Έγκριση δαπάνης για την άμεση αντιμετώπιση έκτακτων αναγκών της Υπηρεσίας μας και δεν κατονομάζονται ειδικά,,,,,,,,https://diavgeia.gov.gr/doc/ΩΡΘΞΟΡΗ9-6ΔΨ
proc:640b1f4886ef,50226,2020,2,66ΖΦΟΡΗ9-7Θ4,2020-02-13,ΕΓΚΡΙΣΗ ΔΑΠΑΝΗΣ,Έγκριση διάθεσης πίστωσης για την διατήρηση του προγράμματος Νομοτέλεια,,,,,,,,https://diavgeia.gov.gr/doc/66ΖΦΟΡΗ9-7Θ4
proc:037eae147700,50226,2020,2,6ΔΡΛΟΡΗ9-ΔΙΛ,2020-02-13,ΕΓΚΡΙΣΗ ΔΑΠΑΝΗΣ,ΕΞΌΦΛΗΣΗ ΤΙΜΟΛΟΓΊΩΝ,,,,,,,,https://diavgeia.gov.gr/doc/6ΔΡΛΟΡΗ9-ΔΙΛ
proc:3faef6684467,50226,2020,2,9ΨΝΒΟΡΗ9-Ψ5Β,2020-02-13,ΕΓΚΡΙΣΗ ΔΑΠΑΝΗΣ,προμήθεια προγράμματος προστασίας των Η/Υ του ΛΤΦ από υιούς,,,,,,,,https://diavgeia.gov.gr/doc/9ΨΝΒΟΡΗ9-Ψ5Β
proc:c65bb94e2b15,50226,2020,2,Ψ96ΦΟΡΗ9-ΣΣΠ,2020-02-13,ΕΓΚΡΙΣΗ ΔΑΠΑΝΗΣ,Καταβολή στην ΡΑΛ το τέλος χρηματοδότησής της,,,,,,,,https://diavgeia.gov.gr/doc/Ψ96ΦΟΡΗ9-ΣΣΠ
proc:8085885c878b,50226,2020,2,ΨΗΨ0ΟΡΗ9-3ΙΚ,2020-02-13,ΕΓΚΡΙΣΗ ΔΑΠΑΝΗΣ,Προμήθεια λαμπτήρων led,,,,,,,,https://diavgeia.gov.gr/doc/ΨΗΨ0ΟΡΗ9-3ΙΚ
proc:0fa35e08568c,50226,2020,2,Ω7ΣΩΟΡΗ9-ΜΦ4,2020-02-13,ΕΓΚΡΙΣΗ ΔΑΠΑΝΗΣ,Προμήθεια υδρομέτρου για το Λ/Χ Στυλίδας.,,,,,,,,https://diavgeia.gov.gr/doc/Ω7ΣΩΟΡΗ9-ΜΦ4
proc:99d40233e3d8,50226,2020,3,6ΞΟΧΟΡΗ9-ΞΨΩ,1584316800000,ΑΝΑΘΕΣΗ ΕΡΓΩΝ / ΠΡΟΜΗΘΕΙΩΝ / ΥΠΗΡΕΣΙΩΝ / ΜΕΛΕΤΩΝ,Περί της απευθείας αναθέσεως στην εταιρεία ΠΑΝΑΓΙΩΤΟΠΟΥΛΟΣ Π.-ΚΑΛΤΣΟΥΛΑΣ Ι.-ΚΟΥΤΣΙΟΥΚΗΣ Ι. ΟΕ υπηρεσιών για την συντήρηση του συστήματος διαχείρισης της ποιότητας σύμφωνα με το πρότυπο ISO 9001:2015,248.0,detail:extraFieldValues.awardAmount.amount,tax:800396956,,800396956,100058408,92806,https://diavgeia.gov.gr/doc/6ΞΟΧΟΡΗ9-ΞΨΩ
proc:bcbac2095cc4,50226,2020,3,68ΨΧΟΡΗ9-ΖΓ4,2020-03-16,ΕΓΚΡΙΣΗ ΔΑΠΑΝΗΣ,περί εγκρίσεως της επιπλέον δαπάνης εγκαταστάσεως της γεννήτριας στο λιμένα Στυλίδας (εργασίες εκτός μελέτης-πιστοποιημένες από ΔΤΕ Περιφέρειας),,,,,,,,https://diavgeia.gov.gr/doc/68ΨΧΟΡΗ9-ΖΓ4
proc:029540cabe36,50226,2020,3,69ΔΕΟΡΗ9-Π1Α,2020-03-16,ΛΟΙΠΕΣ ΑΤΟΜΙΚΕΣ ΔΙΟΙΚΗΤΙΚΕΣ ΠΡΑΞΕΙΣ,"περί της συγκροτήσεως τριμελούς επιτροπής παραλαβής προμήθειας προϊόντων και παροχής υπηρεσιών του Λιμενικού Ταμείου Φθ/δας, ως και της παροχής υπηρεσιών φύλαξης του λιμένα Στυλίδας με βάση τις απαιτήσεις του κώδικα ασφαλείας ISPS και του κανονισμού (ΕΚ)725/2004) για την τριετία 2020-2023",,,,,,,,https://diavgeia.gov.gr/doc/69ΔΕΟΡΗ9-Π1Α
proc:43acf6a3b13d,50226,2020,3,9ΒΤΝΟΡΗ9-ΩΩΠ,2020-03-16,ΕΓΚΡΙΣΗ ΔΑΠΑΝΗΣ,περί της αποδόσεως στο πρακτορείο Νικολάου Περλεπέ των δικαιωμάτων του επί των τελών επιβατών και οχημάτων για το έτος 2019,,,,,,,,https://diavgeia.gov.gr/doc/9ΒΤΝΟΡΗ9-ΩΩΠ
proc:8396a1fcd6fd,50226,2020,3,Ψ7ΑΖΟΡΗ9-0ΞΒ,2020-03-16,ΕΓΚΡΙΣΗ ΔΑΠΑΝΗΣ,περί καταβολής στο ΜΤΝ του ποσοστού του,,,,,,,,https://diavgeia.gov.gr/doc/Ψ7ΑΖΟΡΗ9-0ΞΒ
proc:a10f7a4ffc6d,50226,2020,3,ΨΘΨΤΟΡΗ9-Ω45,2020-03-16,ΕΓΚΡΙΣΗ ΔΑΠΑΝΗΣ,εξόφληση τιμολογίων,,,,,,,,https://diavgeia.gov.gr/doc/ΨΘΨΤΟΡΗ9-Ω45
proc:740a7e816fc5,50226,2020,4,6ΕΗΗΟΡΗ9-ΨΦΤ,2020-04-13,ΛΟΙΠΕΣ ΑΤΟΜΙΚΕΣ ΔΙΟΙΚΗΤΙΚΕΣ ΠΡΑΞΕΙΣ,περί τροποποιήσεως (2ης παράτασης) της σύμβασης παροχής υπηρεσιών φύλαξης λιμένα Στυλίδας,,,,,,,,https://diavgeia.gov.gr/doc/6ΕΗΗΟΡΗ9-ΨΦΤ
proc:dfbfe9c21e95,50226,2020,5,9ΘΡ3ΟΡΗ9-6ΕΟ,1589328000000,ΑΝΑΘΕΣΗ ΕΡΓΩΝ / ΠΡΟΜΗΘΕΙΩΝ / ΥΠΗΡΕΣΙΩΝ / ΜΕΛΕΤΩΝ,περί της ανάθεσης των εργασιών προμήθειας και τοποθέτησης οικίσκου προστασίας του ηλεκτροπαραγωγού ζεύγους στο λιμένα Στυλίδας,2175.0,detail:extraFieldValues.awardAmount.amount,tax:044396534,,044396534,100058408,92806,https://diavgeia.gov.gr/doc/9ΘΡ3ΟΡΗ9-6ΕΟ
proc:4192544308f6,50226,2020,5,60Ξ3ΟΡΗ9-ΨΧΞ,2020-05-13,ΕΓΚΡΙΣΗ ΔΑΠΑΝΗΣ,Εκτέλεση εργασιών συντήρησης πρασίνου λιμένα Στυλίδας,,,,,,,,https://diavgeia.gov.gr/doc/60Ξ3ΟΡΗ9-ΨΧΞ
proc:ed5ac76e1f18,50226,2020,5,69ΑΩΟΡΗ9-ΕΗΡ,2020-05-13,ΕΓΚΡΙΣΗ ΔΑΠΑΝΗΣ,περί της υπογραφής προγραμματικών συμβάσεων αποκομιδής απορριμμάτων και καθαριότητας με το Δήμο Λοκρών,,,,,,,,https://diavgeia.gov.gr/doc/69ΑΩΟΡΗ9-ΕΗΡ
proc:4d3f8412349c,50226,2020,5,6ΗΧΖΟΡΗ9-7ΛΖ,2020-05-13,ΕΓΚΡΙΣΗ ΔΑΠΑΝΗΣ,Προμήθεια λαμπτήρων led για το Λιμεναρχείο Γλύφας,,,,,,,,https://diavgeia.gov.gr/doc/6ΗΧΖΟΡΗ9-7ΛΖ
proc:8f5d633e145e,50226,2020,5,6ΡΜ5ΟΡΗ9-1ΝΔ,2020-05-13,ΕΓΚΡΙΣΗ ΔΑΠΑΝΗΣ,Εκτέλεση εργασιών συντήρησης πρασίνου στις χερσαίες ζώνες λιμένων του Δήμου Λοκρών,,,,,,,,https://diavgeia.gov.gr/doc/6ΡΜ5ΟΡΗ9-1ΝΔ
proc:0ce813e462fe,50226,2020,5,96Β5ΟΡΗ9-8Γ2,2020-05-13,ΕΓΚΡΙΣΗ ΔΑΠΑΝΗΣ,"έγκριση πίστωσης της αναθέσεως των εργασιών που αφορούν στην παροχή υπηρεσιών ασφαλείας (τηλεπιτήρησης) της λιμενικής εγκατάστασης Στυλίδας για διάστημα 12 μηνών, σύμφωνα με τις διατάξεις του κώδικα ασφαλείας ISPS",,,,,,,,https://diavgeia.gov.gr/doc/96Β5ΟΡΗ9-8Γ2
proc:2f2e351f373a,50226,2020,5,97Ε6ΟΡΗ9-ΦΤΞ,2020-05-13,ΕΓΚΡΙΣΗ ΔΑΠΑΝΗΣ,περί της υπογραφής προγραμματικών συμβάσεων αποκομιδής απορριμμάτων και καθαριότητας με το Δήμο Στυλίδας,,,,,,,,https://diavgeia.gov.gr/doc/97Ε6ΟΡΗ9-ΦΤΞ
proc:2757d2f09950,50226,2020,5,9ΕΣΩΟΡΗ9-ΔΑΔ,2020-05-13,ΕΓΚΡΙΣΗ ΔΑΠΑΝΗΣ,καταβολή στο ΜΤΝ του ποσοστού του,,,,,,,,https://diavgeia.gov.gr/doc/9ΕΣΩΟΡΗ9-ΔΑΔ
proc:9e5d2dd1286d,50226,2020,5,ΨΚ9ΨΟΡΗ9-Ξ2Ξ,2020-05-13,ΕΓΚΡΙΣΗ ΔΑΠΑΝΗΣ,περί εγκρίσεως δαπάνης προμήθειας ανταλλακτικών για την περιοδική συντήρηση του περιπολικού σκάφους του Λ/Χ Στυλίδας,,,,,,,,https://diavgeia.gov.gr/doc/ΨΚ9ΨΟΡΗ9-Ξ2Ξ
proc:d9bd76290b64,50226,2020,5,ΨΦΓΜΟΡΗ9-3ΛΧ,2020-05-13,ΕΓΚΡΙΣΗ ΔΑΠΑΝΗΣ,περί προμήθειας ειδών αντιμετώπισης του κορωνοϊού COVID-19,,,,,,,,https://diavgeia.gov.gr/doc/ΨΦΓΜΟΡΗ9-3ΛΧ
proc:abe3c55f79d0,50226,2020,5,ΨΨ9ΗΟΡΗ9-27Ο,2020-05-13,ΕΓΚΡΙΣΗ ΔΑΠΑΝΗΣ,Έγκριση δαπάνης για την άμεση αντιμετώπιση έκτακτων βλαβών που δεν κατονομάζονται ειδικά και που αφορούν τους λιμένες και αλιευτικά καταφύγια Δήμου Λοκρών,,,,,,,,https://diavgeia.gov.gr/doc/ΨΨ9ΗΟΡΗ9-27Ο
proc:2e71e24fd47d,50226,2020,5,ΨΟ14ΟΡΗ9-ΖΙΑ,2020-05-15,ΕΓΚΡΙΣΗ ΔΑΠΑΝΗΣ,εξόφληση τιμολογίων,,,,,,,,https://diavgeia.gov.gr/doc/ΨΟ14ΟΡΗ9-ΖΙΑ
proc:0e67c1ad4e16,50226,2020,6,6ΧΦΝΟΡΗ9-ΦΒ1,2020-06-03,ΕΓΚΡΙΣΗ ΔΑΠΑΝΗΣ,ΧΡΗΜΑΤΙΚΟ ΕΝΤΑΛΜΑ ΠΛΗΡΩΜΗΣ,,,,,,,,https://diavgeia.gov.gr/doc/6ΧΦΝΟΡΗ9-ΦΒ1
proc:ba12774e80f3,50226,2020,6,ΩΙΦ9ΟΡΗ9-Φ3Π,2020-06-03,ΕΓΚΡΙΣΗ ΔΑΠΑΝΗΣ,περί του λιμένα Στυλίδας,,,,,,,,https://diavgeia.gov.gr/doc/ΩΙΦ9ΟΡΗ9-Φ3Π
proc:07e5efaad814,50226,2020,6,ΩΤΟΘΟΡΗ9-6Α6,2020-06-03,ΕΓΚΡΙΣΗ ΔΑΠΑΝΗΣ,εξόφληση τιμολογίων,,,,,,,,https://diavgeia.gov.gr/doc/ΩΤΟΘΟΡΗ9-6Α6
proc:28a7826b8e62,50226,2020,6,ΩΕ8ΩΟΡΗ9-ΟΛ9,2020-06-11,ΕΓΚΡΙΣΗ ΔΑΠΑΝΗΣ,Έγκριση υπερωριακής εργασίας της υπαλλήλου του Λιμενικού Ταμείου Φθ/δας για το Β΄ εξάμηνο 2020 έτους.,,,,,,,,https://diavgeia.gov.gr/doc/ΩΕ8ΩΟΡΗ9-ΟΛ9
proc:17de3949c76a,50226,2020,6,Ψ3Ω3ΟΡΗ9-ΧΙΥ,2020-06-23,ΕΓΚΡΙΣΗ ΔΑΠΑΝΗΣ,εξόφληση τιμολογίων,,,,,,,,https://diavgeia.gov.gr/doc/Ψ3Ω3ΟΡΗ9-ΧΙΥ
proc:1354246a492d,50226,2020,6,ΩΘΣΗΟΡΗ9-Ι98,2020-06-23,ΕΓΚΡΙΣΗ ΔΑΠΑΝΗΣ,Έγκριση δαπάνης κατασκευής ντουλάπας στο γραφείο του Προέδρου,,,,,,,,https://diavgeia.gov.gr/doc/ΩΘΣΗΟΡΗ9-Ι98
proc:074e1355b666,50226,2020,6,ΩΜΔΘΟΡΗ9-3ΨΙ,2020-06-23,ΕΓΚΡΙΣΗ ΔΑΠΑΝΗΣ,Έγκριση δαπάνης αντικαταστάσεως ειδών υγιεινής τουαλετών λιμένα Σκάλας Αταλάντης και προμήθειας μπεκ ποτίσματος,,,,,,,,https://diavgeia.gov.gr/doc/ΩΜΔΘΟΡΗ9-3ΨΙ
proc:d58e640cd1a8,50226,2020,6,ΩΨΔ1ΟΡΗ9-764,2020-06-23,ΕΓΚΡΙΣΗ ΔΑΠΑΝΗΣ,περί εγκρίσεως δαπάνης συμμετοχής σε σεμινάριο,,,,,,,,https://diavgeia.gov.gr/doc/ΩΨΔ1ΟΡΗ9-764
proc:27bcd80f777e,50226,2020,6,ΩΨΛΠΟΡΗ9-7ΞΠ,2020-06-23,ΕΓΚΡΙΣΗ ΔΑΠΑΝΗΣ,Έγκριση δαπάνης για την προμήθεια υλικού για τηλεκπαίδευση-τηλεδιάσκεψη,,,,,,,,https://diavgeia.gov.gr/doc/ΩΨΛΠΟΡΗ9-7ΞΠ
proc:ef66e2805fd2,50226,2020,7,ΨΨΗ9ΟΡΗ9-69Ο,1594598400000,ΑΝΑΘΕΣΗ ΕΡΓΩΝ / ΠΡΟΜΗΘΕΙΩΝ / ΥΠΗΡΕΣΙΩΝ / ΜΕΛΕΤΩΝ,ανάθεση των εργασιών κατασκευής ντουλάπας αρχειοθέτησης,1100.0,detail:extraFieldValues.awardAmount.amount,tax:026707321,,026707321,100058408,92806,https://diavgeia.gov.gr/doc/ΨΨΗ9ΟΡΗ9-69Ο
proc:58c5a395b94e,50226,2020,7,65Λ3ΟΡΗ9-Χ03,2020-07-13,ΛΟΙΠΕΣ ΑΤΟΜΙΚΕΣ ΔΙΟΙΚΗΤΙΚΕΣ ΠΡΑΞΕΙΣ,έγκριση των όρων διακήρυξης για την ανάθεση των εργασιών φύλαξης της λιμενικής εγκατάστασης Στυλίδας σύμφωνα με τις απαιτήσεις του κώδικα ISPS,,,,,,,,https://diavgeia.gov.gr/doc/65Λ3ΟΡΗ9-Χ03
proc:9431ef5a65ca,50226,2020,7,6Σ8ΒΟΡΗ9-54Ω,2020-07-13,ΕΓΚΡΙΣΗ ΔΑΠΑΝΗΣ,εξόφληση τιμολογίων,,,,,,,,https://diavgeia.gov.gr/doc/6Σ8ΒΟΡΗ9-54Ω
proc:302a25943d0e,50226,2020,7,6ΩΗΥΟΡΗ9-Σ1Ζ,2020-07-13,ΕΓΚΡΙΣΗ ΔΑΠΑΝΗΣ,"Έγκριση δαπάνης για την αντιμετώπιση βλαβών στα αλιευτικά καταφύγια Αγίου Ιωάννη Θεολόγου, Σκάλας Αταλάντης και Λιβανατών",,,,,,,,https://diavgeia.gov.gr/doc/6ΩΗΥΟΡΗ9-Σ1Ζ
proc:85cadcdc2aaf,50226,2020,7,Ψ8Θ0ΟΡΗ9-ΦΨΖ,2020-07-13,ΕΓΚΡΙΣΗ ΔΑΠΑΝΗΣ,Έγκριση δαπάνης για την άμεση αντιμετώπιση ηλεκτρολογικής βλάβης στο λιμένα Αρκίτσας,,,,,,,,https://diavgeia.gov.gr/doc/Ψ8Θ0ΟΡΗ9-ΦΨΖ
proc:764d7a90037a,50226,2020,7,ΨΖΣΛΟΡΗ9-ΒΛΝ,2020-07-13,ΕΓΚΡΙΣΗ ΔΑΠΑΝΗΣ,καταβολή χαρτοσήμου και ΟΓΑ χαρτοσήμου παραχωρήσεων – δήλωση φόρου εισοδήματος του Λ.Τ.Φθιώτιδας,,,,,,,,https://diavgeia.gov.gr/doc/ΨΖΣΛΟΡΗ9-ΒΛΝ
proc:8b82b859ab82,50226,2020,7,ΨΖΥΕΟΡΗ9-ΟΡ2,2020-07-13,ΕΓΚΡΙΣΗ ΔΑΠΑΝΗΣ,έγκριση δαπάνης προμήθειας πινακίδων και τροχαίου υλικού για τις ανάγκες των λιμένων αρμοδιότητας του Λιμενικού Ταμείου Φθιώτιδας,,,,,,,,https://diavgeia.gov.gr/doc/ΨΖΥΕΟΡΗ9-ΟΡ2
proc:dcf376f4c86b,50226,2020,7,ΩΕΚΞΟΡΗ9-4Ξ5,2020-07-13,ΕΓΚΡΙΣΗ ΔΑΠΑΝΗΣ,περί εγκρίσεως δαπάνης μετακίνηση του Προέδρου στο λιμένα Σκάλας Αταλάντης,,,,,,,,https://diavgeia.gov.gr/doc/ΩΕΚΞΟΡΗ9-4Ξ5
proc:17c6138cb68d,50226,2020,7,6Ν1ΠΟΡΗ9-ΘΟΡ,2020-07-27,ΕΓΚΡΙΣΗ ΔΑΠΑΝΗΣ,ΧΡΗΜΑΤΙΚΟ ΕΝΤΑΛΜΑ ΠΛΗΡΩΜΗΣ,,,,,,,,https://diavgeia.gov.gr/doc/6Ν1ΠΟΡΗ9-ΘΟΡ
proc:9ba96977ef03,50226,2020,8,Ψ8Ο6ΟΡΗ9-ΚΕΡ,1596758400000,ΑΝΑΘΕΣΗ ΕΡΓΩΝ / ΠΡΟΜΗΘΕΙΩΝ / ΥΠΗΡΕΣΙΩΝ / ΜΕΛΕΤΩΝ,"περί της ανάθεσης των εργασιών επισκευής των δικτύων ηλεκτροφωτισμού λιμένων Σκάλας Αταλάντης, Λιβνατών και Αγίου Ιωάννη Θεολόγου",1650.0,detail:extraFieldValues.awardAmount.amount,tax:044722497,,044722497,100058408,92806,https://diavgeia.gov.gr/doc/Ψ8Ο6ΟΡΗ9-ΚΕΡ
proc:8fb8a214adc2,50226,2020,8,663ΒΟΡΗ9-ΞΔΧ,2020-08-07,ΕΓΚΡΙΣΗ ΔΑΠΑΝΗΣ,εξόφληση τιμολογίων,,,,,,,,https://diavgeia.gov.gr/doc/663ΒΟΡΗ9-ΞΔΧ
proc:d9d39cd60850,50226,2020,8,67ΣΛΟΡΗ9-2Δ9,2020-08-07,ΕΓΚΡΙΣΗ ΔΑΠΑΝΗΣ,Περί προμήθειας ειδών υγιεινής και μπεκ για το λιμένα Σκάλας Αταλάντης,,,,,,,,https://diavgeia.gov.gr/doc/67ΣΛΟΡΗ9-2Δ9
proc:513b783b3362,50226,2020,8,6ΜΛ3ΟΡΗ9-ΙΡ1,2020-08-07,ΕΓΚΡΙΣΗ ΔΑΠΑΝΗΣ,συμμετοχή σε σεμινάριο,,,,,,,,https://diavgeia.gov.gr/doc/6ΜΛ3ΟΡΗ9-ΙΡ1
proc:a1152e2425c8,50226,2020,8,6ΞΦ9ΟΡΗ9-Ζ7Ρ,2020-08-07,ΛΟΙΠΕΣ ΑΤΟΜΙΚΕΣ ΔΙΟΙΚΗΤΙΚΕΣ ΠΡΑΞΕΙΣ,"Έγκρισης 1ου ΑΠΕ σε ισοζύγιο του έργου «κατασκευή θέσης ανέλκυσης καθέλκυσης (γλίστρας) σκαφών Γλύφας Φθιώτιδας», προϋπολογισμού 16.000,00 ευρώ",16000.0,subject:trusted_budget_phrase,,,,,,https://diavgeia.gov.gr/doc/6ΞΦ9ΟΡΗ9-Ζ7Ρ
proc:c8f2a2bfefce,50226,2020,8,6ΥΨΣΟΡΗ9-21Δ,2020-08-07,ΕΓΚΡΙΣΗ ΔΑΠΑΝΗΣ,καταβολή στο ΜΤΝ του ποσοστού του,,,,,,,,https://diavgeia.gov.gr/doc/6ΥΨΣΟΡΗ9-21Δ
proc:da767ff3db6f,50226,2020,8,974ΤΟΡΗ9-ΧΚΟ,2020-08-07,ΕΓΚΡΙΣΗ ΔΑΠΑΝΗΣ,περί της επιστροφής ποσού στον Τσανσίζη Χρυσόστομο,,,,,,,,https://diavgeia.gov.gr/doc/974ΤΟΡΗ9-ΧΚΟ
proc:2fc0ee3de710,50226,2020,8,Ψ7ΥΕΟΡΗ9-ΓΤΔ,2020-08-07,ΕΓΚΡΙΣΗ ΔΑΠΑΝΗΣ,περί αποκαταστάσεως φθορών πεζοδρομίου και λοιπών εγκαταστάσεων λιμένα Αρκίτσας,,,,,,,,https://diavgeia.gov.gr/doc/Ψ7ΥΕΟΡΗ9-ΓΤΔ
proc:dc6b06bf6232,50226,2020,8,Ω31ΨΟΡΗ9-ΒΗ1,2020-08-07,ΛΟΙΠΕΣ ΑΤΟΜΙΚΕΣ ΔΙΟΙΚΗΤΙΚΕΣ ΠΡΑΞΕΙΣ,περί τροποποιήσεως (3ης παράτασης) της σύμβασης παροχής υπηρεσιών φύλαξης λιμένα Στυλίδας,,,,,,,,https://diavgeia.gov.gr/doc/Ω31ΨΟΡΗ9-ΒΗ1
proc:446f9421d82f,50226,2020,9,68Π1ΟΡΗ9-ΝΒΜ,1599436800000,ΑΝΑΘΕΣΗ ΕΡΓΩΝ / ΠΡΟΜΗΘΕΙΩΝ / ΥΠΗΡΕΣΙΩΝ / ΜΕΛΕΤΩΝ,ανάθεση των εργασιών επισκευής-συντήρησης των θυρών του λιμένα Στυλίδας,4823.6,detail:extraFieldValues.awardAmount.amount,tax:011278629,,011278629,100058408,92806,https://diavgeia.gov.gr/doc/68Π1ΟΡΗ9-ΝΒΜ
proc:29d33436545f,50226,2020,9,68ΥΑΟΡΗ9-0Μ7,2020-09-07,ΕΓΚΡΙΣΗ ΔΑΠΑΝΗΣ,περί γκρίσεως δαπάνης προμήθειας UPS για το σύστημα καταγραφής λιμένα Στυλίδας ως και των Η/Υ γραφείου ΛΤΦ,,,,,,,,https://diavgeia.gov.gr/doc/68ΥΑΟΡΗ9-0Μ7
proc:b85f8196da8e,50226,2020,9,6ΘΧΣΟΡΗ9-7ΧΡ,2020-09-07,ΕΓΚΡΙΣΗ ΔΑΠΑΝΗΣ,περί εγκρίσεως δαπάνης συντήρησης του domain name της ιστοσελίδας  του Λιμενικού Ταμείου Φθιώτιδας,,,,,,,,https://diavgeia.gov.gr/doc/6ΘΧΣΟΡΗ9-7ΧΡ
proc:3391fe4f1126,50226,2020,9,Ψ3ΩΑΟΡΗ9-833,2020-09-07,ΕΓΚΡΙΣΗ ΔΑΠΑΝΗΣ,Περί γκρίσεως δαπάνης προμήθειας μπαταρίας για το περιπολικό όχημα του Β΄ Λ/Τ Αγίου Κωνσταντίνου,,,,,,,,https://diavgeia.gov.gr/doc/Ψ3ΩΑΟΡΗ9-833
proc:4f5169fc4b6f,50226,2020,9,ΨΑ2ΔΟΡΗ9-ΓΙ7,2020-09-07,ΕΓΚΡΙΣΗ ΔΑΠΑΝΗΣ,Περί εγκρίσεως δαπάνης προμήθειας ελαστικών για το περιπολικό όχημα του Γ΄ Λ/Τ Σκάλας Αταλάντης,,,,,,,,https://diavgeia.gov.gr/doc/ΨΑ2ΔΟΡΗ9-ΓΙ7
proc:cd50a30de157,50226,2020,9,ΩΚ27ΟΡΗ9-ΒΔΑ,2020-09-07,ΕΓΚΡΙΣΗ ΔΑΠΑΝΗΣ,περί εγκρίσεως δαπάνης προμήθειας UPS για το σύστημα καταγραφής λιμένα Στυλίδας ως και των Η/Υ γραφείου ΛΤΦ,,,,,,,,https://diavgeia.gov.gr/doc/ΩΚ27ΟΡΗ9-ΒΔΑ
proc:e3b46a0a9cb8,50226,2020,9,ΩΣΧ9ΟΡΗ9-ΜΔΤ,2020-09-07,ΕΓΚΡΙΣΗ ΔΑΠΑΝΗΣ,εξόφληση τιμολογίων,,,,,,,,https://diavgeia.gov.gr/doc/ΩΣΧ9ΟΡΗ9-ΜΔΤ
proc:57666234b612,50226,2020,9,63Θ7ΟΡΗ9-58Ο,2020-09-11,ΕΓΚΡΙΣΗ ΔΑΠΑΝΗΣ,Περί έγκρισης διάθεσης πίστωσης προμήθειας γραφικής ύλης,,,,,,,,https://diavgeia.gov.gr/doc/63Θ7ΟΡΗ9-58Ο
proc:5e4229711b4f,50226,2020,9,991ΝΟΡΗ9-ΖΨΠ,2020-09-11,ΕΓΚΡΙΣΗ ΔΑΠΑΝΗΣ,περί εγκρίσεως δαπάνης για την μυοκτονία στους χώρους του Γ΄Λ/Τ Σκάλας Αταλάντης,,,,,,,,https://diavgeia.gov.gr/doc/991ΝΟΡΗ9-ΖΨΠ
proc:2035b2098a53,50226,2020,9,9ΥΦΠΟΡΗ9-9ΟΤ,2020-09-11,ΕΓΚΡΙΣΗ ΔΑΠΑΝΗΣ,εξόφληση τιμολογίου,,,,,,,,https://diavgeia.gov.gr/doc/9ΥΦΠΟΡΗ9-9ΟΤ
proc:004cd62109b2,50226,2020,9,9Ω23ΟΡΗ9-3ΨΝ,2020-09-11,ΕΓΚΡΙΣΗ ΔΑΠΑΝΗΣ,συζητήσεως επί εγγράφου του Τελωνείου Στυλίδας,,,,,,,,https://diavgeia.gov.gr/doc/9Ω23ΟΡΗ9-3ΨΝ
proc:2e8513e47597,50226,2020,9,Ψ4Ε1ΟΡΗ9-Σ7Ι,2020-09-11,ΕΓΚΡΙΣΗ ΔΑΠΑΝΗΣ,περί εγκρίσεως δαπάνης μετακίνηση του Προέδρου και υπαλλήλου Λ.Τ.Φθιώτιδας ως και μελών της Λιμενικής Επιτροπής στους λιμένες και αλιευτικά καταφύγια αρμοδιότητάς του,,,,,,,,https://diavgeia.gov.gr/doc/Ψ4Ε1ΟΡΗ9-Σ7Ι
proc:4dfcf4e82492,50226,2020,9,Ψ9ΣΟΟΡΗ9-ΜΗΘ,2020-09-11,ΕΓΚΡΙΣΗ ΔΑΠΑΝΗΣ,"Περί έγκρισης διάθεσης πίστωσης προμήθειας μπλοκ είσπραξης τελών προσόρμισης κ.λ.π. πλοίων έτους 2021, μπλοκ παραβάσεων ΚΟΚ κ.λ.π. μπλοκ",,,,,,,,https://diavgeia.gov.gr/doc/Ψ9ΣΟΟΡΗ9-ΜΗΘ
proc:2decbb0ea6f6,50226,2020,9,Ω3Ψ3ΟΡΗ9-ΧΣΓ,2020-09-11,ΕΓΚΡΙΣΗ ΔΑΠΑΝΗΣ,Περί έγκρισης διάθεσης πίστωσης προμήθειας σημαιών για τις ανάγκες των λιμένων αρμοδιότητας Λ.Τ.Φθιώτιδας,,,,,,,,https://diavgeia.gov.gr/doc/Ω3Ψ3ΟΡΗ9-ΧΣΓ
proc:c210ae30742a,50226,2020,9,ΩΥΖ6ΟΡΗ9-ΞΤΑ,2020-09-11,ΕΓΚΡΙΣΗ ΔΑΠΑΝΗΣ,περί εγκρίσεως δαπάνης μετακίνηση του Προέδρου και της υπαλλήλου του Λιμενικού Ταμείου Φθιώτιδας στο λιμένα Γλύφας,,,,,,,,https://diavgeia.gov.gr/doc/ΩΥΖ6ΟΡΗ9-ΞΤΑ
