procurement_key,org,year,month,ada,issue_date,decision_type,subject,amount,amount_source,supplier_key,supplier_name,supplier_tax_id,signer,unit,url
proc:1bcc45879977,50226,2024,2,9Β0ΦΟΡΗ9-61Ι,2024-02-01,ΕΓΚΡΙΣΗ ΔΑΠΑΝΗΣ,Έγκριση δαπάνης χρήσεως μηχανημάτων για την καθαριότητα και την αλλαγή λαμπτήρων  στο λιμένα Γλύφας,,,,,,,,https://diavgeia.gov.gr/doc/9Β0ΦΟΡΗ9-61Ι
proc:327de654aeb6,50226,2024,2,Ρ1Κ1ΟΡΗ9-Ν2Ζ,2024-02-01,ΕΓΚΡΙΣΗ ΔΑΠΑΝΗΣ,Έγκριση δαπάνης για την συμβουλευτική στήριξη του φορέα,,,,,,,,https://diavgeia.gov.gr/doc/Ρ1Κ1ΟΡΗ9-Ν2Ζ
proc:d6df73e4d261,50226,2024,2,ΡΠ3ΞΟΡΗ9-Ψ6Π,2024-02-01,ΕΓΚΡΙΣΗ ΔΑΠΑΝΗΣ,Έγκριση δαπάνης εκτέλεσης εργασιών χρωματισμού των γραφείων του ΛΤΦ,,,,,,,,https://diavgeia.gov.gr/doc/ΡΠ3ΞΟΡΗ9-Ψ6Π
proc:885821ca1eba,50226,2024,2,ΨΘΠ2ΟΡΗ9-ΒΧΚ,2024-02-01,ΕΓΚΡΙΣΗ ΔΑΠΑΝΗΣ,Έγκριση δαπάνης καθαρισμού άπαξ του λιμένα Γλύφας,,,,,,,,https://diavgeia.gov.gr/doc/ΨΘΠ2ΟΡΗ9-ΒΧΚ
proc:dfaacb936b9d,50226,2024,2,ΨΚΒΘΟΡΗ9-01Τ,2024-02-01,ΕΓΚΡΙΣΗ ΔΑΠΑΝΗΣ,Έγκριση δαπάνης για την ανάθεση των εργασιών καταμέτρησης και καταγρα-φής των ελλιμενιζόμενων σκαφών σε ελεύθερο επαγγελματία,,,,,,,,https://diavgeia.gov.gr/doc/ΨΚΒΘΟΡΗ9-01Τ
proc:8050645d9f90,50226,2024,2,ΨΡΗ3ΟΡΗ9-ΝΡΝ,2024-02-07,ΕΓΚΡΙΣΗ ΔΑΠΑΝΗΣ,εξόφληση τιμολογίων,,,,,,,,https://diavgeia.gov.gr/doc/ΨΡΗ3ΟΡΗ9-ΝΡΝ
proc:73d05ae5be2d,50226,2024,2,9062ΟΡΗ9-5ΝΟ,2024-02-08,ΕΓΚΡΙΣΗ ΔΑΠΑΝΗΣ,περί εγκρίσεως της διάθεσης πίστωσης για την συντήρηση πρασίνου στις χερσαίες ζώνες λιμένων του Δήμου Λοκρών,,,,,,,,https://diavgeia.gov.gr/doc/9062ΟΡΗ9-5ΝΟ
proc:6fb629624d14,50226,2024,2,639ΤΟΡΗ9-5ΓΞ,2024-02-12,ΕΓΚΡΙΣΗ ΔΑΠΑΝΗΣ,"περί της εγκρίσεως σύναψης προγραμματικής σύμβασης καθαριότητας, αποκομιδής απορριμμάτων και λοιπών εργασιών με το Δήμο Λοκρών",,,,,,,,https://diavgeia.gov.gr/doc/639ΤΟΡΗ9-5ΓΞ
proc:d7dd2da206a8,50226,2024,2,Ψ168ΟΡΗ9-ΩΜΖ,2024-02-22,ΕΓΚΡΙΣΗ ΔΑΠΑΝΗΣ,Καταβολή της 1ης εντολής πληρωμής και πιστοποίησης της μελέτης «Μελέτη επέκτασης αλιευτικού καταφυγίου Αγίου Κωνσταντίνου Φθιώτιδας»,,,,,,,,https://diavgeia.gov.gr/doc/Ψ168ΟΡΗ9-ΩΜΖ
proc:14ba80cf2f0f,50226,2024,2,98ΤΓΟΡΗ9-ΨΘ1,2024-02-27,ΕΓΚΡΙΣΗ ΔΑΠΑΝΗΣ,προμήθεια χρωμάτων διαγράμμισης,,,,,,,,https://diavgeia.gov.gr/doc/98ΤΓΟΡΗ9-ΨΘ1
proc:300c1039a097,50226,2024,2,9Π5ΥΟΡΗ9-2ΓΗ,2024-02-27,ΕΓΚΡΙΣΗ ΔΑΠΑΝΗΣ,Έγκριση δαπάνης εκτέλεσης εργασιών αποκατάστασης/συντήρησης της χερσαίας ζώνης λιμένα Σκάλας Αταλάντης,,,,,,,,https://diavgeia.gov.gr/doc/9Π5ΥΟΡΗ9-2ΓΗ
proc:b47772c4f475,50226,2024,2,9ΦΘΛΟΡΗ9-0ΕΣ,2024-02-27,ΕΓΚΡΙΣΗ ΔΑΠΑΝΗΣ,περί εγκρίσεως  δαπάνης ηλεκτρολογικών εργασιών λιμένα Στυλίδας,,,,,,,,https://diavgeia.gov.gr/doc/9ΦΘΛΟΡΗ9-0ΕΣ
proc:ee5b43678d5a,50226,2024,2,Ψ1ΨΘΟΡΗ9-ΘΔ1,2024-02-27,ΕΓΚΡΙΣΗ ΔΑΠΑΝΗΣ,Έγκριση δαπάνης έκδοσης Υπεύθυνης Δήλωσης Ηλεκτρολόγου Εγκαταστάτη.,,,,,,,,https://diavgeia.gov.gr/doc/Ψ1ΨΘΟΡΗ9-ΘΔ1
proc:1db0ecbbfbb8,50226,2024,2,Ψ33ΛΟΡΗ9-ΖΚ4,2024-02-27,ΕΓΚΡΙΣΗ ΔΑΠΑΝΗΣ,Έγκριση δαπάνης προμήθειας φωτιστικών σωμάτων led,,,,,,,,https://diavgeia.gov.gr/doc/Ψ33ΛΟΡΗ9-ΖΚ4
proc:ded74b2a2aed,50226,2024,2,ΨΘΔΩΟΡΗ9-9ΟΙ,2024-02-27,ΕΓΚΡΙΣΗ ΔΑΠΑΝΗΣ,Έγκριση δαπάνης εκτέλεσης εργασιών αποκατάστασης/συντήρησης της χερσαίας ζώνης λιμένα Αρκίτσας.,,,,,,,,https://diavgeia.gov.gr/doc/ΨΘΔΩΟΡΗ9-9ΟΙ
proc:e96d4a088629,50226,2024,2,68ΚΝΟΡΗ9-Ν24,2024-02-29,ΕΓΚΡΙΣΗ ΔΑΠΑΝΗΣ,περί εγκρίσεως της επιστροφής χρημάτων,,,,,,,,https://diavgeia.gov.gr/doc/68ΚΝΟΡΗ9-Ν24
proc:ae81edd95286,50226,2024,3,ΨΥΛΞΟΡΗ9-2ΦΘ,2024-03-01,ΕΓΚΡΙΣΗ ΔΑΠΑΝΗΣ,περί εγκρίσεως δαπάνης προμήθειας και εγκατάστασης προγράμματος προστασίας των Η/Υ του ΛΤΦ από υιούς,,,,,,,,https://diavgeia.gov.gr/doc/ΨΥΛΞΟΡΗ9-2ΦΘ
proc:41e9be8388af,50226,2024,3,ΨΒΖΤΟΡΗ9-2ΞΝ,2024-03-06,ΕΓΚΡΙΣΗ ΔΑΠΑΝΗΣ,ΕΞΟΦΛΗΣΗ ΤΙΜΟΛΟΓΙΩΝ,,,,,,,,https://diavgeia.gov.gr/doc/ΨΒΖΤΟΡΗ9-2ΞΝ
proc:fa894cba0bd1,50226,2024,3,9ΘΗ2ΟΡΗ9-ΦΝ4,2024-03-12,ΕΓΚΡΙΣΗ ΔΑΠΑΝΗΣ,Έγκριση δαπάνης εκσυγχρονισμού site του Λ.Τ.Φτθιώτιδας,,,,,,,,https://diavgeia.gov.gr/doc/9ΘΗ2ΟΡΗ9-ΦΝ4
proc:d5c2bf012b0f,50226,2024,3,69Μ9ΟΡΗ9-ΥΨΧ,2024-03-29,ΕΓΚΡΙΣΗ ΔΑΠΑΝΗΣ,"περί εγκρίσεως δαπάνης επισκευής των πλωτών και χερσαίων μέσων των Λιμενικών Αρχών,  ως και την προμήθεια των αντίστοιχων ανταλλακτικών",,,,,,,,https://diavgeia.gov.gr/doc/69Μ9ΟΡΗ9-ΥΨΧ
proc:ab464b62515f,50226,2024,3,9ΑΗΔΟΡΗ9-ΜΓ7,2024-03-29,ΕΓΚΡΙΣΗ ΔΑΠΑΝΗΣ,περί εγκρισης δαπάνης σύνταξης μελέτης κυκλοφοριακών ρυθμίσεων εντός χερσαίας ζώνης Λιμένα Γλύφας,,,,,,,,https://diavgeia.gov.gr/doc/9ΑΗΔΟΡΗ9-ΜΓ7
proc:5fc63ace5021,50226,2024,3,9ΖΧΛΟΡΗ9-ΝΥΑ,2024-03-29,ΕΓΚΡΙΣΗ ΔΑΠΑΝΗΣ,εξόφληση τιμολογίων,,,,,,,,https://diavgeia.gov.gr/doc/9ΖΧΛΟΡΗ9-ΝΥΑ
proc:7f9e3f122aae,50226,2024,3,9ΛΨΨΟΡΗ9-Θ12,2024-03-29,ΕΓΚΡΙΣΗ ΔΑΠΑΝΗΣ,έγκριση δαπάνης εργασίας τοπογράφου μηχανικού για τον έλεγχο των παραχωρήσεων.,,,,,,,,https://diavgeia.gov.gr/doc/9ΛΨΨΟΡΗ9-Θ12
proc:9a858bd9adab,50226,2024,3,9ΣΚΕΟΡΗ9-ΠΜΙ,2024-03-29,ΕΓΚΡΙΣΗ ΔΑΠΑΝΗΣ,περί εγκρίσεως δαπάνης προμήθειας κάδων απορριμμάτων,,,,,,,,https://diavgeia.gov.gr/doc/9ΣΚΕΟΡΗ9-ΠΜΙ
proc:6f7745dec40d,50226,2024,3,ΡΓΦ7ΟΡΗ9-ΛΚΧ,2024-03-29,ΕΓΚΡΙΣΗ ΔΑΠΑΝΗΣ,έγκριση δαπάνης για την καθαριότητα εντός χερσαίας ζώνης Λιμένα Στυλίδας (απομάκρυνση αλιευτικών σκαφών-καθαρισμός έμπροσθεν ζώνης Β),,,,,,,,https://diavgeia.gov.gr/doc/ΡΓΦ7ΟΡΗ9-ΛΚΧ
proc:34c7d259b39f,50226,2024,3,ΡΥΤ4ΟΡΗ9-Ζ3Σ,2024-03-29,ΕΓΚΡΙΣΗ ΔΑΠΑΝΗΣ,περί εγκρίσεως δαπάνης αποκατάστασης της περίφραξης του λιμένα Γλύφας,,,,,,,,https://diavgeia.gov.gr/doc/ΡΥΤ4ΟΡΗ9-Ζ3Σ
proc:8381c27f1753,50226,2024,3,ΨΟΒΙΟΡΗ9-ΔΞΔ,2024-03-29,ΕΓΚΡΙΣΗ ΔΑΠΑΝΗΣ,"περί εγκρίσεως δαπάνης επισκευής των πλωτών και χερσαίων μέσων των Λιμενικών Αρχών,  ως και την προμήθεια των αντίστοιχων ανταλλακτικών",,,,,,,,https://diavgeia.gov.gr/doc/ΨΟΒΙΟΡΗ9-ΔΞΔ
proc:9629a5b9ee15,50226,2024,4,61Π5ΟΡΗ9-00Λ,2024-04-09,ΕΓΚΡΙΣΗ ΔΑΠΑΝΗΣ,ΧΡΗΜΑΤΙΚΟ ΕΝΤΑΛΜΑ ΠΛΗΡΩΜΗΣ,,,,,,,,https://diavgeia.gov.gr/doc/61Π5ΟΡΗ9-00Λ
proc:392fa4607294,50226,2024,4,6873ΟΡΗ9-05Η,2024-04-12,ΕΓΚΡΙΣΗ ΔΑΠΑΝΗΣ,περί εγκρίσεως δαπάνης αποκατάστασης του υπαίθριου χώρου εναπόθεσης-αποθήκευσης ιστιοπλοϊκών σκαφών,,,,,,,,https://diavgeia.gov.gr/doc/6873ΟΡΗ9-05Η
proc:b5a5ed20101c,50226,2024,4,62Ξ1ΟΡΗ9-Ξ0Ι,2024-04-18,ΕΓΚΡΙΣΗ ΔΑΠΑΝΗΣ,περί εγκρίσεως της τεχνικής έκθεσης περιγραφής  εργασιών νομικής υποστήριξης και της σχετικής δαπάνης,,,,,,,,https://diavgeia.gov.gr/doc/62Ξ1ΟΡΗ9-Ξ0Ι
proc:25cf98b29ec6,50226,2024,4,69ΕΝΟΡΗ9-ΠΒΤ,2024-04-18,ΕΓΚΡΙΣΗ ΔΑΠΑΝΗΣ,Έγκριση δαπάνης για την ανάθεση των εργασιών σε ελεύθερο επαγγελματία συνέχισης των εργασιών καταμέτρησης και καταγραφής των ελλιμενιζόμενων σκαφών και ψηφιοποίησης των αποτελεσμάτων,,,,,,,,https://diavgeia.gov.gr/doc/69ΕΝΟΡΗ9-ΠΒΤ
proc:5f4bfd6ca7e6,50226,2024,4,6ΥΖ0ΟΡΗ9-ΙΟΦ,2024-04-18,ΕΓΚΡΙΣΗ ΔΑΠΑΝΗΣ,Καταβολή ΜΤΝ περιόδου 1/1/2024 έως 31/3/2024,,,,,,,,https://diavgeia.gov.gr/doc/6ΥΖ0ΟΡΗ9-ΙΟΦ
proc:ef37d77d3197,50226,2024,4,6ΥΟΖΟΡΗ9-ΥΜΜ,2024-04-18,ΕΓΚΡΙΣΗ ΔΑΠΑΝΗΣ,"ΠΕΡΊ δέσμευσης πίστωσης για την διαγράμμιση των Χ.Ζ. λιμένων Αρκίτσας, Σκάλας Αταλάντης Λιβανατών και Αγίου Ιωάννη Θεολόγου",,,,,,,,https://diavgeia.gov.gr/doc/6ΥΟΖΟΡΗ9-ΥΜΜ
proc:e1ddd1b8b105,50226,2024,4,9122ΟΡΗ9-ΨΩ8,2024-04-18,ΕΓΚΡΙΣΗ ΔΑΠΑΝΗΣ,περί δέσμευσης πίστωσης για την διατήρηση του προγράμματος Νομοτέλεια,,,,,,,,https://diavgeia.gov.gr/doc/9122ΟΡΗ9-ΨΩ8
proc:bc21cc0979ac,50226,2024,4,9ΒΚΝΟΡΗ9-ΙΡΚ,2024-04-18,ΕΓΚΡΙΣΗ ΔΑΠΑΝΗΣ,"Περί εγκρίσεως διάθεσης πίστωσης για την παροχή των εργασιών που αφορούν στην παροχή υπηρεσιών τηλεπιτήρησης της λιμενικής εγκατάστασης Στυλίδας για διάστημα 12 μηνών, σύμφωνα με τις διατάξεις του κώδικα ασφαλείας ISPS",,,,,,,,https://diavgeia.gov.gr/doc/9ΒΚΝΟΡΗ9-ΙΡΚ
proc:d1a9dd8cb7dc,50226,2024,4,Ε6Γ8ΟΡΗ9-4ΕΩ,2024-04-18,ΕΓΚΡΙΣΗ ΔΑΠΑΝΗΣ,εξόφληση τιμολογίων,,,,,,,,https://diavgeia.gov.gr/doc/Ε6Γ8ΟΡΗ9-4ΕΩ
proc:ae22e1a7e785,50226,2024,4,ΡΠ8ΠΟΡΗ9-ΙΞΓ,2024-04-18,ΕΓΚΡΙΣΗ ΔΑΠΑΝΗΣ,συμμετοχή της υπαλλήλου του Λιμενικού Ταμείου Φθ/δας σε διημερίδα,,,,,,,,https://diavgeia.gov.gr/doc/ΡΠ8ΠΟΡΗ9-ΙΞΓ
proc:92a83817cf5f,50226,2024,4,ΨΗΒΠΟΡΗ9-Χ1Λ,2024-04-18,ΕΓΚΡΙΣΗ ΔΑΠΑΝΗΣ,περί εγκρίσεως δαπάνης για την ανάθεση σε ιδιωτική εταιρεία της παροχής υπηρεσιών ασφαλείας στη λιμενική εγκατάσταση Στυλίδας με βάση τις απαιτήσεις του κώδικα ISPS,,,,,,,,https://diavgeia.gov.gr/doc/ΨΗΒΠΟΡΗ9-Χ1Λ
proc:888fae5581ce,50226,2024,4,6ΛΘΡΟΡΗ9-ΜΕΗ,2024-04-24,ΕΓΚΡΙΣΗ ΔΑΠΑΝΗΣ,περί εγκρίσεως δαπάνης εργασιών επισκευής των σχαρών ομβρίων υδάτων του λιμένα Στυλίδας,,,,,,,,https://diavgeia.gov.gr/doc/6ΛΘΡΟΡΗ9-ΜΕΗ
proc:bf7f6642857c,50226,2024,4,Ε6ΦΤΟΡΗ9-ΠΨΓ,2024-04-24,ΕΓΚΡΙΣΗ ΔΑΠΑΝΗΣ,Καταβολή στην ΡΑΛ το τέλος χρηματοδότησής της,,,,,,,,https://diavgeia.gov.gr/doc/Ε6ΦΤΟΡΗ9-ΠΨΓ
proc:dfb43355db5a,50226,2024,4,Ρ7ΕΒΟΡΗ9-ΙΥΞ,2024-04-24,ΕΓΚΡΙΣΗ ΔΑΠΑΝΗΣ,Ευταξία του λιμένα Στυλίδας,,,,,,,,https://diavgeia.gov.gr/doc/Ρ7ΕΒΟΡΗ9-ΙΥΞ
proc:6d652cb81375,50226,2024,4,69Υ1ΟΡΗ9-Ξ01,2024-04-25,ΕΓΚΡΙΣΗ ΔΑΠΑΝΗΣ,εξόφληση τιμολογίων,,,,,,,,https://diavgeia.gov.gr/doc/69Υ1ΟΡΗ9-Ξ01
proc:1128fea0ff93,50226,2024,5,627ΕΟΡΗ9-ΣΦΛ,2024-05-16,ΕΓΚΡΙΣΗ ΔΑΠΑΝΗΣ,Περί εγκρίσεως της δαπάνης προμήθειας λογισμικού office,,,,,,,,https://diavgeia.gov.gr/doc/627ΕΟΡΗ9-ΣΦΛ
proc:355a95ba21cc,50226,2024,5,6ΗΡ9ΟΡΗ9-ΖΟ9,2024-05-16,ΕΓΚΡΙΣΗ ΔΑΠΑΝΗΣ,περί εγκρίσεως της δαπάνης προμήθειας SERVER για τις ανάγκες της Υπηρεσίας Λ.Τ.Φ,,,,,,,,https://diavgeia.gov.gr/doc/6ΗΡ9ΟΡΗ9-ΖΟ9
proc:70698439b72b,50226,2024,5,95ΤΝΟΡΗ9-Ξ5Ν,2024-05-16,ΕΓΚΡΙΣΗ ΔΑΠΑΝΗΣ,εξόφληση τιμολογίων,,,,,,,,https://diavgeia.gov.gr/doc/95ΤΝΟΡΗ9-Ξ5Ν
proc:c020eb34eee8,50226,2024,5,99ΙΔΟΡΗ9-ΥΝΜ,2024-05-16,ΕΓΚΡΙΣΗ ΔΑΠΑΝΗΣ,Δέσμευση πίστωσης δαπάνης Προμήθειας τόνερ και γραφίτη για τους εκτυπω-τές και τα φωτοτυπικά μηχανήματα του ΛΤΦ,,,,,,,,https://diavgeia.gov.gr/doc/99ΙΔΟΡΗ9-ΥΝΜ
proc:86849b58fc89,50226,2024,5,9ΒΟ5ΟΡΗ9-ΟΟΦ,2024-05-16,ΕΓΚΡΙΣΗ ΔΑΠΑΝΗΣ,περί εγκρίσεως της δαπάνης προμήθειας ειδών καθαριότητας και ευπρεπισμού για τις ανάγκες του Λιμενικού Ταμείου Φθιώτιδας,,,,,,,,https://diavgeia.gov.gr/doc/9ΒΟ5ΟΡΗ9-ΟΟΦ
proc:095457a27891,50226,2024,5,9ΜΛΛΟΡΗ9-41Θ,2024-05-16,ΕΓΚΡΙΣΗ ΔΑΠΑΝΗΣ,περί εγκρίσεως επιστροφής χρημάτων,,,,,,,,https://diavgeia.gov.gr/doc/9ΜΛΛΟΡΗ9-41Θ
proc:9f683c1f5a90,50226,2024,5,ΡΗΒΚΟΡΗ9-Θ4Μ,2024-05-16,ΛΟΙΠΕΣ ΑΤΟΜΙΚΕΣ ΔΙΟΙΚΗΤΙΚΕΣ ΠΡΑΞΕΙΣ,"Περί προτάσεως ορισμού αποφαινόμενων οργάνων για την εκτέλεση του έργου: ""ΕΚΒΑΘΥΝΣΗ ΛΙΜΕΝΑ ΣΤΥΛΙΔΑΣ"", προϋπολογισμού 10.000.000,00 ευρώ.",10000000.0,subject:trusted_budget_phrase,,,,,,https://diavgeia.gov.gr/doc/ΡΗΒΚΟΡΗ9-Θ4Μ
proc:daca9913e59c,50226,2024,5,63Λ5ΟΡΗ9-3Χ8,2024-05-20,ΕΓΚΡΙΣΗ ΔΑΠΑΝΗΣ,ΑΠΟΦΑΣΗ ΑΝΑΛΗΨΗΣ ΥΠΟΧΡΕΩΣΗΣ,,,,,,,,https://diavgeia.gov.gr/doc/63Λ5ΟΡΗ9-3Χ8
proc:47a4656b8c77,50226,2024,5,6ΦΖ8ΟΡΗ9-6ΘΒ,2024-05-20,ΕΓΚΡΙΣΗ ΔΑΠΑΝΗΣ,ΑΠΟΦΑΣΗ ΑΝΑΛΗΨΗΣ ΥΠΟΧΡΕΩΣΗΣ,,,,,,,,https://diavgeia.gov.gr/doc/6ΦΖ8ΟΡΗ9-6ΘΒ
proc:67a04b9a6d80,50226,2024,5,ΨΧΟ0ΟΡΗ9-Υ3Δ,2024-05-20,ΕΓΚΡΙΣΗ ΔΑΠΑΝΗΣ,ΑΠΟΦΑΣΗ ΑΝΑΛΗΨΗΣ ΥΠΟΧΡΕΩΣΗΣ,,,,,,,,https://diavgeia.gov.gr/doc/ΨΧΟ0ΟΡΗ9-Υ3Δ
proc:e82a1e18bb40,50226,2024,5,6ΝΤ6ΟΡΗ9-0ΟΡ,2024-05-30,ΕΓΚΡΙΣΗ ΔΑΠΑΝΗΣ,"περί εγκρίσεως δαπάνης απεγκατάστασης από το λιμένα Στυλίδας, συντήρησης και εγκατάστασης των αυτόματων μηχανημάτων παροχής νερού και ρεύματος στο λιμένα Ραχών",,,,,,,,https://diavgeia.gov.gr/doc/6ΝΤ6ΟΡΗ9-0ΟΡ
proc:575bd0abf4c1,50226,2024,5,6ΡΙ8ΟΡΗ9-ΦΙΓ,2024-05-30,ΕΓΚΡΙΣΗ ΔΑΠΑΝΗΣ,ΠΕΡΊ εγκρίσεως δαπάνης επισκευής ηλεκτροφωτισμού λιμενικής εγκατάστασης Αγίας Μαρίνας Δήμου Στυλίδας,,,,,,,,https://diavgeia.gov.gr/doc/6ΡΙ8ΟΡΗ9-ΦΙΓ
proc:0477760f457f,50226,2024,5,9Τ2ΦΟΡΗ9-92Ξ,2024-05-30,ΕΓΚΡΙΣΗ ΔΑΠΑΝΗΣ,περί δέσμευσης πίστωσης για την επισκευή του περιπολικού οχήματος του Γ΄Λ/Τ Σκάλας Αταλάντης,,,,,,,,https://diavgeia.gov.gr/doc/9Τ2ΦΟΡΗ9-92Ξ
proc:ba769f4cecc1,50226,2024,5,Ψ32ΣΟΡΗ9-ΠΟΚ,2024-05-30,ΕΓΚΡΙΣΗ ΔΑΠΑΝΗΣ,εξόφληση τιμολογίων,,,,,,,,https://diavgeia.gov.gr/doc/Ψ32ΣΟΡΗ9-ΠΟΚ
proc:da8d8a8ceaee,50226,2024,5,ΨΘΡ1ΟΡΗ9-ΚΜΟ,2024-05-30,ΕΓΚΡΙΣΗ ΔΑΠΑΝΗΣ,περί εγκρίσεως δαπάνης εκτέλεσης μυοκτονίας στο λιμένα Στυλίδας,,,,,,,,https://diavgeia.gov.gr/doc/ΨΘΡ1ΟΡΗ9-ΚΜΟ
proc:daf26b0f24a0,50226,2024,5,ΨΨΓ8ΟΡΗ9-2ΞΑ,2024-05-30,ΕΓΚΡΙΣΗ ΔΑΠΑΝΗΣ,περί εγκρίσεως δαπάνης επισκευής της κεντρικής πόρτας λιμένα Στυλίδας,,,,,,,,https://diavgeia.gov.gr/doc/ΨΨΓ8ΟΡΗ9-2ΞΑ
proc:c4d9c81fbdef,50226,2024,6,9Β6ΝΟΡΗ9-1Μ2,1719446400000,ΑΝΑΘΕΣΗ ΕΡΓΩΝ / ΠΡΟΜΗΘΕΙΩΝ / ΥΠΗΡΕΣΙΩΝ / ΜΕΛΕΤΩΝ,περί αναθέσεως των εργασιών συντήρησης λιμένα Γλύφας και επισκευή  βλάβης χερσαίου χώρου,10540.0,detail:extraFieldValues.awardAmount.amount,tax:801560549,,801560549,100083881,92806,https://diavgeia.gov.gr/doc/9Β6ΝΟΡΗ9-1Μ2
proc:a64d3d088693,50226,2024,6,ΕΟΟΚΟΡΗ9-Ψ4Υ,1719446400000,ΑΝΑΘΕΣΗ ΕΡΓΩΝ / ΠΡΟΜΗΘΕΙΩΝ / ΥΠΗΡΕΣΙΩΝ / ΜΕΛΕΤΩΝ,περί αναθέσεως της προμήθειας και τοποθέτησης στεγάστρων αναμονής επιβατών στο λιμένα Αγίου Κωνσταντίνου,9560.0,detail:extraFieldValues.awardAmount.amount,tax:157534583,,157534583,100083881,92806,https://diavgeia.gov.gr/doc/ΕΟΟΚΟΡΗ9-Ψ4Υ
proc:40a80fcffc0e,50226,2024,6,9Β6ΖΟΡΗ9-64Ζ,2024-06-04,ΕΓΚΡΙΣΗ ΔΑΠΑΝΗΣ,ΑΠΟΦΑΣΗ ΑΝΑΛΗΨΗΣ ΥΠΟΧΡΕΩΣΗΣ,,,,,,,,https://diavgeia.gov.gr/doc/9Β6ΖΟΡΗ9-64Ζ
proc:9959481afc6c,50226,2024,6,600ΕΟΡΗ9-7ΕΖ,2024-06-17,ΕΓΚΡΙΣΗ ΔΑΠΑΝΗΣ,Περί εγκρίσεως αποδέσμευσης ποσού,,,,,,,,https://diavgeia.gov.gr/doc/600ΕΟΡΗ9-7ΕΖ
proc:8395fdf6e57e,50226,2024,6,Ψ6ΨΥΟΡΗ9-5ΑΡ,2024-06-17,ΕΓΚΡΙΣΗ ΔΑΠΑΝΗΣ,"περί ελέγχου των κρηπιδωμάτων του παλιού λιμένα Γλύφας, του αλιευτικού καταφυγίου Ραχών και των υποβρυχίων χώρων τους.",,,,,,,,https://diavgeia.gov.gr/doc/Ψ6ΨΥΟΡΗ9-5ΑΡ
proc:9bf297323bc8,50226,2024,6,ΨΦΙΚΟΡΗ9-ΡΙ7,2024-06-17,ΕΓΚΡΙΣΗ ΔΑΠΑΝΗΣ,περί έγκρισης υπερωριακής εργασίας της υπαλλήλου του Λιμενικού Ταμείου Φθ/δας για το Β΄ εξάμηνο 2024 έτους.,,,,,,,,https://diavgeia.gov.gr/doc/ΨΦΙΚΟΡΗ9-ΡΙ7
proc:1714343e2a76,50226,2024,6,Ρ4Ψ9ΟΡΗ9-22Χ,2024-06-18,ΕΓΚΡΙΣΗ ΔΑΠΑΝΗΣ,περί δέσμευσης πίστωσης για την έκδοση καρτών εισόδου στο λιμένα Στυλίδας,,,,,,,,https://diavgeia.gov.gr/doc/Ρ4Ψ9ΟΡΗ9-22Χ
proc:d4344d22b434,50226,2024,6,918ΒΟΡΗ9-10Π,2024-06-27,ΕΓΚΡΙΣΗ ΔΑΠΑΝΗΣ,περί εγκρίσεως  δαπάνης ηλεκτρολογικών εργασιών στο παλαιό τμήμα του αλιευτικού καταφυγίου Γλύφας,,,,,,,,https://diavgeia.gov.gr/doc/918ΒΟΡΗ9-10Π
proc:ac79ce28aee9,50226,2024,6,9ΠΩ8ΟΡΗ9-ΓΣ7,2024-06-27,ΕΓΚΡΙΣΗ ΔΑΠΑΝΗΣ,Έγκριση δαπάνης για την ανάθεση των εργασιών σε ελεύθερο επαγγελματία συνέχισης των εργασιών καταμέτρησης και καταγραφής των ελλιμενιζόμενων σκαφών και ψηφιοποίησης των αποτελεσμάτων,,,,,,,,https://diavgeia.gov.gr/doc/9ΠΩ8ΟΡΗ9-ΓΣ7
proc:4e1ce8bab0c2,50226,2024,6,ΨΔΕΖΟΡΗ9-4Α8,2024-06-27,ΕΓΚΡΙΣΗ ΔΑΠΑΝΗΣ,περί συμμετοχής της υπαλλήλου του Λιμενικού Ταμείου Φθ/δας σε ΟΝ-LINE σεμινάριο,,,,,,,,https://diavgeia.gov.gr/doc/ΨΔΕΖΟΡΗ9-4Α8
proc:2710b57f2881,50226,2024,6,ΨΥΧΞΟΡΗ9-ΖΓΚ,2024-06-27,ΕΓΚΡΙΣΗ ΔΑΠΑΝΗΣ,περί εγκρίσεως  δαπάνης ηλεκτρολογικών εργασιών στο λιμένα Στυλίδας,,,,,,,,https://diavgeia.gov.gr/doc/ΨΥΧΞΟΡΗ9-ΖΓΚ
proc:1816255fec0f,50226,2024,7,66ΩΝΟΡΗ9-Ε7Ψ,1719792000000,ΑΝΑΘΕΣΗ ΕΡΓΩΝ / ΠΡΟΜΗΘΕΙΩΝ / ΥΠΗΡΕΣΙΩΝ / ΜΕΛΕΤΩΝ,περί αναθέσεως της παροχής υπηρεσιών ασφαλείας (φύλαξης) στη λιμενική εγκατάσταση Στυλίδας με βάση τις απαιτήσεις του κώδικα ISPS,74400.0,detail:extraFieldValues.awardAmount.amount,tax:998919999,,998919999,100083881,92806,https://diavgeia.gov.gr/doc/66ΩΝΟΡΗ9-Ε7Ψ
proc:924f25c15976,50226,2024,7,Ψ4ΟΨΟΡΗ9-Μ26,1721001600000,ΑΝΑΘΕΣΗ ΕΡΓΩΝ / ΠΡΟΜΗΘΕΙΩΝ / ΥΠΗΡΕΣΙΩΝ / ΜΕΛΕΤΩΝ,"περί αναθέσεως των εργασιών ελέγχου των κρηπιδωμάτων του παλιού λιμένα Γλύφας, του αλιευτικού καταφυγίου Ραχών και των υποβρυχίων χώρων τους",7000.0,detail:extraFieldValues.awardAmount.amount,tax:997044763,,997044763,100083881,92806,https://diavgeia.gov.gr/doc/Ψ4ΟΨΟΡΗ9-Μ26
proc:6409d88d61ed,50226,2024,7,9ΙΣ5ΟΡΗ9-ΓΘ3,2024-07-15,ΕΓΚΡΙΣΗ ΔΑΠΑΝΗΣ,καταβολή των πρακτορικών δικαιωμάτων στην Κ/Ξ Π/Θ Αρκίτσας-Αιδηψού για το έτος 2023,,,,,,,,https://diavgeia.gov.gr/doc/9ΙΣ5ΟΡΗ9-ΓΘ3
proc:3924b56b4fbb,50226,2024,7,9ΝΡΤΟΡΗ9-Σ2Π,2024-07-15,ΕΓΚΡΙΣΗ ΔΑΠΑΝΗΣ,περί εγκρίσεως  δαπάνης αντικατάστασης ηλεκτρομηχανολογικού δικτύου παλαιού λιμένα Γλύφας,,,,,,,,https://diavgeia.gov.gr/doc/9ΝΡΤΟΡΗ9-Σ2Π
proc:6f7d3832f387,50226,2024,7,9ΤΛΔΟΡΗ9-4ΥΠ,2024-07-15,ΕΓΚΡΙΣΗ ΔΑΠΑΝΗΣ,Καταβολή ΜΤΝ περιόδου 1/4/2024 έως 30/6/2024,,,,,,,,https://diavgeia.gov.gr/doc/9ΤΛΔΟΡΗ9-4ΥΠ
proc:a16844f80824,50226,2024,7,Ρ48ΟΟΡΗ9-ΕΓ0,2024-07-15,ΕΓΚΡΙΣΗ ΔΑΠΑΝΗΣ,εξόφληση τιμολογίων,,,,,,,,https://diavgeia.gov.gr/doc/Ρ48ΟΟΡΗ9-ΕΓ0
proc:fbe4929d3b57,50226,2024,7,ΡΗΔΤΟΡΗ9-4ΟΥ,2024-07-15,ΕΓΚΡΙΣΗ ΔΑΠΑΝΗΣ,περί εγκρίσεως  δαπάνης προμήθειας φωτιστικών led παλαιού λιμένα Γλύφας,,,,,,,,https://diavgeia.gov.gr/doc/ΡΗΔΤΟΡΗ9-4ΟΥ
proc:c9fc2986ae53,50226,2024,7,ΨΝΥΥΟΡΗ9-Ξ04,2024-07-15,ΕΓΚΡΙΣΗ ΔΑΠΑΝΗΣ,Έγκριση δέσμευσης πίστωσης για την κάλυψη της δαπάνης σύνταξης εγχειριδίου καρτών  πρόσβασης,,,,,,,,https://diavgeia.gov.gr/doc/ΨΝΥΥΟΡΗ9-Ξ04
proc:f7b97860b10d,50226,2024,7,ΨΨ30ΟΡΗ9-17Γ,2024-07-15,ΕΓΚΡΙΣΗ ΔΑΠΑΝΗΣ,Έγκριση δέσμευσης πίστωσης για την κάλυψη της δαπάνης τοποθέτησης παροχών υδροδότησης τους λιμένες και αλιευτικά καταφύγια του Δήμου Λοκρών,,,,,,,,https://diavgeia.gov.gr/doc/ΨΨ30ΟΡΗ9-17Γ
proc:029979873cea,50226,2024,7,6ΣΧΓΟΡΗ9-ΠΦΤ,2024-07-17,ΕΓΚΡΙΣΗ ΔΑΠΑΝΗΣ,περί καταβολής χαρτοσήμου και ΟΓΑ χαρτοσήμου παραχωρήσεων – δήλωση φόρου εισοδήματος του Λ.Τ.Φθιώτιδας,,,,,,,,https://diavgeia.gov.gr/doc/6ΣΧΓΟΡΗ9-ΠΦΤ
proc:ffa5da79e100,50226,2024,7,6ΤΟ0ΟΡΗ9-8ΕΣ,2024-07-17,ΕΓΚΡΙΣΗ ΔΑΠΑΝΗΣ,περί εγκρίσεως  δαπάνης προμήθειας τροχαίου υλικού για την χ.ζ. λιμένα Γλύφας,,,,,,,,https://diavgeia.gov.gr/doc/6ΤΟ0ΟΡΗ9-8ΕΣ
proc:d25615821242,50226,2024,7,9ΩΒ2ΟΡΗ9-8ΛΨ,2024-07-22,ΕΓΚΡΙΣΗ ΔΑΠΑΝΗΣ,ΧΡΗΜΑΤΙΚΟ ΕΝΤΑΛΜΑ ΠΛΗΡΩΜΗΣ,,,,,,,,https://diavgeia.gov.gr/doc/9ΩΒ2ΟΡΗ9-8ΛΨ
proc:816bc9725a9c,50226,2024,7,6Ζ3ΣΟΡΗ9-ΑΑΕ,2024-07-29,ΕΓΚΡΙΣΗ ΔΑΠΑΝΗΣ,περί εγκρίσεως  δαπάνης προμήθειας και τοποθέτησης ενός κλιματιστικού στο Λ/Χ Στυλίδας,,,,,,,,https://diavgeia.gov.gr/doc/6Ζ3ΣΟΡΗ9-ΑΑΕ
proc:86c60388dac8,50226,2024,7,6ΘΤΜΟΡΗ9-ΞΤΕ,2024-07-29,ΛΟΙΠΕΣ ΑΤΟΜΙΚΕΣ ΔΙΟΙΚΗΤΙΚΕΣ ΠΡΑΞΕΙΣ,"Αλλαγή αναδόχου απομάκρυνσης, αποσυναρμολόγησης & μεταφοράς της πλωτής εξέδρας ως και της προμήθειας σημαδούρας βαρέως τύπου μετά παρελ-κομένων αυτής.",,,,,,,,https://diavgeia.gov.gr/doc/6ΘΤΜΟΡΗ9-ΞΤΕ
