procurement_key,org,year,month,ada,issue_date,decision_type,subject,amount,amount_source,supplier_key,supplier_name,supplier_tax_id,signer,unit,url
proc:f16073562d00,50449,2020,1,ΩΧΠΗΟΡΥΑ-ΚΔ6,2020-01-02,ΑΝΑΛΗΨΗ ΥΠΟΧΡΕΩΣΗΣ,ΠΡΟΜΗΘΕΙΑ ΠΕΤΡΕΛΑΙΟΥ ΘΕΡΜΑΝΣΗΣ ΓΙΑ ΚΑΛΥΨΗ ΛΕΙΤΟΥΡΓΙΚΩΝ ΑΝΑΓΚΩΝ ΤΗΣ ΕΓΚΑΤΑΣΤΑΣΗΣ Τ/Θ ΚΟΖΑΝΗΣ,,,,,,,,https://diavgeia.gov.gr/doc/ΩΧΠΗΟΡΥΑ-ΚΔ6
proc:bde60b1bcaa0,50449,2020,1,6Ζ8ΟΟΡΥΑ-Κ6Ν,2020-01-03,ΑΝΑΛΗΨΗ ΥΠΟΧΡΕΩΣΗΣ,ΠΡΟΜΗΘΕΙΑ ΕΞΥΠΗΡΕΤΗΤΩΝ ΔΙΚΤΥΟΥ (SERVERS),,,,,,,,https://diavgeia.gov.gr/doc/6Ζ8ΟΟΡΥΑ-Κ6Ν
proc:04157aebf14f,50449,2020,1,6ΞΩ8ΟΡΥΑ-ΓΘΦ,2020-01-03,ΕΓΚΡΙΣΗ ΔΑΠΑΝΗΣ,"ΣΥΝΔΡΟΜΗ ""ΔΗΜΟΣ ΝΕΤ"" ΓΙΑ ΤΟ ΕΤΟΣ 2020",,,,,,,,https://diavgeia.gov.gr/doc/6ΞΩ8ΟΡΥΑ-ΓΘΦ
proc:9cd9ac00f0d7,50449,2020,1,Ψ5Γ3ΟΡΥΑ-Ε1Θ,2020-01-03,ΑΝΑΛΗΨΗ ΥΠΟΧΡΕΩΣΗΣ,ΔΕΣΜΕΥΣΗ ΠΙΣΤΩΣΗΣ ΓΙΑ ΠΡΟΜΗΘΕΙΑ ΜΠΑΤΑΡΙΩΝ ΛΙΘΙΟΥ R20D(B),,,,,,,,https://diavgeia.gov.gr/doc/Ψ5Γ3ΟΡΥΑ-Ε1Θ
proc:3800f78bfda5,50449,2020,1,665ΛΟΡΥΑ-2Ρ8,2020-01-07,ΑΝΑΛΗΨΗ ΥΠΟΧΡΕΩΣΗΣ,ΔΕΣΜΕΥΣΗ ΠΙΣΤΩΣΗΣ ΔΑΠΑΝΗΣ ΤΗΛΕΠΙΚΟΙΝΩΝΙΩΝ,,,,,,,,https://diavgeia.gov.gr/doc/665ΛΟΡΥΑ-2Ρ8
proc:1dab02c34188,50449,2020,1,66Ω4ΟΡΥΑ-Θ0Π,2020-01-07,ΑΝΑΛΗΨΗ ΥΠΟΧΡΕΩΣΗΣ,ΔΕΣΜΕΥΣΗΣ ΠΙΣΤΩΣΗΣ ΠΡΟΜΗΘΕΙΑΣ ΠΟΛΥΗΛΕΚΤΡΟΛΥΤΗ,,,,,,,,https://diavgeia.gov.gr/doc/66Ω4ΟΡΥΑ-Θ0Π
proc:3f87c3d050ce,50449,2020,1,Ω678ΟΡΥΑ-ΖΦ5,2020-01-08,ΑΝΑΘΕΣΗ ΕΡΓΩΝ / ΠΡΟΜΗΘΕΙΩΝ / ΥΠΗΡΕΣΙΩΝ / ΜΕΛΕΤΩΝ,"ΣΥΜΒΑΣΗ (Σ1/2020)
ΑΝΑΘΕΣΗ ΠΑΡΟΧΗΣ ΥΠΗΡΕΣΙΑΣ ΚΑΘΑΡΙΟΤΗΤΑΣ ΤΩΝ ΚΤΙΡΙΑΚΩΝ ΕΓΚΑΤΑΣΤΑΣΕΩΝ ΤΗΣ ΔΕΥΑΚ",,,,,,,,https://diavgeia.gov.gr/doc/Ω678ΟΡΥΑ-ΖΦ5
proc:e92a4093c5e5,50449,2020,1,63Μ7ΟΡΥΑ-2ΧΗ,2020-01-10,ΟΡΙΣΤΙΚΟΠΟΙΗΣΗ ΠΛΗΡΩΜΗΣ,ΕΞΟΦΛΗΣΗ ΤΔΑ-939 (ΠΡΟΜΗΘΕΙΑ ΦΥΣΙΓΓΩΝ ΣΚΟΝΗΣ ΤΟΝΕΡ),,,,,,,,https://diavgeia.gov.gr/doc/63Μ7ΟΡΥΑ-2ΧΗ
proc:428cb075a392,50449,2020,1,Ψ74ΒΟΡΥΑ-8ΤΜ,2020-01-10,ΑΝΑΛΗΨΗ ΥΠΟΧΡΕΩΣΗΣ,ΠΡΟΜΗΘΕΙΑ ΕΞΟΠΛΙΣΜΟΥ ΔΡΑΣΗΣ ΚΥΚΛΟΣ ΑΣΤΙΚΟΥ ΝΕΡΟΥ-ΕΝΕΡΓΕΙΑΣ 2014-2020,,,,,,,,https://diavgeia.gov.gr/doc/Ψ74ΒΟΡΥΑ-8ΤΜ
proc:7cb1cfba9ea2,50449,2020,1,Ω5Π9ΟΡΥΑ-ΖΩ8,2020-01-10,ΑΝΑΛΗΨΗ ΥΠΟΧΡΕΩΣΗΣ,ΔΕΣΜΕΥΣΗ ΠΙΣΤΩΣΗΣ ΠΡΟΜΗΘΕΙΑ ΑΝΤΑΛΛΑΚΤΙΚΩΝ ΦΙΛΤΡΩΝ ΑΠΟΣΜΗΣΗΣ ΕΕΛ ΒΙ.ΠΕ,,,,,,,,https://diavgeia.gov.gr/doc/Ω5Π9ΟΡΥΑ-ΖΩ8
proc:7f06fc603a9d,50449,2020,1,Ω2ΑΤΟΡΥΑ-Π93,2020-01-13,ΑΝΑΛΗΨΗ ΥΠΟΧΡΕΩΣΗΣ,ΠΡΟΜΗΘΕΙΑ ΔΙΑΦΟΡΩΝ ΕΠΙΠΛΩΝ & ΕΞΟΠΛΙΣΜΟΥ,,,,,,,,https://diavgeia.gov.gr/doc/Ω2ΑΤΟΡΥΑ-Π93
proc:dccbde534f72,50449,2020,1,6ΠΑ1ΟΡΥΑ-ΠΚΨ,2020-01-15,ΑΝΑΛΗΨΗ ΥΠΟΧΡΕΩΣΗΣ,ΠΡΟΜΗΘΕΙΑ ΨΗΦΙΑΚΩΝ ΜΕΤΑΔΟΤΩΝ ΔΙΑΦΟΡΙΚΗΣ ΠΙΕΣΗΣ ΘΕΡΜΟΥ ΑΕΡΑ,,,,,,,,https://diavgeia.gov.gr/doc/6ΠΑ1ΟΡΥΑ-ΠΚΨ
proc:8e3f2d099c22,50449,2020,1,6ΧΧΓΟΡΥΑ-ΣΤΣ,2020-01-15,ΕΓΚΡΙΣΗ ΔΑΠΑΝΗΣ,ΑΠΟΖΗΜΙΩΣΗ ΖΗΜΙΑΣ ΛΟΓΩ ΔΙΑΡΡΟΗΣ ΑΠΟΧΕΤΕΥΣΗΣ,,,,,,,,https://diavgeia.gov.gr/doc/6ΧΧΓΟΡΥΑ-ΣΤΣ
proc:0650b5564c6c,50449,2020,1,9ΞΖΗΟΡΥΑ-ΨΛ2,2020-01-15,ΑΝΑΛΗΨΗ ΥΠΟΧΡΕΩΣΗΣ,ΔΕΣΜΕΥΣΗ ΠΙΣΤΩΣΗΣ ΠΡΟΜΗΘΕΙΑ ΥΠΟΧΛΩΡΙΩΔΟΥΣ ΝΑΤΡΙΟΥ Σ61/19,,,,,,,,https://diavgeia.gov.gr/doc/9ΞΖΗΟΡΥΑ-ΨΛ2
proc:27765e19dd1e,50449,2020,1,ΩΑΛΤΟΡΥΑ-ΘΔ0,2020-01-15,ΑΝΑΛΗΨΗ ΥΠΟΧΡΕΩΣΗΣ,ΠΡΟΜΗΘΕΙΑ ΕΓΚΑΤΑΣΤΑΣΗ ΚΑΙ ΘΕΣΗ ΣΕ ΛΕΙΤΟΥΡΓΙΑ ΕΞΟΠΛΙΣΜΟΥ ΑΠΟΜΑΚΡΥΣΜΕΝΗΣ ΑΝΑΓΝΩΣΗΣ ΜΕΤΡΗΣΕΩΝ ΚΑΙ ΔΙΑΤΑΞΕΩΝ ΠΑΡΑΓΩΓΗΣ ΕΝΕΡΓΕΙΑΣ ΣΕ ΕΠΙΛΕΓΜΕΝΕΣ ΘΕΣΕΙΣ ΤΟΥ ΔΙΚΤΥΟΥ ΥΔΡΕΥΣΗΣ ΤΗΣ ΔΕΥΑΚ,,,,,,,,https://diavgeia.gov.gr/doc/ΩΑΛΤΟΡΥΑ-ΘΔ0
proc:cbb284686bcb,50449,2020,1,ΩΤ04ΟΡΥΑ-Υ37,2020-01-15,ΑΝΑΛΗΨΗ ΥΠΟΧΡΕΩΣΗΣ,ΠΡΟΜΗΘΕΙΑ ΑΝΤΑΛΛΑΚΤΙΚΩΝ ΜΕΙΩΤΗΡΩΝ ΓΙΑ ΣΥΝΤΗΡΗΣΗ Β/Κ,,,,,,,,https://diavgeia.gov.gr/doc/ΩΤ04ΟΡΥΑ-Υ37
proc:62fdf80df891,50449,2020,1,6Δ7ΚΟΡΥΑ-8ΛΩ,2020-01-16,ΟΡΙΣΤΙΚΟΠΟΙΗΣΗ ΠΛΗΡΩΜΗΣ,ΕΞΟΦΛΗΣΗ ΤΙΜ-1102 (ΠΡΟΜΗΘΕΙΑ ΣΩΛΗΝΩΝ ΓΕΩΤΡΗΣΗΣ),,,,,,,,https://diavgeia.gov.gr/doc/6Δ7ΚΟΡΥΑ-8ΛΩ
proc:bf8596dd4b3a,50449,2020,1,ΨΡΨΔΟΡΥΑ-ΓΝΛ,2020-01-16,ΑΝΑΛΗΨΗ ΥΠΟΧΡΕΩΣΗΣ,ΔΕΣΜΕΥΣΗ ΠΙΣΤΩΣΗΣ ΠΡΟΜΗΘΕΙΑ ΘΕΡΜΙΔOΜΕΤΡΩΝ & ΑΛΛΩΝ ΑΝΤΑΛΛΑΚΤΙΚΩΝ Θ/Υ,,,,,,,,https://diavgeia.gov.gr/doc/ΨΡΨΔΟΡΥΑ-ΓΝΛ
proc:15b9a946f559,50449,2020,1,ΨΧ3ΠΟΡΥΑ-Ξ4Φ,2020-01-16,ΕΓΚΡΙΣΗ ΔΑΠΑΝΗΣ,ΔΕΣΜΕΥΣΗ ΓΙΑ ΑΠΟΖΗΜΙΩΣΗ ΕΠΙΦΑΝΕΙΑΚΗΣ ΑΓΡΟΖΗΜΙΑΣ,,,,,,,,https://diavgeia.gov.gr/doc/ΨΧ3ΠΟΡΥΑ-Ξ4Φ
proc:ac3f246d3cb3,50449,2020,1,64ΗΥΟΡΥΑ-Ρ21,2020-01-17,ΑΝΑΛΗΨΗ ΥΠΟΧΡΕΩΣΗΣ,ΠΡΟΜΗΘΕΙΑ ΔΙΑΛΥΜΑΤΟΣ ΔΙΣΘΕΝΟΥΣ ΣΙΔΗΡΟΥ,,,,,,,,https://diavgeia.gov.gr/doc/64ΗΥΟΡΥΑ-Ρ21
proc:0f92c66bda3c,50449,2020,1,6ΓΛΑΟΡΥΑ-Ω9Α,2020-01-17,ΑΝΑΛΗΨΗ ΥΠΟΧΡΕΩΣΗΣ,ΠΡΟΜΗΘΕΙΑ ΧΗΜΙΚΩΝ ΑΝΤΙΔΡΑΣΤΗΡΙΩΝ,,,,,,,,https://diavgeia.gov.gr/doc/6ΓΛΑΟΡΥΑ-Ω9Α
proc:5611eb9e7762,50449,2020,1,6408ΟΡΥΑ-Μ56,2020-01-20,ΑΝΑΛΗΨΗ ΥΠΟΧΡΕΩΣΗΣ,ΠΡΟΜΗΘΕΙΑ ΥΠΟΒΡΥΧΙΩΝ ΑΝΤΛΗΤΙΚΩΝ ΣΥΓΚΡΟΤΗΜΑΤΩΝ,,,,,,,,https://diavgeia.gov.gr/doc/6408ΟΡΥΑ-Μ56
proc:60faf11c9fe5,50449,2020,1,6ΘΩΔΟΡΥΑ-ΔΡΖ,2020-01-20,ΑΝΑΛΗΨΗ ΥΠΟΧΡΕΩΣΗΣ,ΠΡΟΜΗΘΕΙΑ ΑΝΑΛΩΣΙΜΩΝ ΥΛΙΚΩΝ ΣΥΝΤΗΡΗΣΗΣ Β/Κ,,,,,,,,https://diavgeia.gov.gr/doc/6ΘΩΔΟΡΥΑ-ΔΡΖ
proc:a5b521d6dd50,50449,2020,1,9ΕΟ8ΟΡΥΑ-ΛΗΟ,2020-01-20,ΑΝΑΛΗΨΗ ΥΠΟΧΡΕΩΣΗΣ,ΔΕΣΜΕΥΣΗ ΠΙΣΤΩΣΗΣ ΠΡΟΜΗΘΕΙΑΣ ΗΛΕΚΤΡΟΛΟΓΙΚΟΥ ΥΛΙΚΟΥ,,,,,,,,https://diavgeia.gov.gr/doc/9ΕΟ8ΟΡΥΑ-ΛΗΟ
proc:baaaafefc275,50449,2020,1,ΩΑΤ1ΟΡΥΑ-Ω3Λ,2020-01-20,ΑΝΑΛΗΨΗ ΥΠΟΧΡΕΩΣΗΣ,ΔΕΣΜΕΥΣΗ ΠΙΣΤΩΣΗΣ ΠΡΟΜΗΘΕΙΑΣ ΛΕΥΚΟΥ ΠΑΣΤΕΡΙΩΜΕΝΟΥ ΓΑΛΑΚΤΟΣ,,,,,,,,https://diavgeia.gov.gr/doc/ΩΑΤ1ΟΡΥΑ-Ω3Λ
proc:a500596e0ca7,50449,2020,1,6ΥΑΙΟΡΥΑ-ΙΤ7,2020-01-21,ΟΡΙΣΤΙΚΟΠΟΙΗΣΗ ΠΛΗΡΩΜΗΣ,ΕΞΟΦΛΗΣΗ ΤΙΜ-150 (ΠΡΟΜΗΘΕΙΑ ΑΝΤΑΛ/ΚΩΝ Θ/Υ ΤΗΛ/ΝΣΗΣ),,,,,,,,https://diavgeia.gov.gr/doc/6ΥΑΙΟΡΥΑ-ΙΤ7
proc:7164439de693,50449,2020,1,Ψ2ΑΘΟΡΥΑ-ΩΗΑ,2020-01-21,ΟΡΙΣΤΙΚΟΠΟΙΗΣΗ ΠΛΗΡΩΜΗΣ,"ΕΞΟΦΛΗΣΗ ΤΙΜ-699,701 (ΠΡΟΜΗΘΕΙΑ ΧΗΜΙΚΩΝ ΚΑΘΑΡΙΣΜΟΥ ΕΝΑΛΛΑΚΤΩΝ ΘΕΡΜΟΤΗΤΑΣ)",,,,,,,,https://diavgeia.gov.gr/doc/Ψ2ΑΘΟΡΥΑ-ΩΗΑ
proc:3982e1114676,50449,2020,1,Ψ4ΥΡΟΡΥΑ-ΛΔΠ,2020-01-21,ΑΝΑΛΗΨΗ ΥΠΟΧΡΕΩΣΗΣ,ΔΕΣΜΕΥΣΗ ΠΙΣΤΩΣΗΣ ΠΡΟΜΗΘΕΙΑΣ ΕΤΟΙΜΟΥ ΣΚΥΡΟΔΕΜΑΤΟΣ,,,,,,,,https://diavgeia.gov.gr/doc/Ψ4ΥΡΟΡΥΑ-ΛΔΠ
proc:eea5e9d0aa27,50449,2020,1,ΨΧΦΣΟΡΥΑ-ΗΒ9,2020-01-21,ΑΝΑΛΗΨΗ ΥΠΟΧΡΕΩΣΗΣ,ΔΕΣΜΕΥΣΗ ΠΙΣΤΩΣΗΣ ΠΡΟΜΗΘΕΙΑΣ ΑΔΡΑΝΩΝ ΥΛΙΚΩΝ,,,,,,,,https://diavgeia.gov.gr/doc/ΨΧΦΣΟΡΥΑ-ΗΒ9
proc:d0178e525994,50449,2020,1,Ω9Μ8ΟΡΥΑ-Α9Ρ,2020-01-21,ΑΝΑΛΗΨΗ ΥΠΟΧΡΕΩΣΗΣ,ΔΕΣΜΕΥΣΗ ΠΙΣΤΩΣΗΣ ΠΡΟΜΗΘΕΙΑ ΟΙΚΟΔΟΜΙΚΩΝ ΥΛΙΚΩΝ,,,,,,,,https://diavgeia.gov.gr/doc/Ω9Μ8ΟΡΥΑ-Α9Ρ
proc:2b57c37497c3,50449,2020,1,ΩΧΘΞΟΡΥΑ-5ΛΠ,2020-01-21,ΑΝΑΛΗΨΗ ΥΠΟΧΡΕΩΣΗΣ,ΔΕΣΜΕΥΣΗ ΠΙΣΤΩΣΗΣ ΓΙΑ ΠΡΟΜΗΘΕΙΑ & ΤΟΠΟΘΕΤΗΣΗ ΥΔΡΟΜΕΤΡΗΤΩΝ,,,,,,,,https://diavgeia.gov.gr/doc/ΩΧΘΞΟΡΥΑ-5ΛΠ
proc:b16f5c01098b,50449,2020,1,60ΓΨΟΡΥΑ-ΗΙΤ,2020-01-22,ΑΝΑΛΗΨΗ ΥΠΟΧΡΕΩΣΗΣ,ΔΕΣΜΕΥΣΗ ΠΙΣΤΩΣΗΣ ΠΡΟΜΗΘΕΙΑΣ ΥΛΙΚΩΝ ΥΔΡΕΥΣΗΣ-ΑΠΟΧΕΤΕΥΣΗΣ,,,,,,,,https://diavgeia.gov.gr/doc/60ΓΨΟΡΥΑ-ΗΙΤ
proc:709be239fae9,50449,2020,1,6ΕΨΕΟΡΥΑ-Ρ5Ν,2020-01-22,ΑΝΑΛΗΨΗ ΥΠΟΧΡΕΩΣΗΣ,ΔΕΣΜΕΥΣΗ ΠΙΣΤ.ΠΡΟΜΗΘΕΙΑΣ ΒΕΛΤΙΩΤΙΚΩΝ ΝΕΡΟΤ ΠΡ.ΚΥΚΛΩΜΑΤΟΣ Τ/Θ ΚΟΖΑΝΗΣ,,,,,,,,https://diavgeia.gov.gr/doc/6ΕΨΕΟΡΥΑ-Ρ5Ν
proc:4aabb37b3075,50449,2020,1,6ΩΦΜΟΡΥΑ-51Θ,2020-01-22,ΚΑΝΟΝΙΣΤΙΚΗ ΠΡΑΞΗ,"Έγκριση τευχών & όρων διεξαγωγής Ανοικτού μειοδοτικού διαγωνισμού για την ανάθεση εκπόνησης μελέτης με τίτλο: ""Αναβάθμιση / Εκσυγχρονισμός Υφιστάμενου Λεβητοστασίου αιχμής - εφεδρείας Τηλεθέρμανσης Κοζάνης"" με αριθμό αναφοράς : ΤΘ 0355/2019.",,,,,,,,https://diavgeia.gov.gr/doc/6ΩΦΜΟΡΥΑ-51Θ
proc:98ce9515557a,50449,2020,1,9ΕΣΩΟΡΥΑ-Λ0Υ,2020-01-22,ΚΑΝΟΝΙΣΤΙΚΗ ΠΡΑΞΗ,Έγκριση ανάθεσης αποστολής λογαριασμών ύδρευσης & τηλεθέρμανσης Δ.Ε.Υ.Α. Κοζάνης.,,,,,,,,https://diavgeia.gov.gr/doc/9ΕΣΩΟΡΥΑ-Λ0Υ
proc:2d97795675b1,50449,2020,1,9Κ0ΣΟΡΥΑ-ΤΙΗ,2020-01-22,ΚΑΝΟΝΙΣΤΙΚΗ ΠΡΑΞΗ,Έγκριση τροποποίησης της σύμβασης « Προμήθεια πετρελαίου θέρμανσης για την εγκατάσταση τηλεθέρμανσης Κοζάνης Κωδικός ( Τ/Θ 0347 / 2018 ) ( Αρ. Σύμβασης Ν°4/2019) » με ρήτρα αναθεώρησης την άσκηση του δικαιώματος προαίρεσης.,,,,,,,,https://diavgeia.gov.gr/doc/9Κ0ΣΟΡΥΑ-ΤΙΗ
proc:18a3411c07f0,50449,2020,1,Ψ0ΦΑΟΡΥΑ-ΥΣΜ,2020-01-22,ΚΑΝΟΝΙΣΤΙΚΗ ΠΡΑΞΗ,Έγκριση και κατακύρωση απευθείας ανάθεσης υπηρεσιών υποστήριξης και συντήρησης εφαρμογών για το 2020.,,,,,,,,https://diavgeia.gov.gr/doc/Ψ0ΦΑΟΡΥΑ-ΥΣΜ
proc:3dff1050f9d5,50449,2020,1,Ψ9ΧΠΟΡΥΑ-7ΒΘ,2020-01-22,ΚΑΝΟΝΙΣΤΙΚΗ ΠΡΑΞΗ,Έγκριση και κατακύρωση απευθείας ανάθεσης υπηρεσιών υποστήριξης και συντήρησης των εμφακελωτικών μηχανημάτων για το 2020.,,,,,,,,https://diavgeia.gov.gr/doc/Ψ9ΧΠΟΡΥΑ-7ΒΘ
proc:bc9709cc042f,50449,2020,1,ΨΓΦΚΟΡΥΑ-ΧΗΛ,2020-01-22,ΚΑΝΟΝΙΣΤΙΚΗ ΠΡΑΞΗ,Έγκριση προγραμματικής σύμβασης με την ΑΝ.ΚΟ. Α.Ε. «Μελέτη περιβαλλοντικών επιπτώσεων υδραγωγείων ΕΛΙΜΕΙΑΣ ΚΑΙ ΑΙΑΝΗΣ».,,,,,,,,https://diavgeia.gov.gr/doc/ΨΓΦΚΟΡΥΑ-ΧΗΛ
proc:1e3a8caa5e50,50449,2020,1,ΨΡ05ΟΡΥΑ-ΞΝΕ,2020-01-22,ΑΝΑΛΗΨΗ ΥΠΟΧΡΕΩΣΗΣ,ΔΕΣΜΕΥΣΗ ΠΙΣΤΩΣΗΣ ΠΡΟΜΗΘΕΙΑ ΓΡΑΦΙΚΗΣ ΥΛΗΣ,,,,,,,,https://diavgeia.gov.gr/doc/ΨΡ05ΟΡΥΑ-ΞΝΕ
proc:02616540f4ab,50449,2020,1,ΩΣΝΖΟΡΥΑ-ΟΘΤ,2020-01-22,ΑΝΑΛΗΨΗ ΥΠΟΧΡΕΩΣΗΣ,ΔΕΣΜΕΥΣΗ ΠΙΣΤΩΣΗΣ ΠΡΟΜΗΘΕΙΑΣ ΕΝΤΥΠΩΝ & ΦΑΚΕΛΩΝ,,,,,,,,https://diavgeia.gov.gr/doc/ΩΣΝΖΟΡΥΑ-ΟΘΤ
proc:1773319efa71,50449,2020,1,ΩΩΩ1ΟΡΥΑ-7Φ8,2020-01-22,ΑΝΑΛΗΨΗ ΥΠΟΧΡΕΩΣΗΣ,ΔΕΣΜΕΥΣΗ ΠΙΣΤ.ΠΡΟΜΗΘΕΙΑ ΣΤΟΙΧΕΙΩΝ ΕΝΑΛΛΑΓΗΣ ΘΕΡΜΟΤΗΤΑΣ Θ/Υ Τ/Θ ΚΟΖΑΝΗΣ,,,,,,,,https://diavgeia.gov.gr/doc/ΩΩΩ1ΟΡΥΑ-7Φ8
proc:073d07f6b2d7,50449,2020,1,684ΓΟΡΥΑ-ΡΓΙ,2020-01-23,ΑΝΑΛΗΨΗ ΥΠΟΧΡΕΩΣΗΣ,ΔΕΣΜΕΥΣΗ ΠΙΣΤΩΣΗΣ ΠΡΟΜΗΘΕΙΑ ΨΥΧΡΟΥ ΑΣΦΑΛΤΟΜΙΓΜΑΤΟΣ,,,,,,,,https://diavgeia.gov.gr/doc/684ΓΟΡΥΑ-ΡΓΙ
proc:53c6443d1eaa,50449,2020,1,ΩΩ82ΟΡΥΑ-7ΧΟ,2020-01-23,ΑΝΑΛΗΨΗ ΥΠΟΧΡΕΩΣΗΣ,ΔΕΣΜΕΥΣΗ ΠΙΣΤΩΣΗΣ ΠΡΟΜΗΘΕΙΑΣ ΥΓΡΩΝ ΚΑΥΣΙΜΩΝ,,,,,,,,https://diavgeia.gov.gr/doc/ΩΩ82ΟΡΥΑ-7ΧΟ
proc:66dbf69e4662,50449,2020,1,ΩΘ8ΕΟΡΥΑ-ΑΧ4,2020-01-24,ΑΝΑΛΗΨΗ ΥΠΟΧΡΕΩΣΗΣ,ΔΕΣΜΕΥΣΗ ΠΙΣΤΩΣΗΣ ΠΡΟΜΗΘΕΙΑΣ ΠΟΣΙΜΟΥ ΝΕΡΟΥ,,,,,,,,https://diavgeia.gov.gr/doc/ΩΘ8ΕΟΡΥΑ-ΑΧ4
proc:299829543645,50449,2020,1,6ΒΕΝΟΡΥΑ-ΝΝΞ,2020-01-28,ΑΝΑΘΕΣΗ ΕΡΓΩΝ / ΠΡΟΜΗΘΕΙΩΝ / ΥΠΗΡΕΣΙΩΝ / ΜΕΛΕΤΩΝ,ΠΡΟΜΗΘΕΙΑ ΑΝΤΑΛΛΑΚΤΙΚΩΝ ΦΙΛΤΡΩΝ ΑΠΟΣΜΗΣΗΣ ΓΙΑ ΤΗΝ ΕΕΛ ΒΙΠΕ,,,,,,,,https://diavgeia.gov.gr/doc/6ΒΕΝΟΡΥΑ-ΝΝΞ
proc:e6b83afd427c,50449,2020,1,6ΓΗ6ΟΡΥΑ-ΑΕΠ,2020-01-28,ΑΝΑΘΕΣΗ ΕΡΓΩΝ / ΠΡΟΜΗΘΕΙΩΝ / ΥΠΗΡΕΣΙΩΝ / ΜΕΛΕΤΩΝ,ανάθεση προμήθειας αγοράς καθισμάτων,,,,,,,,https://diavgeia.gov.gr/doc/6ΓΗ6ΟΡΥΑ-ΑΕΠ
proc:199e90e778ae,50449,2020,1,6ΠΔ1ΟΡΥΑ-Χ4Χ,2020-01-28,ΑΝΑΘΕΣΗ ΕΡΓΩΝ / ΠΡΟΜΗΘΕΙΩΝ / ΥΠΗΡΕΣΙΩΝ / ΜΕΛΕΤΩΝ,προμηθεια καθισμάτων και επιπλων,,,,,,,,https://diavgeia.gov.gr/doc/6ΠΔ1ΟΡΥΑ-Χ4Χ
proc:4996ecfb6ce0,50449,2020,1,ΩΑΣΜΟΡΥΑ-ΝΩ3,2020-01-28,ΑΝΑΘΕΣΗ ΕΡΓΩΝ / ΠΡΟΜΗΘΕΙΩΝ / ΥΠΗΡΕΣΙΩΝ / ΜΕΛΕΤΩΝ,Ανάθεση κατασκευής και προμήθειας πάνελ (εξέδρας),,,,,,,,https://diavgeia.gov.gr/doc/ΩΑΣΜΟΡΥΑ-ΝΩ3
proc:5a9f63b329ba,50449,2020,1,6503ΟΡΥΑ-Α18,2020-01-29,ΕΓΚΡΙΣΗ ΔΑΠΑΝΗΣ,ΔΕΣΜΕΥΣΗ ΠΙΣΤΩΣΗ ΓΙΑ ΑΠΟΖΗΜΙΩΣΗ ΖΗΜΙΑΣ ΑΥΤ/ΤΟΥ ΠΟΥ ΥΠΕΣΤΗ ΜΕΤΑ ΑΠΟ ΠΡΟΣΚΡΟΥΣΗ ΤΟΥ ΣΕ ΦΡΕΑΤΙΟ,,,,,,,,https://diavgeia.gov.gr/doc/6503ΟΡΥΑ-Α18
proc:0b78592fc97e,50449,2020,1,99ΚΗΟΡΥΑ-ΔΡ9,2020-01-29,ΑΝΑΘΕΣΗ ΕΡΓΩΝ / ΠΡΟΜΗΘΕΙΩΝ / ΥΠΗΡΕΣΙΩΝ / ΜΕΛΕΤΩΝ,"«ΠΡΟΜΗΘΕΙΑ ΜΠΑΤΑΡΙΩΝ ΛΙΘΙΟΥ R20-D(B)» (Αριθμός αναφοράς:ΤΘ0375/2019)»,",,,,,,,,https://diavgeia.gov.gr/doc/99ΚΗΟΡΥΑ-ΔΡ9
proc:e0c19d0d25c1,50449,2020,1,ΨΩΒΟΟΡΥΑ-Ξ7Γ,2020-01-29,ΑΝΑΛΗΨΗ ΥΠΟΧΡΕΩΣΗΣ,ΠΡΟΜΗΘΕΙΑ ΤΕΣΣΑΡΩΝ ΤΟΝΝΩΝ ΠΟΛΥΗΛΕΚΤΡΟΛΥΤΗ,,,,,,,,https://diavgeia.gov.gr/doc/ΨΩΒΟΟΡΥΑ-Ξ7Γ
proc:04d39554ce9a,50449,2020,1,6Ε9ΣΟΡΥΑ-ΡΥΛ,2020-01-30,ΚΑΤΑΚΥΡΩΣΗ,ΣΥΜΒΑΣΗ (Σ4/2020)«ΠΡΟΜΗΘΕΙΑ ΗΛΕΚΤΡΟΛΟΓΙΚΟΥ ΥΛΙΚΟΥ»,,,,,,,,https://diavgeia.gov.gr/doc/6Ε9ΣΟΡΥΑ-ΡΥΛ
proc:2df90d73e757,50449,2020,2,ΨΗΞΨΟΡΥΑ-ΧΙΙ,2020-02-04,ΑΝΑΘΕΣΗ ΕΡΓΩΝ / ΠΡΟΜΗΘΕΙΩΝ / ΥΠΗΡΕΣΙΩΝ / ΜΕΛΕΤΩΝ,ΠΡΟΜΗΘΕΙΑ ΔΥΟ ΥΠΟΒΡΥΧΙΩΝ ΑΝΤΛΗΤΙΚΩΝ ΣΥΓΚΡΟΤΗΜΑΤΩΝ,,,,,,,,https://diavgeia.gov.gr/doc/ΨΗΞΨΟΡΥΑ-ΧΙΙ
proc:ff34811cb385,50449,2020,2,ΨΧΧΝΟΡΥΑ-ΕΕΜ,2020-02-04,ΑΝΑΛΗΨΗ ΥΠΟΧΡΕΩΣΗΣ,ΠΡΟΜΗΘΕΙΑ ΠΕΤΡΕΛΑΙΟΥ ΘΕΡΜΑΝΣΗΣ ΓΙΑ ΤΗΝ ΕΓΚΑΤΑΣΤΑΣΗ ΤΗΛ/ΝΣΗΣ-ΔΙΚΑΙΩΜΑ ΠΡΟΑΙΡΕΣΗΣ,,,,,,,,https://diavgeia.gov.gr/doc/ΨΧΧΝΟΡΥΑ-ΕΕΜ
proc:887008d94567,50449,2020,2,ΩΤ9ΗΟΡΥΑ-0Α7,2020-02-04,ΟΡΙΣΤΙΚΟΠΟΙΗΣΗ ΠΛΗΡΩΜΗΣ,ΕΞΟΦΛΗΣΗ ΤΙΜ-14898 (ΠΡΟΜΗΘΕΙΑ ΕΙΔΙΚΩΝ ΕΞΑΡΤΗΜΑΤΩΝ ΥΔΡΕΥΣΗΣ),,,,,,,,https://diavgeia.gov.gr/doc/ΩΤ9ΗΟΡΥΑ-0Α7
proc:9bd7a5f90c2e,50449,2020,2,Ψ7ΘΒΟΡΥΑ-ΨΛ2,2020-02-05,ΑΝΑΛΗΨΗ ΥΠΟΧΡΕΩΣΗΣ,ΠΡΟΜΗΘΕΙΑ ΛΟΓΙΣΜΙΚΟΥ (ΛΕΙΤΟΥΡΓΙΚΟY ΣΥΣΤΗΜΑΤΟΣ ΔΙΚΤΥΟΥ-ΑΣΦΑΛΕΙΑ),,,,,,,,https://diavgeia.gov.gr/doc/Ψ7ΘΒΟΡΥΑ-ΨΛ2
proc:04242442a5a8,50449,2020,2,66ΧΥΟΡΥΑ-ΠΒΖ,2020-02-06,ΑΝΑΘΕΣΗ ΕΡΓΩΝ / ΠΡΟΜΗΘΕΙΩΝ / ΥΠΗΡΕΣΙΩΝ / ΜΕΛΕΤΩΝ,ΠΡΟΜΗΘΕΙΑΣ ΤΕΣΣΑΡΩΝ (4) ΤΟΝΝΩΝ ΠΟΛΥΗΛΕΚΤΡΟΛΥΤΗ,,,,,,,,https://diavgeia.gov.gr/doc/66ΧΥΟΡΥΑ-ΠΒΖ
proc:d59aad7d670b,50449,2020,2,650ΙΟΡΥΑ-ΞΓ6,2020-02-07,ΠΕΡΙΛΗΨΗ ΔΙΑΚΗΡΥΞΗΣ,"«ΠΡΟΜΗΘΕΙΑ ΠΟΛΥΗΛΕΚΤΡΟΛΥΤΗ», (Αρ. Δ.: 17/2019)",,,,,,,,https://diavgeia.gov.gr/doc/650ΙΟΡΥΑ-ΞΓ6
proc:8cddca402ca6,50449,2020,2,6904ΟΡΥΑ-4Κ3,2020-02-07,ΑΝΑΛΗΨΗ ΥΠΟΧΡΕΩΣΗΣ,ΠΡΟΜΗΘΕΙΑ ΟΙΚΟΔΟΜΙΚΩΝ ΕΡΓΑΛΕΙΩΝ,,,,,,,,https://diavgeia.gov.gr/doc/6904ΟΡΥΑ-4Κ3
proc:24646943981b,50449,2020,2,6ΙΑΟΟΡΥΑ-Η45,2020-02-07,ΟΡΙΣΤΙΚΟΠΟΙΗΣΗ ΠΛΗΡΩΜΗΣ,ΕΞΟΦΛΗΣΗ ΤΔΑ-2432 (ΠΡΟΜΗΘΕΙΑ ΥΛΙΚΩΝ ΥΔΡΕΥΣΗΣ-ΑΠΟΧΕΤΕΥΣΗΣ),,,,,,,,https://diavgeia.gov.gr/doc/6ΙΑΟΟΡΥΑ-Η45
proc:ee17b29818aa,50449,2020,2,9Ι1ΧΟΡΥΑ-ΜΡ1,2020-02-07,ΚΑΤΑΚΥΡΩΣΗ,ΣΥΜΒΑΣΗ   7/2020 Π ΣΥΝΤ & ΥΠΟΣΤΗΡ ΓΙΑ ΜΗΧΑΝΟΓΡΑΦΙΚΕΣ ΕΦΑΡΜ (ΑΝΑΘΕΣΗ),,,,,,,,https://diavgeia.gov.gr/doc/9Ι1ΧΟΡΥΑ-ΜΡ1
proc:81db38db28cf,50449,2020,2,ΨΑ1ΗΟΡΥΑ-1ΙΛ,2020-02-07,ΑΝΑΛΗΨΗ ΥΠΟΧΡΕΩΣΗΣ,ΠΡΟΜΗΘΕΙΑ ΜΙΚΡΟΕΡΓΑΛΕΙΩΝ ΧΕΙΡΟΣ,,,,,,,,https://diavgeia.gov.gr/doc/ΨΑ1ΗΟΡΥΑ-1ΙΛ
proc:f81356a54ddc,50449,2020,2,ΨΓ9ΘΟΡΥΑ-8ΞΦ,2020-02-07,ΟΡΙΣΤΙΚΟΠΟΙΗΣΗ ΠΛΗΡΩΜΗΣ,ΕΞΟΦΛΗΣΗ ΤΙΜ-6975 (ΠΡΟΜΗΘΕΙΑ ΕΞΟΠΛΙΣΜΟΥ ΑΠΟΜΑΚΡΥΣΜΕΝΗΣ ΑΝΑΓΝΩΣΗΣ ΜΕΤΡΗΣΕΩΝ),,,,,,,,https://diavgeia.gov.gr/doc/ΨΓ9ΘΟΡΥΑ-8ΞΦ
proc:ac2598398d37,50449,2020,2,ΨΖΓ5ΟΡΥΑ-ΞΦ7,2020-02-07,ΚΑΤΑΚΥΡΩΣΗ,ΣΥΜΒΑΣΗ  8/2020 Π ΣΥΝΤ & ΥΠΟΣΤ ΕΜΦΑΚΕΛΛΩΤΙΚΩΝ ΜΗΧ (ΑΝΑΘΕΣΗ),,,,,,,,https://diavgeia.gov.gr/doc/ΨΖΓ5ΟΡΥΑ-ΞΦ7
proc:2209e22f02f8,50449,2020,2,ΨΤΕΦΟΡΥΑ-4ΤΙ,2020-02-07,ΑΝΑΛΗΨΗ ΥΠΟΧΡΕΩΣΗΣ,ΠΡΟΜΗΘΕΙΑ ΣΙΔΗΡΟΥΡΓΙΚΩΝ ΕΙΔΩΝ,,,,,,,,https://diavgeia.gov.gr/doc/ΨΤΕΦΟΡΥΑ-4ΤΙ
proc:7a28c26adf1e,50449,2020,2,ΩΔΩΨΟΡΥΑ-Λ9Σ,2020-02-07,ΟΡΙΣΤΙΚΟΠΟΙΗΣΗ ΠΛΗΡΩΜΗΣ,ΕΞΟΦΛΗΣΗ ΤΔΑ-1200 (ΠΡΟΜΗΘΕΙΑ ΧΥΤΟΣΙΔΗΡΑ ΥΔΡΕΥΣΗΣ-ΑΠΟΧΕΤΕΥΣΗΣ),,,,,,,,https://diavgeia.gov.gr/doc/ΩΔΩΨΟΡΥΑ-Λ9Σ
proc:e05c8f5e7f49,50449,2020,2,662ΕΟΡΥΑ-ΒΚ2,2020-02-10,ΟΡΙΣΤΙΚΟΠΟΙΗΣΗ ΠΛΗΡΩΜΗΣ,ΕΞΟΦΛΗΣΗ ΤΔΑ-226608 (ΠΡΟΜΗΘΕΙΑ ΟΙΚΟΔΟΜΙΚΩΝ ΥΛΙΚΩΝ),,,,,,,,https://diavgeia.gov.gr/doc/662ΕΟΡΥΑ-ΒΚ2
proc:41139e81caf1,50449,2020,2,6ΙΧ8ΟΡΥΑ-ΧΣ8,2020-02-10,ΣΥΜΒΑΣΗ,(Σ010 / 2020) ΠΡΟΣΘΕΤΗ ΠΡΑΞΗ ΤΡΟΠΟΠΟΙΗΣΗΣ ΤΗΣ  ΑΡΧΙΚΗΣ ΣΥΜΒΑΣΗΣ “ΠΡΟΜΗΘΕΙΑ ΠΕΤΡΕΛΑΙΟΥ ΘΕΡΜΑΝΣΗΣ ΓΙΑ ΤΗΝ ΕΓΚΑΤΑΣΤΑΣΗ ΤΗΛΕΘΕΡΜΑΝΣΗΣ ΚΟΖΑΝΗΣ ΓΙΑ ΤΑ ΕΤΗ 2018 & 2019»-  Αριθμός Αναφοράς: ΤΘ 0347/2018,,,,,,,,https://diavgeia.gov.gr/doc/6ΙΧ8ΟΡΥΑ-ΧΣ8
proc:9735a9783517,50449,2020,2,Ψ08ΡΟΡΥΑ-Λ09,2020-02-10,ΣΥΜΒΑΣΗ,ΣΥΜΒΑΣΗ Σ9/2020 ΓΙΑ ΑΠΟΣΤΟΛΗ ΤΑΧΥΔΡΟΜΙΚΩΝ ΑΝΤΙΚΕΙΜΕΝΩΝ ΕΠΙΣΤΟΛΙΚΟΥ ΤΑΧΥΔΡΟΜΕΙΟΥ & ΔΕΜΑΤΩΝ,,,,,,,,https://diavgeia.gov.gr/doc/Ψ08ΡΟΡΥΑ-Λ09
proc:7d7b86c9e3f9,50449,2020,2,ΩΝΧ0ΟΡΥΑ-ΨΒΕ,2020-02-10,ΕΓΚΡΙΣΗ ΔΑΠΑΝΗΣ,ΚΑΤΑΒΟΛΗ ΠΑΡΑΒΟΛΟΥ ΜΗΤΡΩΟΥ ΕΜΠΟΡΙΑΣ ΕΚΠΟΜΠΩΝ ΑΕΡΙΩΝ ΘΕΡΜΟΚΗΠΙΟΥ ΕΤΟΥΣ 2020,,,,,,,,https://diavgeia.gov.gr/doc/ΩΝΧ0ΟΡΥΑ-ΨΒΕ
proc:e4cd654e7597,50449,2020,2,63ΣΜΟΡΥΑ-Τ7Χ,2020-02-11,ΑΝΑΛΗΨΗ ΥΠΟΧΡΕΩΣΗΣ,ΠΡΟΜΗΘΕΙΑ ΜΙΚΡΟΥΛΙΚΩΝ ΓΙΑ ΣΥΝΤΗΡΗΣΗ ΤΜΗΜΑΤΟΣ ΒΙΟΛΟΓΙΚΟΥ ΚΑΘΑΡΙΣΜΟΥ,,,,,,,,https://diavgeia.gov.gr/doc/63ΣΜΟΡΥΑ-Τ7Χ
proc:4d3ce807ba30,50449,2020,2,65Θ3ΟΡΥΑ-ΚΝΛ,2020-02-11,ΑΝΑΛΗΨΗ ΥΠΟΧΡΕΩΣΗΣ,ΠΡΟΜΗΘΕΙΑ ΠΕΤΡΕΛΑΙΟΥ ΘΕΡΜΑΝΣΗΣ ΓΙΑ ΤΗΝ ΕΓΚΑΤΑΣΤΑΣΗ ΤΗΛ/ΝΣΗΣ ΚΟΖΑΝΗΣ 2020-2022,,,,,,,,https://diavgeia.gov.gr/doc/65Θ3ΟΡΥΑ-ΚΝΛ
proc:318ed6169a1f,50449,2020,2,ΨΓΔΙΟΡΥΑ-ΗΤΦ,2020-02-11,ΚΑΝΟΝΙΣΤΙΚΗ ΠΡΑΞΗ,Έγκριση  όρων διενέργειας συνοπτικού διαγωνισμού για την «προμήθεια λογισμικού» αριθ. διακηρ.2/2020.,,,,,,,,https://diavgeia.gov.gr/doc/ΨΓΔΙΟΡΥΑ-ΗΤΦ
proc:4d81e93a24ab,50449,2020,2,ΨΧ4ΦΟΡΥΑ-ΩΞΨ,2020-02-11,ΚΑΝΟΝΙΣΤΙΚΗ ΠΡΑΞΗ,Έγκρισή μελέτης & όρων διεξαγωγής Ηλεκτρονικού Ανοικτού Μειοδοτικού διαγωνισμού για την  :  «Προμήθεια πετρελαίου θέρμανσης για την εγκατάσταση ΤΗΛ/ΝΣΗΣ Κοζάνης για την περίοδο 2020-2022» - Αριθμός αναφοράς : ΤΘ 0378/2020,,,,,,,,https://diavgeia.gov.gr/doc/ΨΧ4ΦΟΡΥΑ-ΩΞΨ
proc:4c4696d5678e,50449,2020,2,ΩΒΦ1ΟΡΥΑ-ΝΘΟ,2020-02-11,ΚΑΝΟΝΙΣΤΙΚΗ ΠΡΑΞΗ,Ανάθεση εκτέλεσης γεωτεχνικών ερευνών στη περιοχή της ΕΕΛ Κοζάνης.,,,,,,,,https://diavgeia.gov.gr/doc/ΩΒΦ1ΟΡΥΑ-ΝΘΟ
proc:26ce747519e2,50449,2020,2,ΩΤΖΩΟΡΥΑ-ΤΥΤ,2020-02-11,ΚΑΝΟΝΙΣΤΙΚΗ ΠΡΑΞΗ,Έγκριση 1ου & 2ου πρακτικού επιτροπής ανοικτού ηλεκτρονικού μειοδοτικού διαγωνισμού «Προμήθεια θερμιδόμετρων και ροομέτρων Θ/Υ» ΑΡ. ΑΝΑΦΟΡΑΣ : Τ/Θ 0376/2019.,,,,,,,,https://diavgeia.gov.gr/doc/ΩΤΖΩΟΡΥΑ-ΤΥΤ
proc:4a1e19085444,50449,2020,2,6Ξ0ΓΟΡΥΑ-ΣΕ2,2020-02-12,ΑΝΑΘΕΣΗ ΕΡΓΩΝ / ΠΡΟΜΗΘΕΙΩΝ / ΥΠΗΡΕΣΙΩΝ / ΜΕΛΕΤΩΝ,ΕΡΓΟ: «ΑΠΟΚΑΤΑΣΤΑΣΗ ΑΣΦΑΛΤΙΚΩΝ ΤΟΜΩΝ ΟΔΟΣΤΡΩΜΑΤΟΣ ΔΗΜΟΥ ΚΟΖΑΝΗΣ 2019-2020»,,,,,,,,https://diavgeia.gov.gr/doc/6Ξ0ΓΟΡΥΑ-ΣΕ2
proc:fa7deff69573,50449,2020,2,ΨΞ86ΟΡΥΑ-ΣΒΜ,2020-02-12,ΕΓΚΡΙΣΗ ΔΑΠΑΝΗΣ,ΔΕΣΜΕΥΣΗ ΠΙΣΤΩΣΗΣ ΓΙΑ ΕΞΟΔΑ ΥΠΟΔΟΧΗΣ & ΦΙΛΟΞΕΝΙΑΣ,,,,,,,,https://diavgeia.gov.gr/doc/ΨΞ86ΟΡΥΑ-ΣΒΜ
proc:ed2bcebb1303,50449,2020,2,Ω3ΡΘΟΡΥΑ-ΞΧΖ,2020-02-13,ΑΝΑΛΗΨΗ ΥΠΟΧΡΕΩΣΗΣ,ΠΡΟΜΗΘΕΙΑ ΚΑΡΤΩΝ PLC,,,,,,,,https://diavgeia.gov.gr/doc/Ω3ΡΘΟΡΥΑ-ΞΧΖ
proc:e0217e48d347,50449,2020,2,62ΖΡΟΡΥΑ-Θ6Κ,2020-02-14,ΑΝΑΛΗΨΗ ΥΠΟΧΡΕΩΣΗΣ,ΠΡΟΜΗΘΕΙΑ ΘΥΡΟΦΡΑΓΜΑΤΩΝ & ΕΠΙΣΚΕΥΗ ΓΕΦΥΡΑΣ ΠΡΟΕΠΕΞΕΡΓΑΣΙΑΣ,,,,,,,,https://diavgeia.gov.gr/doc/62ΖΡΟΡΥΑ-Θ6Κ
proc:ad5b732b86c2,50449,2020,2,6Σ5ΝΟΡΥΑ-ΩΓ7,2020-02-17,ΑΝΑΘΕΣΗ ΕΡΓΩΝ / ΠΡΟΜΗΘΕΙΩΝ / ΥΠΗΡΕΣΙΩΝ / ΜΕΛΕΤΩΝ,"ΣΥΜΒΑΣΗ  Σ12/2020 
 «ΑΝΑΘΕΣΗ ΠΡΟΜΗΘΕΙΑΣ ΠΟΛΥΗΛΕΚΤΡΟΛΥΤΗ»",,,,,,,,https://diavgeia.gov.gr/doc/6Σ5ΝΟΡΥΑ-ΩΓ7
proc:494fe138ca81,50449,2020,2,ΩΦΝ9ΟΡΥΑ-8ΧΓ,2020-02-18,ΑΝΑΛΗΨΗ ΥΠΟΧΡΕΩΣΗΣ,ΠΡΟΜΗΘΕΙΑ ΜΕΡΩΝ ΔΙΑΦΟΡΩΝ ΜΗΧΑΝΗΜΑΤΩΝ ΓΙΑ ΕΞΟΠΛΙΣΜΟ ΤΜΗΜ. ΒΙΟΛΟΓΙΚΟΥ ΚΑΘΑΡΙΣΜΟΥ,,,,,,,,https://diavgeia.gov.gr/doc/ΩΦΝ9ΟΡΥΑ-8ΧΓ
proc:8bab5885c920,50449,2020,2,6684ΟΡΥΑ-ΟΟ5,2020-02-19,ΚΑΤΑΚΥΡΩΣΗ,ΣΥΜΒΑΣΗ (Σ13/2020) ΑΝΑΘΕΣΗ ΠΡΟΜΗΘΕΙΑΣ ΟΛΟΚΛΗΡΩΜΕΝΟΥ ΣΥΣΤΗΜΑΤΟΣ ΕΞΥΠΗΡΕΤΗΤΗ ΔΙΚΤΥΟΥ & ΛΕΙΤΟΥΡΓΙΚΟΥ ΣΥΣΤΗΜΑΤΟΣ ΓΙΑ ΤΟ GIS,,,,,,,,https://diavgeia.gov.gr/doc/6684ΟΡΥΑ-ΟΟ5
proc:7fa956d542fd,50449,2020,2,6ΜΥΣΟΡΥΑ-1Τ5,2020-02-19,ΑΝΑΛΗΨΗ ΥΠΟΧΡΕΩΣΗΣ,ΠΡΟΜΗΘΕΙΑ ΞΥΛΕΙΑΣ,,,,,,,,https://diavgeia.gov.gr/doc/6ΜΥΣΟΡΥΑ-1Τ5
proc:1995137ea2f1,50449,2020,2,ΩΕΥΑΟΡΥΑ-Α2Χ,2020-02-19,ΑΝΑΛΗΨΗ ΥΠΟΧΡΕΩΣΗΣ,ΠΡΟΜΗΘΕΙΑ ΔΙΑΦΟΡΩΝ ΑΝΑΛΩΣΙΜΩΝ ΥΛΙΚΩΝ ΥΔΡΕΥΣΗΣ-ΑΠΟΧΕΤΕΥΣΗΣ,,,,,,,,https://diavgeia.gov.gr/doc/ΩΕΥΑΟΡΥΑ-Α2Χ
proc:8c020ea7ae2c,50449,2020,2,697ΟΟΡΥΑ-Π1Δ,2020-02-21,ΑΝΑΛΗΨΗ ΥΠΟΧΡΕΩΣΗΣ,ΠΡΟΜΗΘΕΙΑ ΚΑΥΣΙΜΩΝ ΚΙΝΗΣΗΣ,,,,,,,,https://diavgeia.gov.gr/doc/697ΟΟΡΥΑ-Π1Δ
proc:016e86d4fcea,50449,2020,2,6ΙΧ4ΟΡΥΑ-ΤΛΙ,2020-02-21,ΑΝΑΛΗΨΗ ΥΠΟΧΡΕΩΣΗΣ,ΠΡΟΜΗΘΕΙΑ ΥΠΗΡΕΣΙΩΝ ΜΑΖΙΚΗΣ ΑΠΟΣΤΟΛΗΣ ΜΗΝΥΜΑΤΩΝ,,,,,,,,https://diavgeia.gov.gr/doc/6ΙΧ4ΟΡΥΑ-ΤΛΙ
proc:d0e5e7142d99,50449,2020,2,ΨΒΟΡΟΡΥΑ-33Β,2020-02-21,ΑΝΑΘΕΣΗ ΕΡΓΩΝ / ΠΡΟΜΗΘΕΙΩΝ / ΥΠΗΡΕΣΙΩΝ / ΜΕΛΕΤΩΝ,Μελέτες Περιβαλλοντικών Επιπτώσεων υδραγωγείων Δ.Ε. Ελίμειας και Αιανής του Δήμου Κοζάνης (Σ14/2020),,,,,,,,https://diavgeia.gov.gr/doc/ΨΒΟΡΟΡΥΑ-33Β
