procurement_key,org,year,month,ada,issue_date,decision_type,subject,amount,amount_source,supplier_key,supplier_name,supplier_tax_id,signer,unit,url
proc:bb8babc22bdd,50449,2024,10,ΡΡΨΙΟΡΥΑ-86Μ,2024-10-23,ΚΑΤΑΚΥΡΩΣΗ,ΣΥΜΒΑΣΗ (Σ71/2024) ΠΡΟΜΗΘΕΙΑ ΔΙΑΦΟΡΩΝ ΑΝΑΛΩΣΙΜΩΝ ΥΛΙΚΩΝ ΥΔΡΕΥΣΗΣ – ΑΠΟΧΕΤΕΥΣΗΣ,,,,,,,,https://diavgeia.gov.gr/doc/ΡΡΨΙΟΡΥΑ-86Μ
proc:22eb266660a3,50449,2024,10,6Ζ6ΡΟΡΥΑ-ΠΣΗ,2024-10-25,ΚΑΝΟΝΙΣΤΙΚΗ ΠΡΑΞΗ,Έγκριση παράτασης διάρκειας προγραμματικής σύμβασης Σ48/2024 με τίτλο: «Σύσταση δουλείας και απαλλοτρίωση στο πλαίσιο κατασκευής – διέλευσης αγωγού ομβρίων υδάτων της Τ.Κ. (Νέας) Ποντοκώμης».,,,,,,,,https://diavgeia.gov.gr/doc/6Ζ6ΡΟΡΥΑ-ΠΣΗ
proc:986f9ca61d4e,50449,2024,10,Ψ4Ρ7ΟΡΥΑ-ΟΕ7,2024-10-25,ΚΑΝΟΝΙΣΤΙΚΗ ΠΡΑΞΗ,Έγκριση Τροποποίησης φακέλου δημόσιας σύμβασης της τεχνικής υπηρεσίας με τίτλο: «Τεχνική βοήθεια για την κατασκευή του έργου: ΑΝΤΙΠΛΗΜΜΥΡΙΚΗ ΠΡΟΣΤΑΣΙΑ ΝΟΤΙΟΔΥΤΙΚΗΣ ΠΛΕΥΡΑΣ ΠΟΛΗΣ ΚΟΖΑΝΗΣ».,,,,,,,,https://diavgeia.gov.gr/doc/Ψ4Ρ7ΟΡΥΑ-ΟΕ7
proc:b00876d50883,50449,2024,10,Ψ4ΣΞΟΡΥΑ-ΛΡΗ,2024-10-25,ΚΑΝΟΝΙΣΤΙΚΗ ΠΡΑΞΗ,"Έγκριση παράτασης σύμβασης προμήθειας Διαλύματος υποχλωριώδους νατρίου (Χλωρίου), Σ74/2023.",,,,,,,,https://diavgeia.gov.gr/doc/Ψ4ΣΞΟΡΥΑ-ΛΡΗ
proc:b2e4e4cb6bd7,50449,2024,10,Ψ4ΨΑΟΡΥΑ-ΤΓΕ,2024-10-25,ΚΑΝΟΝΙΣΤΙΚΗ ΠΡΑΞΗ,Έγκριση Παράτασης της με αριθμό Σ10/2024 σύμβασης με τίτλο: «Εκποίηση πεπαλαιωμένων μη επαναχρησιμοποιήσιμων υλικών» με αριθμό αναφοράς ΤΘ 0455/2022.,,,,,,,,https://diavgeia.gov.gr/doc/Ψ4ΨΑΟΡΥΑ-ΤΓΕ
proc:b72f4b89622d,50449,2024,10,Ψ5ΖΖΟΡΥΑ-ΓΓΘ,2024-10-25,ΑΝΑΛΗΨΗ ΥΠΟΧΡΕΩΣΗΣ,ΠΡΟΜΗΘΕΙΑ ΣΥΝΔΡΟΜΗΤΙΚΩΝ ΕΙΔΙΚΩΝ ΥΠ.ΕΦΑΡΜΟΓΩΝ ΛΟΓΙΣΜΙΚΟΥ ΓΙΑ ΚΑΛΥΨΗ ΑΝΑΓΚΩΝ ΤΘ,,,,,,,,https://diavgeia.gov.gr/doc/Ψ5ΖΖΟΡΥΑ-ΓΓΘ
proc:cdc52666a40f,50449,2024,10,ΨΜΙ1ΟΡΥΑ-ΑΗΘ,2024-10-25,ΚΑΝΟΝΙΣΤΙΚΗ ΠΡΑΞΗ,"Έγκριση 1ου πρακτικού αποσφράγισης δικαιολογητικών συμμετοχής – Τεχνικής προσφοράς και Οικονομικής προσφοράς  ηλεκτρονικού ανοικτού διαγωνισμού με τίτλο: «ΠΡΟΜΗΘΕΙΑ : Α. ΔΙΑΛΥΜΑΤΟΣ ΥΠΟΧΛΩΡΙΩΔΟΥΣ ΝΑΤΡΙΟΥ ΚΑΙ Β. ΔΙΑΛΥΜΑΤΟΣ ΔΙΣΘΕΝΟΥΣ ΧΛΩΡΙΟΥΧΟΥ ΣΙΔΗΡΟΥ ΓΙΑ  ΤΙΣ ΑΝΑΓΚΕΣ ΤΗΣ ΔΕΥΑ ΚΟΖΑΝΗΣ ΓΙΑ ΕΝΑ ΧΡΟΝΟ 2024-2025», (Αρ. Διακ.: 14/2024)",,,,,,,,https://diavgeia.gov.gr/doc/ΨΜΙ1ΟΡΥΑ-ΑΗΘ
proc:93543f9b2d1a,50449,2024,10,ΨΟΧ3ΟΡΥΑ-Η5Υ,2024-10-25,ΚΑΝΟΝΙΣΤΙΚΗ ΠΡΑΞΗ,Έγκριση παράτασης σύμβασης Παροχής Υπηρεσίας Σ73/2023 με τίτλο «ΜΕΤΑΦΟΡΑ ΝΕΡΟΥ».,,,,,,,,https://diavgeia.gov.gr/doc/ΨΟΧ3ΟΡΥΑ-Η5Υ
proc:baa0a9106969,50449,2024,11,ΨΧΚΕΟΡΥΑ-ΛΧ2,2024-11-05,ΠΕΡΙΛΗΨΗ ΔΙΑΚΗΡΥΞΗΣ,ΠΡΟΜΗΘΕΙΑ ΟΛΟΚΛΗΡΩΤΩΝ ΘΕΡΜΙΚΗΣ ΕΝΕΡΓΕΙΑΣ ΓΙΑ ΤΗΝ ΚΑΛΥΨΗ ΑΝΑΓΚΩΝ ΤΗΣ ΕΓΚΑΤΑΣΤΑΣΗΣ ΤΗΛΕΘΕΡΜΑΝΣΗΣ ΚΟΖΑΝΗΣ – ΠΕΡΙΟΔΟΣ ΛΕΙΤΟΥΡΓΙΑΣ 2024/2025,,,,,,,,https://diavgeia.gov.gr/doc/ΨΧΚΕΟΡΥΑ-ΛΧ2
proc:b483fef2c185,50449,2024,11,94ΚΖΟΡΥΑ-ΧΦΛ,2024-11-06,ΚΑΝΟΝΙΣΤΙΚΗ ΠΡΑΞΗ,Έγκριση  αποζημίωσης    καταγγελίας σύμβασης εργαζόμενου   λόγω συνταξιοδότησης.,,,,,,,,https://diavgeia.gov.gr/doc/94ΚΖΟΡΥΑ-ΧΦΛ
proc:2a8275d890ab,50449,2024,11,9ΤΝΖΟΡΥΑ-Ι9Χ,2024-11-06,ΑΝΑΘΕΣΗ ΕΡΓΩΝ / ΠΡΟΜΗΘΕΙΩΝ / ΥΠΗΡΕΣΙΩΝ / ΜΕΛΕΤΩΝ,"Σ 72 / 2024: Παροχή Νομικών Υπηρεσιών για την Προετοιμασία, διαχείριση και υλοποίηση Δημοσίων Συμβάσεων Έργων Προμηθειών και Υπηρεσιών στην ΔΗΜΟΤΙΚΗ ΕΠΙΧΕΙΡΗΣΗ ΥΔΡΕΥΣΗΣ ΑΠΟΧΕΤΕΥΣΗΣ ΚΟΖΑΝΗΣ",,,,,,,,https://diavgeia.gov.gr/doc/9ΤΝΖΟΡΥΑ-Ι9Χ
proc:02e1b2168565,50449,2024,11,9Χ50ΟΡΥΑ-7Β2,2024-11-06,ΚΑΝΟΝΙΣΤΙΚΗ ΠΡΑΞΗ,Έγκριση ανάθεσης υπηρεσίας για την Εκποίηση Παλαιών Μη Επαναχρησιμοποιήσιμων Μετάλλων Παντός Τύπου  - Αριθμός αναφοράς ΤΘ 0529/2024.,,,,,,,,https://diavgeia.gov.gr/doc/9Χ50ΟΡΥΑ-7Β2
proc:8390c483beba,50449,2024,11,ΨΚΒΖΟΡΥΑ-ΔΘΠ,2024-11-06,ΚΑΝΟΝΙΣΤΙΚΗ ΠΡΑΞΗ,"Έγκριση παράτασης σύμβασης Σ72/2023 με τίτλο «Παροχή Υπηρεσιών Προληπτικής Συντήρησης & Συντήρησης αποκατάστασης ηλεκτρολογικών εγκαταστάσεων Μέσης & Χαμηλής τάσης αντλιοστασίων Ύδρευσης, Τηλεθέρμανσης Κοζάνης & Αποχέτευσης»  (Αριθμός αναφοράς: ΤΘ 0476/2023)",,,,,,,,https://diavgeia.gov.gr/doc/ΨΚΒΖΟΡΥΑ-ΔΘΠ
proc:6ddf6e52425a,50449,2024,11,Ψ9ΞΨΟΡΥΑ-Ν06,2024-11-12,ΠΕΡΙΛΗΨΗ ΔΙΑΚΗΡΥΞΗΣ,"Παροχή Υπηρεσιών μέσω Σύμβασης Ενεργειακής Απόδοσης για την προμήθεια, εγκατάσταση, συντήρηση & λειτουργία τριών (3) Φωτοβολταϊκών σταθμών συνολικής εγκατεστημένης ισχύος 2.499,2 kWp",,,,,,,,https://diavgeia.gov.gr/doc/Ψ9ΞΨΟΡΥΑ-Ν06
proc:de0d6e053ec1,50449,2024,11,9Κ8ΧΟΡΥΑ-ΔΜ1,2024-11-13,ΑΝΑΛΗΨΗ ΥΠΟΧΡΕΩΣΗΣ,ΠΡΟΜΗΘΕΙΑ ΜΙΚΡΟΥΛΙΚΩΝ ΥΔΡΕΥΣΗΣ,,,,,,,,https://diavgeia.gov.gr/doc/9Κ8ΧΟΡΥΑ-ΔΜ1
proc:db5184c76fc4,50449,2024,11,ΨΨΘΨΟΡΥΑ-2ΞΙ,2024-11-13,ΑΝΑΛΗΨΗ ΥΠΟΧΡΕΩΣΗΣ,ΠΡΟΜΗΘΕΙΑ ΕΞΟΠΛΙΣΜΟΥ ΜΕΤΡΗΤΗ ΣΤΑΘΜΗΣ ΝΕΡΟΥ (ΣΤΑΘΜΗΜΕΤΡΟΥ),,,,,,,,https://diavgeia.gov.gr/doc/ΨΨΘΨΟΡΥΑ-2ΞΙ
proc:ba241e815386,50449,2024,11,Ρ1ΘΨΟΡΥΑ-ΗΨΕ,2024-11-15,ΛΟΙΠΕΣ ΑΤΟΜΙΚΕΣ ΔΙΟΙΚΗΤΙΚΕΣ ΠΡΑΞΕΙΣ,"ΠΡΟΣΚΛΗΣΗ ΕΚΔΗΛΩΣΗΣ ΕΝΔΙΑΦΕΡΟΝΤΟΣ ΓΙΑ ΥΠΟΒΟΛΗ
ΠΡΟΤΑΣΗΣ ΣΥΝΑΨΗΣ ΣΥΜΒΑΣΗΣ ΜΙΣΘΩΣΗΣ ΕΡΓΟΥ
ΥΠΟΣΤΗΡΙΞΗ ΤΟΥ ΕΡΓΟΥ: «PROMOTING URBAN RESILIENCE
THROUGH AN INTEGRATED ADVANCED DECISION SUPPORT
SYSTEM FOR FLOOD CONTROL - URBANFLOODS»",,,,,,,,https://diavgeia.gov.gr/doc/Ρ1ΘΨΟΡΥΑ-ΗΨΕ
proc:dae1c48205f0,50449,2024,11,ΨΟ7ΣΟΡΥΑ-3ΔΞ,2024-11-15,ΛΟΙΠΕΣ ΑΤΟΜΙΚΕΣ ΔΙΟΙΚΗΤΙΚΕΣ ΠΡΑΞΕΙΣ,"ΠΡΟΣΚΛΗΣΗ ΕΚΔΗΛΩΣΗΣ ΕΝΔΙΑΦΕΡΟΝΤΟΣ ΓΙΑ ΥΠΟΒΟΛΗ
ΠΡΟΤΑΣΗΣ ΣΥΝΑΨΗΣ ΣΥΜΒΑΣΗΣ ΜΙΣΘΩΣΗΣ ΕΡΓΟΥ
ΥΠΟΣΤΗΡΙΞΗ ΤΟΥ ΕΡΓΟΥ: «PROMOTING URBAN RESILIENCE
THROUGH AN INTEGRATED ADVANCED DECISION SUPPORT
SYSTEM FOR FLOOD CONTROL - URBANFLOODS»",,,,,,,,https://diavgeia.gov.gr/doc/ΨΟ7ΣΟΡΥΑ-3ΔΞ
proc:a84a575a5379,50449,2024,11,6560ΟΡΥΑ-Ρ7Π,2024-11-18,ΕΓΚΡΙΣΗ ΔΑΠΑΝΗΣ,ΕΞΟΦΛΗΣΗ ΤΙΜ-9,,,,,,,,https://diavgeia.gov.gr/doc/6560ΟΡΥΑ-Ρ7Π
proc:4ef70f177195,50449,2024,11,ΨΒΤΛΟΡΥΑ-ΞΜΜ,2024-11-18,ΑΝΑΛΗΨΗ ΥΠΟΧΡΕΩΣΗΣ,ΠΡΟΜΗΘΕΙΑ ΔΙΑΧΥΤΩΝ ΚΑΙ ΛΟΙΠΩΝ ΕΞΑΡΤΗΜΑΤΩΝ,,,,,,,,https://diavgeia.gov.gr/doc/ΨΒΤΛΟΡΥΑ-ΞΜΜ
proc:35a824e9e12f,50449,2024,11,9ΟΔΧΟΡΥΑ-Ε0Τ,2024-11-19,ΚΑΝΟΝΙΣΤΙΚΗ ΠΡΑΞΗ,Έγκριση Τροποποίησης Υφιστάμενης Σύμβασης Παροχής Θερμικής ενέργειας  για την εγκατάσταση Τηλεθέρμανσης Κοζάνης – Ρύθμισης Οφειλών ΔΕΥΑ ΚΟΖΑΝΗΣ από την ΔΕΗ ΑΕ,,,,,,,,https://diavgeia.gov.gr/doc/9ΟΔΧΟΡΥΑ-Ε0Τ
proc:9ad9c7fa6929,50449,2024,11,9ΡΗΖΟΡΥΑ-ΩΣ5,2024-11-19,ΚΑΝΟΝΙΣΤΙΚΗ ΠΡΑΞΗ,"Έγκριση σχεδίου Σύμβασης Παροχής Θερμικής Ενέργειας (ΣΠΘΕ) μεταξύ ΔΕΗ, ΔΙΑΤΗΔΥΜΑ Δήμων Κοζάνης, Εορδαίας και Αμυνταίου και ΔΕΥΑ ΚΟΖΑΝΗΣ, ΔΕΤΗΠ και ΔΕΤΕΠΑ",,,,,,,,https://diavgeia.gov.gr/doc/9ΡΗΖΟΡΥΑ-ΩΣ5
proc:b53b04bae3ac,50449,2024,11,ΨΞ7ΔΟΡΥΑ-ΖΝΕ,2024-11-21,ΑΝΑΛΗΨΗ ΥΠΟΧΡΕΩΣΗΣ,ΠΡΟΜΗΘΕΙΑ ΠΡΟ ΜΟΝΟΜΕΝΩΝ ΥΛΙΚΩΝ & ΕΞΑΡΤΗΜΑΤΩΝ ΓΙΑ ΤΗΝ ΣΥΝΤΗΡΗΣΗ ΤΟΥ ΔΙΚΤΥΟ ΤΘ,,,,,,,,https://diavgeia.gov.gr/doc/ΨΞ7ΔΟΡΥΑ-ΖΝΕ
proc:a784e60baa5b,50449,2024,11,9ΚΝ1ΟΡΥΑ-ΥΜΨ,2024-11-22,ΛΟΙΠΕΣ ΑΤΟΜΙΚΕΣ ΔΙΟΙΚΗΤΙΚΕΣ ΠΡΑΞΕΙΣ,συμβαση σ76/2024 ΥΠΟΣΤΗΡΙΞΗ ΤΗΣ ΥΠΗΡΕΣΙΑΣ ΤΗΛΕΘΕΡΜΑΝΣΗΣ ΔΕΥΑΚ ΓΙΑ ΤΗΝ ΔΗΜΟΠΡΑΤΗΣΗ ΤΟΥ ΕΡΓΟΥ ΚΑΤΑΣΚΕΥΗΣ ΝΕΩΝ ΑΝΤΛΙΟΣΤΑΣΙΩΝ ΤΗΛΕΘΕΡΜΑΝΣΗΣ ΣΤΟΝ ΑΗΣ ΚΑΡΔΙΑΣ ΚΑΙ ΣΤΟΝ ΚΑΣΛΑ ΚΟΖΑΝΗΣ,,,,,,,,https://diavgeia.gov.gr/doc/9ΚΝ1ΟΡΥΑ-ΥΜΨ
proc:2309088195e0,50449,2024,11,69ΒΞΟΡΥΑ-ΓΧ1,2024-11-25,ΚΑΝΟΝΙΣΤΙΚΗ ΠΡΑΞΗ,Έγκριση παράτασης εργασιακής σύμβασης.,,,,,,,,https://diavgeia.gov.gr/doc/69ΒΞΟΡΥΑ-ΓΧ1
proc:cc4cb902b96f,50449,2024,11,6ΤΓΚΟΡΥΑ-4Λ5,2024-11-25,ΑΝΑΘΕΣΗ ΕΡΓΩΝ / ΠΡΟΜΗΘΕΙΩΝ / ΥΠΗΡΕΣΙΩΝ / ΜΕΛΕΤΩΝ,ΠΡΟΜΗΘΕΙΑ ΥΛΙΚΩΝ ΥΔΡΕΥΣΗΣ – ΑΠΟΧΕΤΕΥΣΗΣ ΟΜΑΔΑ 2. ΣΩΛΗΝΩΝ ΚΑΙ ΕΙΔΙΚΩΝ ΤΕΜΑΧΙΩΝ  ΥΔΡΕΥΣΗΣ - ΑΠΟΧΕΤΕΥΣΗΣ,,,,,,,,https://diavgeia.gov.gr/doc/6ΤΓΚΟΡΥΑ-4Λ5
proc:7e7bbb63e43b,50449,2024,11,9ΑΒ1ΟΡΥΑ-ΝΔ3,2024-11-25,ΚΑΝΟΝΙΣΤΙΚΗ ΠΡΑΞΗ,Έγκριση ανάθεσης και κατακύρωση για την «Προμήθεια πολυηλεκτρολύτη για τις ανάγκες ενός έτους».,,,,,,,,https://diavgeia.gov.gr/doc/9ΑΒ1ΟΡΥΑ-ΝΔ3
proc:f172fc82bc57,50449,2024,11,9ΜΓΜΟΡΥΑ-52Ζ,2024-11-25,ΚΑΝΟΝΙΣΤΙΚΗ ΠΡΑΞΗ,Έγκριση παράτασης σύμβασης Σ79/2023 για την προμήθεια «Ειδών ατομικής προστασίας».,,,,,,,,https://diavgeia.gov.gr/doc/9ΜΓΜΟΡΥΑ-52Ζ
proc:36b4b7164e33,50449,2024,11,9Ω60ΟΡΥΑ-Ο61,2024-11-25,ΚΑΝΟΝΙΣΤΙΚΗ ΠΡΑΞΗ,Έγκριση ανάθεσης “Παροχή Υπηρεσιών Βελτίωσης λειτουργίας Θερμικών Υποσταθμών καταναλωτών Τηλεθέρμανσης Κοζάνης για την 32η Περίοδο λειτουργίας  2024/2025” με αριθμό αναφοράς: ΤΘ 0532/2024.,,,,,,,,https://diavgeia.gov.gr/doc/9Ω60ΟΡΥΑ-Ο61
proc:7098387485d3,50449,2024,11,ΡΞΡΗΟΡΥΑ-84Η,2024-11-25,ΑΝΑΘΕΣΗ ΕΡΓΩΝ / ΠΡΟΜΗΘΕΙΩΝ / ΥΠΗΡΕΣΙΩΝ / ΜΕΛΕΤΩΝ,ΠΡΟΜΗΘΕΙΑ ΥΛΙΚΩΝ ΥΔΡΕΥΣΗΣ – ΑΠΟΧΕΤΕΥΣΗΣ: ΟΜΑΔΑ 1. ΥΛΙΚΩΝ ΧΥΤΟΣΙΔΗΡΩΝ - ΕΙΔΙΚΑ ΤΕΜΑΧΙΑ,,,,,,,,https://diavgeia.gov.gr/doc/ΡΞΡΗΟΡΥΑ-84Η
proc:6133c828f2c9,50449,2024,11,Ψ3ΒΧΟΡΥΑ-0Γ5,2024-11-25,ΚΑΝΟΝΙΣΤΙΚΗ ΠΡΑΞΗ,Έγκριση “Προμήθειας Προμονωμένων Υλικών & Εξαρτημάτων  για την κάλυψη άμεσων λειτουργικών αναγκών συντήρησης  της εγκατάστασης Τηλεθέρμανσης Κοζάνης ” με αριθμό αναφοράς ΤΘ 0533/2024.,,,,,,,,https://diavgeia.gov.gr/doc/Ψ3ΒΧΟΡΥΑ-0Γ5
proc:045e72c62f06,50449,2024,11,ΨΒΝΣΟΡΥΑ-ΛΧΥ,2024-11-25,ΚΑΝΟΝΙΣΤΙΚΗ ΠΡΑΞΗ,Έγκριση 2ης παράτασης σύμβασης παροχής υπηρεσίας Σ80/2022 με αντικείμενο την επισκευή και συντήρηση αντλητικών συγκροτημάτων των γεωτρήσεων και αντλιοστασίων ύδρευσης.,,,,,,,,https://diavgeia.gov.gr/doc/ΨΒΝΣΟΡΥΑ-ΛΧΥ
proc:3ac89d4a60a5,50449,2024,11,ΨΟΝΘΟΡΥΑ-ΩΓ1,2024-11-25,ΑΝΑΘΕΣΗ ΕΡΓΩΝ / ΠΡΟΜΗΘΕΙΩΝ / ΥΠΗΡΕΣΙΩΝ / ΜΕΛΕΤΩΝ,ΠΡΟΜΗΘΕΙΑ ΥΛΙΚΩΝ ΥΔΡΕΥΣΗΣ – ΑΠΟΧΕΤΕΥΣΗΣ ΟΜΑΔΑ 3. ΕΙΔΙΚΩΝ ΕΞΑΡΤΗΜΑΤΩΝ (ΣΕΛΛΕΣ ΕΠΙΣΚΕΥΗΣ - ΦΛΑΝΤΖΩΖΥΜΠΩ),,,,,,,,https://diavgeia.gov.gr/doc/ΨΟΝΘΟΡΥΑ-ΩΓ1
proc:2f873e89bedb,50449,2024,11,ΨΧΛ4ΟΡΥΑ-1Β7,2024-11-25,ΚΑΝΟΝΙΣΤΙΚΗ ΠΡΑΞΗ,Έγκριση προμήθειας «Ταινιοφιλτροπρεσσών αφυδάτωσης και εξαρτημάτων αφυδάτωσης».,,,,,,,,https://diavgeia.gov.gr/doc/ΨΧΛ4ΟΡΥΑ-1Β7
proc:f085815a8750,50449,2024,11,66ΩΗΟΡΥΑ-Ε3Δ,2024-11-27,ΑΝΑΛΗΨΗ ΥΠΟΧΡΕΩΣΗΣ,ΠΡΟΜΗΘΕΙΑ ΑΔΡΑΝΩΝ ΥΛΙΚΩΝ,,,,,,,,https://diavgeia.gov.gr/doc/66ΩΗΟΡΥΑ-Ε3Δ
proc:a4bb7ad0e9c0,50449,2024,11,6ΩΘ1ΟΡΥΑ-95Β,2024-11-28,ΣΥΜΒΑΣΗ,ΣΥΜΒΑΣΗ ΑΠΟΣΤΟΛΗΣ ΛΟΓΑΡΙΑΣΜΩΝ ΔΕΥΑΚ,,,,,,,,https://diavgeia.gov.gr/doc/6ΩΘ1ΟΡΥΑ-95Β
proc:64d662e17220,50449,2024,12,60ΜΙΟΡΥΑ-Γ1Ζ,2024-12-02,ΚΑΝΟΝΙΣΤΙΚΗ ΠΡΑΞΗ,"Έγκριση 5ης Ανάθεση Παροχής Υπηρεσίας «ΓΙΑ ΤΗ ΔΙΑΧΕΙΡΙΣΗ ΙΛΥΟΣ, ΕΣΧΑΡΙΣΜΑΤΩΝ, ΑΜΜΟΥ ΚΑΙ ΛΙΠΩΝ ΤΟΥ ΒΙΟΛΟΓΙΚΟΥ ΚΑΘΑΡΙΣΜΟΥ»",,,,,,,,https://diavgeia.gov.gr/doc/60ΜΙΟΡΥΑ-Γ1Ζ
proc:450e3c3d5a7e,50449,2024,12,63ΛΧΟΡΥΑ-ΙΦ9,2024-12-02,ΚΑΝΟΝΙΣΤΙΚΗ ΠΡΑΞΗ,"Έγκριση 2ου ΠΡΑΚΤΙΚΟΥ ΑΠΟΣΦΡΑΓΙΣΗΣ ΔΙΚΑΙΟΛΟΓΗΤΙΚΩΝ ΣΥΜΜΕΤΟΧΗΣ-ΤΕΧΝΙΚΗΣ ΠΡΟΣΦΟΡΑΣ ΚΑΙ ΟΙΚΟΝΟΜΙΚΗΣ ΠΡΟΣΦΟΡΑΣ ΗΛΕΚΤΡΟΝΙΚΟΥ ΑΝΟΙΚΤΟΥ ΔΙΑΓΩΝΙΣΜΟΥ ΜΕ ΤΙΤΛΟ: «ΠΡΟΜΗΘΕΙΑ : Α. ΔΙΑΛΥΜΑΤΟΣ ΥΠΟΧΛΩΡΙΩΔΟΥΣ ΝΑΤΡΙΟΥ ΚΑΙ Β. ΔΙΑΛΥΜΑΤΟΣ ΔΙΣΘΕΝΟΥΣ ΧΛΩΡΙΟΥΧΟΥ ΣΙΔΗΡΟΥ ΓΙΑ  ΤΙΣ ΑΝΑΓΚΕΣ ΤΗΣ ΔΕΥΑ ΚΟΖΑΝΗΣ ΓΙΑ ΕΝΑ ΧΡΟΝΟ 2024-2025», (Αρ. Διακ.: 14/2024).",,,,,,,,https://diavgeia.gov.gr/doc/63ΛΧΟΡΥΑ-ΙΦ9
proc:77851998fc53,50449,2024,12,6ΗΔΘΟΡΥΑ-ΕΕ3,2024-12-02,ΣΥΜΒΑΣΗ,ΔΙΑΝΟΜΗ ΛΟΓΑΡΙΑΣΜΩΝ ΔΕΥΑ ΚΟΖΑΝΗΣ ΣΤΑ ΤΟΠΙΚΑ ΔΙΑΜΕΡΙΣΜΑΤΑ ΤΟΥ ΔΗΜΟΥ ΚΟΖΑΝΗΣ,,,,,,,,https://diavgeia.gov.gr/doc/6ΗΔΘΟΡΥΑ-ΕΕ3
proc:389fe1e2a473,50449,2024,12,ΨΟΡΥΟΡΥΑ-2ΘΚ,2024-12-02,ΚΑΝΟΝΙΣΤΙΚΗ ΠΡΑΞΗ,"Έγκριση 2ης παράτασης συνολικής προθεσμίας της Σύμβασης παροχής υπηρεσιών (Σ Σ87/2021), με τίτλο «Υπηρεσίες Επιστημονικού Συμβούλου Ενεργειακού Εκσυγχρονισμού και Αξιοποίησης ΑΠΕ Εγκαταστάσεων Ύδρευσης ΔΕΥΑ Κοζάνης».",,,,,,,,https://diavgeia.gov.gr/doc/ΨΟΡΥΟΡΥΑ-2ΘΚ
proc:bfeb8d08468f,50449,2024,12,ΨΦΛ6ΟΡΥΑ-Ρ4Α,2024-12-02,ΣΥΜΒΑΣΗ,ΔΙΑΝΟΜΗ ΠΑΚΕΤΩΝ ΛΟΓΑΡΙΑΣΜΩΝ ΔΕΥΑΚ Δ.Ε. ΚΟΖΑΝΗΣ,,,,,,,,https://diavgeia.gov.gr/doc/ΨΦΛ6ΟΡΥΑ-Ρ4Α
proc:949572db4e41,50449,2024,12,ΨΠΥ9ΟΡΥΑ-ΞΓΔ,2024-12-05,ΑΝΑΛΗΨΗ ΥΠΟΧΡΕΩΣΗΣ,ΠΡΟΜΗΘΕΙΑ & ΕΓΚΑΤΑΣΤΑΣΗ ΕΞΟΠΛΙΣΜΟΥ & ΟΡΓΑΝΩΝ ΣΤΑ ΠΛΑΙΣΙΑ ΕΠΙΣΤΗΜΟΝΙΚΗΣ ΚΑΙ ΤΕΧΝΟΛΟΓΙΚΗΣ ΕΡΕΥΝΑΣ ΤΟΥ ΕΡΓΟΥ URBANFLOODS-INTERREG IPA ADRION (ΣΥΜΒΑΣΕΙΣ ΑΝΕΞΑΡΤΗΤΩΝ ΥΠΗΡΕΣΙΩΝ),,,,,,,,https://diavgeia.gov.gr/doc/ΨΠΥ9ΟΡΥΑ-ΞΓΔ
proc:cfd0e0a3be3c,50449,2024,12,6Ρ4ΘΟΡΥΑ-Τ1Η,2024-12-16,ΚΑΝΟΝΙΣΤΙΚΗ ΠΡΑΞΗ,Έγκριση   1ου και 2ου πρακτικού αποσφράγισης δικαιολογητικών συμμετοχής - τεχνικής προσφοράς και οικονομικής προσφοράς ηλεκτρονικού ανοικτού διαγωνισμού με τίτλο: «ΠΡΟΜΗΘΕΙΑ ΔΥΟ ΚΑΙΝΟΥΡΓΙΩΝ ΗΜΙΦΟΡΤΗΓΩΝ 4X4 ΔΙΠΛΗ ΚΑΜΠΙΝΑ 4ΘΥΡΑ» (Αρ. Διακ: 15/2024 και Αρ. ΕΣΗΔΗΣ: 357577),,,,,,,,https://diavgeia.gov.gr/doc/6Ρ4ΘΟΡΥΑ-Τ1Η
proc:e1de555554b6,50449,2024,12,9821ΟΡΥΑ-4Υ9,2024-12-16,ΚΑΝΟΝΙΣΤΙΚΗ ΠΡΑΞΗ,"Έγκριση χρονικής παράτασης καταληκτικής ημερομηνίας υποβολής προσφορών & μετάθεσης ημερομηνίας ηλεκτρονικής αποσφράγισης του διαγωνισμού παροχής υπηρεσιών με τίτλο «Παροχή Υπηρεσιών μέσω Σύμβασης Ενεργειακής Απόδοσης για την προμήθεια, εγκατάσταση, συντήρηση & λειτουργία τριών (3) Φωτοβολταϊκών σταθμών συνολικής εγκατεστημένης ισχύος 2.499,2 kWp» (Αρ. Διακ.: 18/2024, Αρ. ΕΣΗΔΗΣ: 360690)",,,,,,,,https://diavgeia.gov.gr/doc/9821ΟΡΥΑ-4Υ9
proc:94aa754a25b4,50449,2024,12,993ΒΟΡΥΑ-ΒΩΕ,2024-12-16,ΚΑΝΟΝΙΣΤΙΚΗ ΠΡΑΞΗ,Έγκριση  παράτασης σύμβασης της εταιρείας ΑΦΟΙ Π. ΒΟΥΡΚΑ ΣΤΑΝΤΑΡ ΜΠΕΤΟΝ ΑΒΕΕ για την προμήθεια «ΕΤΟΙΜΟΥ ΣΚΥΡΟΔΕΜΑΤΟΣ».,,,,,,,,https://diavgeia.gov.gr/doc/993ΒΟΡΥΑ-ΒΩΕ
proc:c7ee717377ae,50449,2024,12,996ΩΟΡΥΑ-ΠΔ6,2024-12-16,ΚΑΝΟΝΙΣΤΙΚΗ ΠΡΑΞΗ,Έγκριση 1ου  και 2ου ΠΡΑΚΤΙΚΟΥ ΗΛΕΚΤΡΟΝΙΚΟΥ ΑΝΟΙΚΤΟΥ ΔΙΑΓΩΝΙΣΜΟΥ ΜΕ ΤΙΤΛΟ: «ΠΡΟΜΗΘΕΙΑ ΟΛΟΚΛΗΡΩΤΩΝ ΘΕΡΜΙΚΗΣ ΕΝΕΡΓΕΙΑΣ ΓΙΑ ΤΗΝ ΚΑΛΥΨΗ ΑΝΑΓΚΩΝ ΤΗΣ ΕΓΚΑΤΑΣΤΑΣΗΣ ΤΗΛΕΘΕΡΜΑΝΣΗΣ ΚΟΖΑΝΗΣ – ΠΕΡΙΟΔΟΣ ΛΕΙΤΟΥΡΓΙΑΣ 2024/2025» (Αριθμός αναφοράς: ΤΘ 0512/2024) (ΑΡ. ΕΣΗΔΗΣ: 361043),,,,,,,,https://diavgeia.gov.gr/doc/996ΩΟΡΥΑ-ΠΔ6
proc:e8781fc16128,50449,2024,12,ΨΟΚΟΟΡΥΑ-ΡΚΔ,2024-12-16,ΚΑΝΟΝΙΣΤΙΚΗ ΠΡΑΞΗ,Έγκριση  ανάθεσης Υπηρεσιών Αποκατάστασης / Άρσης βλαβών υφιστάμενων Μετατροπέων συχνότητας κύριων αντλιοστασίων Τηλεθέρμανσης Κοζάνης για την Περίοδο λειτουργίας 2024/2025 με αριθμό αναφοράς: ΤΘ 0535/2024.,,,,,,,,https://diavgeia.gov.gr/doc/ΨΟΚΟΟΡΥΑ-ΡΚΔ
proc:5ce1f9f98e66,50449,2024,12,9ΒΗΠΟΡΥΑ-Σ95,2024-12-19,ΛΟΙΠΕΣ ΑΤΟΜΙΚΕΣ ΔΙΟΙΚΗΤΙΚΕΣ ΠΡΑΞΕΙΣ,"Σ83/2024

ΣΥΜΒΑΣΗ
«ΠΡΟΜΗΘΕΙΑ ΠΡΟΜΟΝΩΜΈΝΩΝ ΥΛΙΚΩΝ & ΕΞΑΡΤΗΜΑΤΩΝ  ΓΙΑ ΤΗΝ ΚΑΛΥΨΗ ΑΜΕΣΩΝ ΛΕΙΤΟΥΡΓΙΚΩΝ ΑΝΑΓΚΩΝ ΣΥΝΤΗΡΗΣΗΣ  ΤΗΣ ΕΓΚΑΤΑΣΤΑΣΗΣ ΤΗΛΕΘΕΡΜΑΝΣΗΣ ΚΟΖΑΝΗΣ»",,,,,,,,https://diavgeia.gov.gr/doc/9ΒΗΠΟΡΥΑ-Σ95
proc:b42c2f3746ca,50449,2024,12,9Δ10ΟΡΥΑ-736,2024-12-20,ΛΟΙΠΕΣ ΑΤΟΜΙΚΕΣ ΔΙΟΙΚΗΤΙΚΕΣ ΠΡΑΞΕΙΣ,"ΣΥΜΒΑΣΗ (Σ84 /2024)
 «ΠΡΟΜΗΘΕΙΑ ΤΑΙΝΙΩΝ ΑΦΥΔΑΤΩΣΗΣ ΚΑΙ ΕΞΑΡΤΗΜΑΤΩΝ ΑΦΥΔΑΤΩΣΗΣ»",,,,,,,,https://diavgeia.gov.gr/doc/9Δ10ΟΡΥΑ-736
proc:1a3be49af43f,50449,2024,12,ΨΗΘ4ΟΡΥΑ-Π5Ρ,2024-12-20,ΛΟΙΠΕΣ ΑΤΟΜΙΚΕΣ ΔΙΟΙΚΗΤΙΚΕΣ ΠΡΑΞΕΙΣ,"ΣΥΜΒΑΣΗ ΠΑΡΟΧΗΣ ΥΠΗΡΕΣΙΩΝ
(Σ  82 / 2024)
ΠΑΡΟΧΗ ΥΠΗΡΕΣΙΩΝ : 
« ΔΙΑΧΕΙΡΙΣΗ ΙΛΥΟΣ, ΕΣΧΑΡΙΣΜΑΤΩΝ, ΑΜΜΟΥ ΚΑΙ ΛΙΠΩΝ ΤΟΥ ΒΙΟΛΟΓΙΚΟΥ ΚΑΘΑΡΙΣΜΟΥ»",,,,,,,,https://diavgeia.gov.gr/doc/ΨΗΘ4ΟΡΥΑ-Π5Ρ
proc:2107c3dd89c4,50449,2024,12,ΨΠΠΩΟΡΥΑ-1Λ0,2024-12-23,ΚΑΝΟΝΙΣΤΙΚΗ ΠΡΑΞΗ,Έγκριση  Ανάθεσης και κατακύρωση για την ΑΣΦΑΛΙΣΗ ΤΩΝ ΟΧΗΜΑΤΩΝ ΤΗΣ ΔΕΥΑΚ.,,,,,,,,https://diavgeia.gov.gr/doc/ΨΠΠΩΟΡΥΑ-1Λ0
proc:8b5fcdd51d0c,50449,2024,12,ΨΤΒΓΟΡΥΑ-ΩΣΤ,2024-12-24,ΑΝΑΘΕΣΗ ΕΡΓΩΝ / ΠΡΟΜΗΘΕΙΩΝ / ΥΠΗΡΕΣΙΩΝ / ΜΕΛΕΤΩΝ,Σ85/2024: ΕΡΓΑΣΤΗΡΙΑΚΟΣ ΕΛΕΓΧΟΣ ΠΟΙΟΤΗΤΟΣ ΠΟΣΙΜΟΥ ΝΕΡΟΥ ΔΗΜΟΥ ΚΟΖΑΝΗΣ 2023-2025» (Αρ. Διακ.:7/2023),,,,,,,,https://diavgeia.gov.gr/doc/ΨΤΒΓΟΡΥΑ-ΩΣΤ
proc:400d067eb447,50449,2024,12,ΨΓ9ΙΟΡΥΑ-ΒΘΗ,2024-12-26,ΚΑΝΟΝΙΣΤΙΚΗ ΠΡΑΞΗ,Έγκριση παράτασης σύμβασης Σ86/2023 για την προμήθεια «Ηλεκτρολογικού υλικού».,,,,,,,,https://diavgeia.gov.gr/doc/ΨΓ9ΙΟΡΥΑ-ΒΘΗ
proc:ccc4f7b4fa22,50449,2024,12,6Ε1ΑΟΡΥΑ-ΗΙ9,2024-12-27,ΑΝΑΛΗΨΗ ΥΠΟΧΡΕΩΣΗΣ,ΠΡΟΜΗΘΕΙΑ ΑΠΙΝΙΔΩΤΗ,,,,,,,,https://diavgeia.gov.gr/doc/6Ε1ΑΟΡΥΑ-ΗΙ9
proc:0b0121437aab,50449,2024,12,6ΕΤΥΟΡΥΑ-ΨΩΘ,2024-12-30,ΚΑΤΑΚΥΡΩΣΗ,ΣΥΜΒΑΣΗ (Σ87/2024) ΑΝΑΘΕΣΗ ΠΑΡΟΧΗΣ ΥΠΗΡΕΣΙΑΣ ΑΣΦΑΛΙΣΗ ΤΩΝ ΟΧΗΜΑΤΩΝ ΤΗΣ ΔΕΥΑΚ.,,,,,,,,https://diavgeia.gov.gr/doc/6ΕΤΥΟΡΥΑ-ΨΩΘ
proc:ff13a6b58960,50449,2024,12,94Π2ΟΡΥΑ-Ι2Δ,2024-12-30,ΚΑΝΟΝΙΣΤΙΚΗ ΠΡΑΞΗ,Έγκριση  ανάθεσης και κατακύρωση για την προμήθεια αδρανών υλικών.,,,,,,,,https://diavgeia.gov.gr/doc/94Π2ΟΡΥΑ-Ι2Δ
proc:4ee72c248aba,50449,2024,12,9Ξ73ΟΡΥΑ-4ΘΑ,2024-12-30,ΚΑΝΟΝΙΣΤΙΚΗ ΠΡΑΞΗ,Έγκριση 4ης παράτασης συνολικής προθεσμίας της Σύμβασης (Σ 16/2023) προμήθειας με τίτλο «Ενεργειακός Εκσυγχρονισμός Εγκαταστάσεων Ύδρευσης».,,,,,,,,https://diavgeia.gov.gr/doc/9Ξ73ΟΡΥΑ-4ΘΑ
proc:018775e1a88b,50449,2024,12,Ψ0ΖΧΟΡΥΑ-Τ31,2024-12-30,ΚΑΝΟΝΙΣΤΙΚΗ ΠΡΑΞΗ,Έγκριση ανάθεσης και κατακύρωση για την καθαριότητα των κτιριακών εγκαταστάσεων της ΔΕΥΑΚ.,,,,,,,,https://diavgeia.gov.gr/doc/Ψ0ΖΧΟΡΥΑ-Τ31
proc:593bd28b969d,50449,2024,12,ΨΖ18ΟΡΥΑ-8Ρ3,2024-12-30,ΚΑΝΟΝΙΣΤΙΚΗ ΠΡΑΞΗ,Έγκριση  ανάθεσης προμήθειας διάχυτών και λοιπών εξαρτημάτων,,,,,,,,https://diavgeia.gov.gr/doc/ΨΖ18ΟΡΥΑ-8Ρ3
proc:e8b6217ab510,50449,2025,1,Ρ0ΚΓΟΡΥΑ-919,2025-01-03,ΑΝΑΛΗΨΗ ΥΠΟΧΡΕΩΣΗΣ,"ΠΡΟΜΗΘΕΙΑ ΚΑΙ ΕΓΚΑΤΑΣΤΑΣΗ ΦΩΤΟΒΟΛΤΑΙΚΟΥ ΣΤΑΘΜΟΥ ΙΣΧΥΟΣ 500KW ΣΤΗ ΘΕΣΗ ""ΑΓΡΟΤΕΜΑΧΙΟ ΜΕ ΚΑΕΚ 270500206189,ΚΤΗΜΑΤΙΚΗΣ ΠΕΡΙΟΧΗΣ ΚΑΡΥΔΙΤΣΑΣ""(ΕΕΛ1) ΤΟΥ ΔΗΜΟΥ ΚΟΖΑΝΗΣ ΤΗΣ ΠΕΡΙΦΕΡΕΙΑΚΗΣ ΕΝΟΤΗΤΑΣ ΚΟΖΑΝΗΣ",,,,,,,,https://diavgeia.gov.gr/doc/Ρ0ΚΓΟΡΥΑ-919
proc:a8968f8ad1cb,50449,2025,1,ΡΞΑΗΟΡΥΑ-ΠΗ5,2025-01-03,ΑΝΑΛΗΨΗ ΥΠΟΧΡΕΩΣΗΣ,"ΠΑΡΟΧΗ ΥΠΗΡΕΣΙΩΝ ΜΕΣΩ ΣΥΜΒΑΣΗΣ ΕΝΕΡΓΕΙΑΚΗΣ ΑΠΟΔΟΣΗΣ ΓΙΑ ΤΗΝ ΠΡΟΜΗΘΕΙΑ ΕΓΚΑΤΑΣΤΑΣΗ ,ΣΥΝΤΗΡΗΣΗ & ΛΕΙΤΟΥΡΓΙΑ ΤΡΙΩΝ (3) ΦΩΤΟΒΟΛΤΑΙΚΩΝ ΣΤΑΘΜΩΝ ΣΥΝΟΛΙΚΗΣ ΕΓΚΤΕΣΤΗΜΕΝΗ ΙΣΧΥΟΣ  2.499,2 KWP",,,,,,,,https://diavgeia.gov.gr/doc/ΡΞΑΗΟΡΥΑ-ΠΗ5
proc:06980c5d2abe,50449,2025,1,Ψ6ΗΔΟΡΥΑ-ΓΛΗ,2025-01-03,ΑΝΑΛΗΨΗ ΥΠΟΧΡΕΩΣΗΣ,ΠΡΟΜΗΘΕΙΑ ΚΑΙ ΕΓΚ/ΣΤΑΣΗ ΕΞΟΠΛΙΣΜΟΥ & ΟΡΓΑΝΩΝ ΣΤΑ ΠΛΑΙΣΙΑ ΕΠΙΣΤΗΜΟΝΙΚΗΣ ΚΑΙ ΤΕΧΝΟΛΟΓΙΚΗΣ ΕΡΕΥΝΑΣ  ΤΟΥ ΕΡΓΟΥ:URBANFLOODS-INTERREG IPA ADRION,,,,,,,,https://diavgeia.gov.gr/doc/Ψ6ΗΔΟΡΥΑ-ΓΛΗ
proc:016b5cc69436,50449,2025,1,Ψ8ΧΞΟΡΥΑ-3Σ4,2025-01-03,ΑΝΑΛΗΨΗ ΥΠΟΧΡΕΩΣΗΣ,ΠΡΟΜΗΘΕΙΑ ΥΓΡΩΝ ΚΑΥΣΙΜΩΝ (ΔΙΑΓΩΝΙΣΜΟΣ),,,,,,,,https://diavgeia.gov.gr/doc/Ψ8ΧΞΟΡΥΑ-3Σ4
proc:694b066e6e35,50449,2025,1,625ΠΟΡΥΑ-ΙΝΧ,2025-01-07,ΑΝΑΛΗΨΗ ΥΠΟΧΡΕΩΣΗΣ,ΠΡΟΜΗΘΕΙΑ ΕΞΟΠΛΙΣΜΟΥ ΜΕΤΡΗΣΗ ΣΤΑΘΜΗΣ ΝΕΡΟΥ,,,,,,,,https://diavgeia.gov.gr/doc/625ΠΟΡΥΑ-ΙΝΧ
proc:7bf736f0db08,50449,2025,1,612ΡΟΡΥΑ-ΥΣΒ,2025-01-08,ΑΝΑΛΗΨΗ ΥΠΟΧΡΕΩΣΗΣ,ΠΡΟΜΗΘΕΙΑ ΕΙΔΩΝ ΑΤΟΜΙΚΗΣ ΠΡΟΣΤΑΣΙΑΣ,,,,,,,,https://diavgeia.gov.gr/doc/612ΡΟΡΥΑ-ΥΣΒ
proc:61b744887da8,50449,2025,1,6ΙΧΞΟΡΥΑ-ΑΤΥ,2025-01-08,ΑΝΑΛΗΨΗ ΥΠΟΧΡΕΩΣΗΣ,ΠΡΟΜΗΘΕΙΑ ΥΛΙΚΩΝ ΚΑΘΑΡΙΟΤΗΤΑΣ,,,,,,,,https://diavgeia.gov.gr/doc/6ΙΧΞΟΡΥΑ-ΑΤΥ
