procurement_key,org,year,month,ada,issue_date,decision_type,subject,amount,amount_source,supplier_key,supplier_name,supplier_tax_id,signer,unit,url
proc:67e26104a729,50449,2021,5,9ΨΟΕΟΡΥΑ-4ΧΙ,2021-05-10,ΑΝΑΘΕΣΗ ΕΡΓΩΝ / ΠΡΟΜΗΘΕΙΩΝ / ΥΠΗΡΕΣΙΩΝ / ΜΕΛΕΤΩΝ,ΣΥΜΒΑΣΗ Σ31/2021 Για ΠΥ ΑΠΟΣΤΟΛΗ ΛΟΓΑΡΙΑΣΜΩΝ ΔΕΥΑΚ 2021 (ΑΝΑΘΕΣΗ),,,,,,,,https://diavgeia.gov.gr/doc/9ΨΟΕΟΡΥΑ-4ΧΙ
proc:fc93f7fc933d,50449,2021,5,9ΚΡΧΟΡΥΑ-ΠΙ5,2021-05-11,ΑΝΑΘΕΣΗ ΕΡΓΩΝ / ΠΡΟΜΗΘΕΙΩΝ / ΥΠΗΡΕΣΙΩΝ / ΜΕΛΕΤΩΝ,«ΠΑΡΟΧΗ ΥΠΗΡΕΣΙΩΝ: ΕΡΓΑΣΤΗΡΙΑΚΟΣ ΜΟΡΙΑΚΟΣ ΕΛΕΓΧΟΣ ΓΙΑ ΤΗΝ  ΑΝΙΧΝΕΥΣΗ ΤΟΥ ΚΟΡΩΝΟΙΟΥ (COVID-19)»,,,,,,,,https://diavgeia.gov.gr/doc/9ΚΡΧΟΡΥΑ-ΠΙ5
proc:1b7453c021a1,50449,2021,5,ΨΓΚΒΟΡΥΑ-Δ8Ψ,2021-05-11,ΚΑΤΑΚΥΡΩΣΗ,"ΠΡΟΓΡΑΜΜΑΤΙΚΗ ΣΥΜΒΑΣΗ
Σ033/2021",,,,,,,,https://diavgeia.gov.gr/doc/ΨΓΚΒΟΡΥΑ-Δ8Ψ
proc:38c2eb659906,50449,2021,5,Ω0ΦΗΟΡΥΑ-ΔΛΚ,2021-05-13,ΠΕΡΙΛΗΨΗ ΔΙΑΚΗΡΥΞΗΣ,ΣΥΝΟΠΤΙΚΟΣ ΔΙΑΓΩΝΙΣΜΟΣ ΠΡΟΜΗΘΕΙΑΣ: ΠΡΟΜΗΘΕΙΑ ΣΤΑ ΠΛΑΙΣΙΑ ΤΗΣ ΠΡΑΞΗΣ : «ΈΞΥΠΝΗ ΠΛΑΤΦΟΡΜΑ ΔΙΑΔΙΚΤΥΟΥ-ΤΩΝ-ΠΡΑΓΜΑΤΩΝ ΔΙΑΧΕΙΡΙΣΗΣ ΚΑΙ ΑΞΙΟΠΟΙΗΣΗΣ ΑΝΑΚΥΚΛΟΥΜΕΝΟΥ ΝΕΡΟΥ ΒΙΟΛΟΓΙΚΟΥ ΚΑΘΑΡΙΣΜΟΥ ΓΙΑ ΑΡΔΕΥΣΗ ΣΕ ΚΑΛΛΙΕΡΓΕΙΕΣ ΣΤΗ ΓΕΩΡΓΙΑ ΑΚΡΙΒΕΙΑΣ (ΑΥΓΕΙΑΣ) ΑΡ. ΔΙΑΚ.: 5/2021,,,,,,,,https://diavgeia.gov.gr/doc/Ω0ΦΗΟΡΥΑ-ΔΛΚ
proc:8f6ff9088947,50449,2021,5,67ΨΨΟΡΥΑ-8Ι7,2021-05-14,ΛΟΙΠΕΣ ΑΤΟΜΙΚΕΣ ΔΙΟΙΚΗΤΙΚΕΣ ΠΡΑΞΕΙΣ,Απόφαση Γενικού Διευθυντή για την προμήθεια τριών άνω φιλτροταινιών πρέσας,,,,,,,,https://diavgeia.gov.gr/doc/67ΨΨΟΡΥΑ-8Ι7
proc:5d41c236fd3a,50449,2021,5,9ΩΣΠΟΡΥΑ-ΤΣΨ,2021-05-14,ΑΝΑΛΗΨΗ ΥΠΟΧΡΕΩΣΗΣ,ΠΡΟΜΗΘΕΙΑ ΥΓΡΩΝ ΚΑΥΣΙΜΩΝ ΚΙΝΗΣΗΣ,,,,,,,,https://diavgeia.gov.gr/doc/9ΩΣΠΟΡΥΑ-ΤΣΨ
proc:c383359ca164,50449,2021,5,6ΖΗΤΟΡΥΑ-ΨΑ1,2021-05-18,ΚΑΝΟΝΙΣΤΙΚΗ ΠΡΑΞΗ,Έγκριση ανάθεσης και κατακύρωση για την προμήθεια  ψυχρής ασφάλτου.,,,,,,,,https://diavgeia.gov.gr/doc/6ΖΗΤΟΡΥΑ-ΨΑ1
proc:332c77c76923,50449,2021,5,6Μ06ΟΡΥΑ-ΕΗΨ,2021-05-18,ΚΑΝΟΝΙΣΤΙΚΗ ΠΡΑΞΗ,Έγκριση όρων διενέργειας Συνοπτικού διαγωνισμού για την προμήθεια : «Υγρών Καυσίμων Κίνησης» (ΑΡ. ΔΙΑΚ.: 6/2021).,,,,,,,,https://diavgeia.gov.gr/doc/6Μ06ΟΡΥΑ-ΕΗΨ
proc:4735a2ee47e8,50449,2021,5,6ΨΣ3ΟΡΥΑ-0ΚΓ,2021-05-18,ΚΑΝΟΝΙΣΤΙΚΗ ΠΡΑΞΗ,Επικαιροποίηση μελέτης προμήθειας : «Ενεργειακός συμψηφισμός εγκαταστάσεων ύδρευσης με χρήση ΑΠΕ »,,,,,,,,https://diavgeia.gov.gr/doc/6ΨΣ3ΟΡΥΑ-0ΚΓ
proc:6f054e37a5f8,50449,2021,5,9ΠΛΥΟΡΥΑ-972,2021-05-18,ΚΑΝΟΝΙΣΤΙΚΗ ΠΡΑΞΗ,Έγκριση απασχόλησης υφιστάμενου προσωπικού της ΔΕΥΑ ΚΟΖΑΝΗΣ  για την υλοποίηση του Ευρωπαϊκού έργου με τον τίτλο STARDUST  με αριθμό σύμβασης 774094.,,,,,,,,https://diavgeia.gov.gr/doc/9ΠΛΥΟΡΥΑ-972
proc:62c2bf8264a1,50449,2021,5,ΨΑΑΖΟΡΥΑ-ΓΒ9,2021-05-18,ΚΑΝΟΝΙΣΤΙΚΗ ΠΡΑΞΗ,Έγκριση πρακτικού επιτροπής  μειοδοτικού διαγωνισμού με την διαδικασία της διαπραγμάτευσης για την προμήθεια: «Μεταχειρισμένου φορτηγού ανατρεπόμενου » (Αρ. Διακ.: 13/2020),,,,,,,,https://diavgeia.gov.gr/doc/ΨΑΑΖΟΡΥΑ-ΓΒ9
proc:0c27a3303335,50449,2021,5,ΨΔΨΡΟΡΥΑ-6ΜΡ,2021-05-18,ΚΑΝΟΝΙΣΤΙΚΗ ΠΡΑΞΗ,Επικαιροποίηση μελέτης προμήθειας : «Εγκατάσταση υδρομετρητών απομακρυσμένης μέτρησης ».,,,,,,,,https://diavgeia.gov.gr/doc/ΨΔΨΡΟΡΥΑ-6ΜΡ
proc:4b49940dccf8,50449,2021,5,ΨΣΝΖΟΡΥΑ-ΑΜΩ,2021-05-18,ΚΑΝΟΝΙΣΤΙΚΗ ΠΡΑΞΗ,Έγκριση της απευθείας ανάθεσης της υπηρεσίας: “ΠΡΟΛΗΠΤΙΚΗ ΣΥΝΤΗΡΗΣΗ ΜΕΤΑΤΡΟΠΕΩΝ ΣΥΧΝΟΤΗΤΑΣ ΑΒΒ της εγκατάστασης Τηλεθέρμανσης Κοζάνης ” με αριθμό Αναφοράς: ΤΘ 0413/2021,,,,,,,,https://diavgeia.gov.gr/doc/ΨΣΝΖΟΡΥΑ-ΑΜΩ
proc:eafacb2cc384,50449,2021,5,Ω88ΝΟΡΥΑ-25Σ,2021-05-18,ΚΑΝΟΝΙΣΤΙΚΗ ΠΡΑΞΗ,Έγκριση ανάθεσης υπηρεσίας επισκευής και συντήρησης αποφρακτικού μηχανήματος και εκσκαφέα – φορτωτή για ένα έτος.,,,,,,,,https://diavgeia.gov.gr/doc/Ω88ΝΟΡΥΑ-25Σ
proc:87595f0cded4,50449,2021,5,ΩΜΛ3ΟΡΥΑ-ΛΝΝ,2021-05-18,ΚΑΝΟΝΙΣΤΙΚΗ ΠΡΑΞΗ,Έγκριση παράτασης σύμβασης προμήθειας Πολυηλεκτρολύτη (Σ34/2020).,,,,,,,,https://diavgeia.gov.gr/doc/ΩΜΛ3ΟΡΥΑ-ΛΝΝ
proc:f9aa8ece531d,50449,2021,5,ΩΝΒΖΟΡΥΑ-2ΩΤ,2021-05-18,ΚΑΝΟΝΙΣΤΙΚΗ ΠΡΑΞΗ,"Έγκριση όρων διαγωνισμού για την προμήθεια α) Υλικών χυτοσιδηρών, β)Σωλήνες και ειδικά τεμάχια, γ) Ειδικά εξαρτήματα.",,,,,,,,https://diavgeia.gov.gr/doc/ΩΝΒΖΟΡΥΑ-2ΩΤ
proc:169c4e39a6ef,50449,2021,5,ΩΦ3ΣΟΡΥΑ-Χ3Ξ,2021-05-18,ΚΑΝΟΝΙΣΤΙΚΗ ΠΡΑΞΗ,Επικαιροποίηση μελέτης προμήθειας : «Ενεργειακός εκσυγχρονισμός εγκαταστάσεων ύδρευσης».,,,,,,,,https://diavgeia.gov.gr/doc/ΩΦ3ΣΟΡΥΑ-Χ3Ξ
proc:5def46c8aeed,50449,2021,5,9ΚΑ8ΟΡΥΑ-Ι1Γ,2021-05-20,ΑΝΑΛΗΨΗ ΥΠΟΧΡΕΩΣΗΣ,ΠΡΟΜΗΘΕΙΑ ΜΕΙΩΤΩΝ ΠΙΕΣΗΣ,,,,,,,,https://diavgeia.gov.gr/doc/9ΚΑ8ΟΡΥΑ-Ι1Γ
proc:fd9083b94d5f,50449,2021,5,ΨΞΤΜΟΡΥΑ-2ΘΤ,2021-05-26,ΛΟΙΠΕΣ ΑΤΟΜΙΚΕΣ ΔΙΟΙΚΗΤΙΚΕΣ ΠΡΑΞΕΙΣ,"(Σ036/2021)
ΣΥΜΒΑΣΗ
«ΠΡΟΜΗΘΕΙΑ ΠΡΟΜΟΝΩΜΕΝΩΝ ΥΛΙΚΩΝ ΤΗΛΕΘΕΡΜΑΝΣΗΣ ΚΟΖΑΝΗΣ»
Αριθμός Αναφοράς: Τ/Θ 0411/2021",,,,,,,,https://diavgeia.gov.gr/doc/ΨΞΤΜΟΡΥΑ-2ΘΤ
proc:b3e561862a92,50449,2021,5,6ΤΘΞΟΡΥΑ-ΤΓ6,2021-05-27,ΠΕΡΙΛΗΨΗ ΔΙΑΚΗΡΥΞΗΣ,ΠΕΡΙΛΗΨΗ ΔΙΑΚΗΡΥΞΗΣ ΣΥΝΟΠΤΙΚΟΥ  ΔΙΑΓΩΝΙΣΜΟΥ για την «ΠΡΟΜΗΘΕΙΑ ΥΓΡΩΝ ΚΑΥΣΙΜΩΝ ΚΙΝΗΣΗΣ» (Αρ. Διακ: 6/2021),,,,,,,,https://diavgeia.gov.gr/doc/6ΤΘΞΟΡΥΑ-ΤΓ6
proc:e846c94ae075,50449,2021,5,ΨΗΣΞΟΡΥΑ-ΨΚΦ,2021-05-31,ΛΟΙΠΕΣ ΑΤΟΜΙΚΕΣ ΔΙΟΙΚΗΤΙΚΕΣ ΠΡΑΞΕΙΣ,ΣΥΜΒΑΣΗ 35/2021 ΠΑΡΟΧΗΣ ΥΠΗΡΕΣΙΩΝ ΗΛΕΚΤΡΟΤΕΧΝΕΙΟΥ,,,,,,,,https://diavgeia.gov.gr/doc/ΨΗΣΞΟΡΥΑ-ΨΚΦ
proc:d042cde951a5,50449,2021,5,ΨΩΤΧΟΡΥΑ-3ΛΦ,2021-05-31,ΛΟΙΠΕΣ ΑΤΟΜΙΚΕΣ ΔΙΟΙΚΗΤΙΚΕΣ ΠΡΑΞΕΙΣ,ΣΥΜΒΑΣΗ 37/2021 «ΠΡΟΜΗΘΕΙΑ ΑΝΩ ΦΙΛΤΡΟΤΑΙΝΙΩΝ ΠΡΕΣΣΑΣ »,,,,,,,,https://diavgeia.gov.gr/doc/ΨΩΤΧΟΡΥΑ-3ΛΦ
proc:0e1f425618f5,50449,2021,6,6ΓΘΗΟΡΥΑ-6ΤΒ,2021-06-01,ΚΑΤΑΚΥΡΩΣΗ,ΣΥΜΒΑΣΗ (Σ38/2021) ΠΡΟΜΗΘΕΙΑ ΔΙΑΦΟΡΩΝ ΑΝΑΛΩΣΙΜΩΝ ΥΛΙΚΩΝ ΥΔΡΕΥΣΗΣ – ΑΠΟΧΕΤΕΥΣΗΣ,,,,,,,,https://diavgeia.gov.gr/doc/6ΓΘΗΟΡΥΑ-6ΤΒ
proc:930372ed8e34,50449,2021,6,6Η84ΟΡΥΑ-ΣΨ9,2021-06-01,ΚΑΤΑΚΥΡΩΣΗ,ΣΥΜΒΑΣΗ  (Σ41/2021)ΠΡΟΜΗΘΕΙΑ «ΕΙΔΩΝ ΑΤΟΜΙΚΗΣ ΠΡΟΣΤΑΣΙΑΣ»,,,,,,,,https://diavgeia.gov.gr/doc/6Η84ΟΡΥΑ-ΣΨ9
proc:e2ce83a42b5e,50449,2021,6,6Χ5ΧΟΡΥΑ-ΓΜΓ,2021-06-01,ΛΟΙΠΕΣ ΑΤΟΜΙΚΕΣ ΔΙΟΙΚΗΤΙΚΕΣ ΠΡΑΞΕΙΣ,ΣΥΜΒΑΣΗ Σ42/2021 Η εκτέλεση από τον «Ανάδοχο» των εργασιών επισκευής και συντήρησης  των Μ.Ε. 44925 εκσκαφέα-φορτωτή και του Μ.Ε. 101861 αποφρακτικού μηχανήματος μετά  από την εισήγηση της Τεχνικής Υπηρεσίας Δ.Ε.Υ.Α.Κ.,,,,,,,,https://diavgeia.gov.gr/doc/6Χ5ΧΟΡΥΑ-ΓΜΓ
proc:ae3fe2829cf3,50449,2021,6,6Ψ32ΟΡΥΑ-ΕΑΓ,2021-06-01,ΚΑΝΟΝΙΣΤΙΚΗ ΠΡΑΞΗ,Έγκριση ανάθεσης για την προμήθεια «Διαφόρων οικοδομικών υλικών ύδρευσης».,,,,,,,,https://diavgeia.gov.gr/doc/6Ψ32ΟΡΥΑ-ΕΑΓ
proc:23064094c1fe,50449,2021,6,9Φ1ΨΟΡΥΑ-ΕΧ9,2021-06-01,ΚΑΤΑΚΥΡΩΣΗ,ΣΥΜΒΑΣΗ (Σ40/2021) ΠΡΟΜΗΘΕΙΑ ΜΙΚΡΟΕΡΓΑΛΕΙΩΝ ΧΕΙΡΟΣ,,,,,,,,https://diavgeia.gov.gr/doc/9Φ1ΨΟΡΥΑ-ΕΧ9
proc:9ecbf70eb287,50449,2021,6,ΩΝΔΛΟΡΥΑ-Θ5Κ,2021-06-01,ΚΑΤΑΚΥΡΩΣΗ,ΣΥΜΒΑΣΗ (Σ39/2021) ΠΡΟΜΗΘΕΙΑ ΟΙΚΟΔΟΜΙΚΩΝ ΕΡΓΑΛΕΙΩΝ,,,,,,,,https://diavgeia.gov.gr/doc/ΩΝΔΛΟΡΥΑ-Θ5Κ
proc:e1af9491011d,50449,2021,6,ΩΦΜΠΟΡΥΑ-1Ε7,2021-06-01,ΚΑΝΟΝΙΣΤΙΚΗ ΠΡΑΞΗ,Έγκριση ανάθεσης για την προμήθεια «Μηχανήματος ελέγχου διαρροών ύδρευσης».,,,,,,,,https://diavgeia.gov.gr/doc/ΩΦΜΠΟΡΥΑ-1Ε7
proc:33e5feb31204,50449,2021,6,6ΤΟΚΟΡΥΑ-8ΕΕ,2021-06-03,ΑΝΑΛΗΨΗ ΥΠΟΧΡΕΩΣΗΣ,ΠΡΟΜΗΘΕΙΑ ΥΛΙΚΩΝ ΧΥΤΟΣΙΔΗΡΩΝ-ΠΥΡΟΣΒΕΣΤΙΚΟΙ ΚΡΟΥΝΟΙ,,,,,,,,https://diavgeia.gov.gr/doc/6ΤΟΚΟΡΥΑ-8ΕΕ
proc:4b71d559d9e5,50449,2021,6,9Λ3ΜΟΡΥΑ-ΙΒ0,2021-06-07,ΛΟΙΠΕΣ ΑΤΟΜΙΚΕΣ ΔΙΟΙΚΗΤΙΚΕΣ ΠΡΑΞΕΙΣ,ΕΚΤΑΚΤΗ ΠΡΟΜΗΘΕΙΑ ΗΛΕΚΤΡΟΛΟΓΙΚΟΥ ΕΞΟΠΛΙΣΜΟΥ,,,,,,,,https://diavgeia.gov.gr/doc/9Λ3ΜΟΡΥΑ-ΙΒ0
proc:39455e22250d,50449,2021,6,ΩΖΖ4ΟΡΥΑ-2Τ1,2021-06-07,ΚΑΤΑΚΥΡΩΣΗ,ΣΥΜΒΑΣΗ (Σ43/2021)ΠΡΟΜΗΘΕΙΑ ΨΥΧΡΟΥ ΑΣΦΑΛΤΟΜΙΓΜΑΤΟΣ (ΑΝΑΘΕΣΗ),,,,,,,,https://diavgeia.gov.gr/doc/ΩΖΖ4ΟΡΥΑ-2Τ1
proc:0da4ad6ae405,50449,2021,6,ΩΙ3ΛΟΡΥΑ-2ΝΒ,2021-06-08,ΑΝΑΛΗΨΗ ΥΠΟΧΡΕΩΣΗΣ,ΕΚΤΑΚΤΗ ΠΡΟΜΗΘΕΙΑ ΗΛΕΚΤΡΟΛΟΓΙΚΟΥ ΕΞΟΠΛΙΣΜΟΥ,,,,,,,,https://diavgeia.gov.gr/doc/ΩΙ3ΛΟΡΥΑ-2ΝΒ
proc:260c82103700,50449,2021,6,ΨΨΡΟΟΡΥΑ-ΔΣΙ,2021-06-11,ΚΑΤΑΚΥΡΩΣΗ,"Σύμβαση Αρ.: 45/2021 «ΣΥΝΤΗΡΗΣΗ ΠΕΡΙΒΑΛΛΟΝΤΟΣ ΧΩΡΟΥ ΓΕΩΤΡΗΣΕΩΝ, ΑΝΤΛΙΟΣΤΑΣΙΩΝ ΚΑΙ ΔΕΞΑΜΕΝΩΝ ΣΕ ΟΛΑ ΤΑ ΔΗΜΟΤΙΚΑ ΔΙΑΜΕΡΙΣΜΑΤΑ ΤΟΥ ΔΗΜΟΥ ΚΟΖΑΝΗΣ 2021-2022»  (Αρ. Διακ.: 3/2021).",,,,,,,,https://diavgeia.gov.gr/doc/ΨΨΡΟΟΡΥΑ-ΔΣΙ
proc:23d617c70f81,50449,2021,6,6ΜΦΓΟΡΥΑ-8ΨΒ,2021-06-14,ΚΑΤΑΚΥΡΩΣΗ,"ΣΥΜΒΑΣΗ (Σ48/2021)
ΠΑΡΟΧΗ ΥΠΗΡΕΣΙΑΣ «ΚΑΘΑΡΙΣΜΟΣ ΦΡΕΑΤΙΩΝ ΥΔΡΟΣΥΛΛΟΓΗΣ ΜΕ ΑΠΟΦΡΑΚΤΙΚΟ ΜΗΧΑΝΗΜΑ ΕΝΤΟΣ ΤΩΝ ΟΡΙΩΝ ΤΟΥ ΔΗΜΟΥ ΚΟΖΑΝΗΣ 2020-2021 (Αρ. Διακ.: 02/2021)»",,,,,,,,https://diavgeia.gov.gr/doc/6ΜΦΓΟΡΥΑ-8ΨΒ
proc:5f70a77ff24b,50449,2021,6,6Υ18ΟΡΥΑ-ΖΙΥ,2021-06-16,ΚΑΝΟΝΙΣΤΙΚΗ ΠΡΑΞΗ,Έγκριση μελέτης & Όρων διεξαγωγής ανοικτού ηλεκτρονικού διαγωνισμού για την Προμήθεια Θερμικών Υποσταθμών καταναλωτών Τηλεθέρμανσης Κοζάνης για τα έτη 2021 & 2022 ” με αριθμό Αναφοράς: ΤΘ 0410/2021,,,,,,,,https://diavgeia.gov.gr/doc/6Υ18ΟΡΥΑ-ΖΙΥ
proc:83b6334197a2,50449,2021,6,ΨΒΣΑΟΡΥΑ-ΩΚ7,2021-06-16,ΑΝΑΛΗΨΗ ΥΠΟΧΡΕΩΣΗΣ,ΠΡΟΜΗΘΕΙΑ ΕΝΑΛΛΑΚΤΩΝ ΘΕΡΜΟΤΗΤΑΣ ΤΗΛΕΘΕΡΜΑΝΣΗΣ,,,,,,,,https://diavgeia.gov.gr/doc/ΨΒΣΑΟΡΥΑ-ΩΚ7
proc:a7fb5344bb8a,50449,2021,6,ΨΚΖΧΟΡΥΑ-14Ε,2021-06-16,ΚΑΝΟΝΙΣΤΙΚΗ ΠΡΑΞΗ,Έγκριση Προμήθειας εξαρτημάτων για την συντήρηση των κύριων αντλητικών συγκροτημάτων μεταφοράς & διανομής της εγκατάστασης τηλεθέρμανσης Κοζάνης για την περίοδο λειτουργίας 2021/2022   με αριθμό Αναφοράς: ΤΘ 0414/2021,,,,,,,,https://diavgeia.gov.gr/doc/ΨΚΖΧΟΡΥΑ-14Ε
proc:0e0649d98add,50449,2021,6,ΨΤ4ΧΟΡΥΑ-ΒΝ0,2021-06-16,ΚΑΝΟΝΙΣΤΙΚΗ ΠΡΑΞΗ,Έγκριση παράτασης σύμβασης Σ48/2020 της εταιρείας ΓΚΟΓΚΟΜΗΤΡΟΣ ΖΗΣΗΣ ΜΟΝ. ΙΚΕ για την «Μίσθωση ενός ερπυστριοφόρου εκσκαπτικού μηχανήματος μικρών διαστάσεων (τσαπάκι) με συνοδευτικό όχημα» (Αρ. Διακ.: 08/2020) για τις ανάγκες των Δ.Ε. Κοζάνης.,,,,,,,,https://diavgeia.gov.gr/doc/ΨΤ4ΧΟΡΥΑ-ΒΝ0
proc:3cd2e67e6ec5,50449,2021,6,ΨΥΘΩΟΡΥΑ-ΖΜ8,2021-06-16,ΚΑΝΟΝΙΣΤΙΚΗ ΠΡΑΞΗ,Έγκριση απ’ ευθείας ανάθεσης παροχής υπηρεσιών «Επισκευών μηχανολογικού εξοπλισμού».,,,,,,,,https://diavgeia.gov.gr/doc/ΨΥΘΩΟΡΥΑ-ΖΜ8
proc:f002520ec97d,50449,2021,6,ΨΨΔΞΟΡΥΑ-3Τ3,2021-06-16,ΚΑΝΟΝΙΣΤΙΚΗ ΠΡΑΞΗ,Έγκριση ανάθεσης φύλαξης και ελέγχου της κεντρικής εισόδου των γραφείων της ΔΕΥΑΚ.,,,,,,,,https://diavgeia.gov.gr/doc/ΨΨΔΞΟΡΥΑ-3Τ3
proc:f08984ee0e45,50449,2021,6,Ω1Ε9ΟΡΥΑ-8ΑΨ,2021-06-16,ΚΑΝΟΝΙΣΤΙΚΗ ΠΡΑΞΗ,Έγκριση πρακτικού επιτροπής συνοπτικού διαγωνισμού για την προμήθεια «Υγρών καυσίμων κίνησης» (Αρ. Διακ.: 6/2021).,,,,,,,,https://diavgeia.gov.gr/doc/Ω1Ε9ΟΡΥΑ-8ΑΨ
proc:fa23fa2d4f58,50449,2021,6,ΩΤΙΡΟΡΥΑ-ΧΥΕ,2021-06-16,ΚΑΝΟΝΙΣΤΙΚΗ ΠΡΑΞΗ,Έγκριση πρακτικού επιτροπής συνοπτικού διαγωνισμού για την προμήθεια στα πλαίσια της πράξης: «Έξυπνη πλατφόρμα διαδικτύου των πραγμάτων διαχείρισης και αξιοποίησης ανακυκλούμενου νερού Βιολογικού Καθαρισμού για άρδευση σε καλλιέργειες στη γεωργία ακριβείας (ΑΥΓΕΙΑΣ) (ΑΡ. ΔΙΑΚ.: 5/2021)».,,,,,,,,https://diavgeia.gov.gr/doc/ΩΤΙΡΟΡΥΑ-ΧΥΕ
proc:b41905a67dd0,50449,2021,6,ΩΧΠΨΟΡΥΑ-Ω67,2021-06-16,ΚΑΝΟΝΙΣΤΙΚΗ ΠΡΑΞΗ,Έγκριση παράτασης σύμβασης Σ43/2020 του Ζαζά Αθανασίου για την «Μίσθωση ενός εκσκαπτικού μηχανήματος τύπου JCB» (Αρ. Διακ. : 09/2020) για τις ανάγκες της Δ.Κ. Κοζάνης.,,,,,,,,https://diavgeia.gov.gr/doc/ΩΧΠΨΟΡΥΑ-Ω67
proc:057e2f9fe9d3,50449,2021,6,ΨΛΩΚΟΡΥΑ-Φ6Ρ,2021-06-24,ΚΑΤΑΚΥΡΩΣΗ,ΣΥΜΒΑΣΗ (Σ 49 / 2021) ΛΕΙΤΟΥΡΓΙΑ ΠΕΡΙΦΕΡΕΙΑΚΩΝ ΕΕΛ ΚΟΖΑΝΗΣ & ΑΝΤΛΙΟΣΤΑΣΙΩΝ ΑΚΑΘΑΡΤΩΝ 2020-2022,,,,,,,,https://diavgeia.gov.gr/doc/ΨΛΩΚΟΡΥΑ-Φ6Ρ
proc:d57957c959b7,50449,2021,6,9ΝΨΠΟΡΥΑ-ΣΞ9,2021-06-28,ΑΝΑΘΕΣΗ ΕΡΓΩΝ / ΠΡΟΜΗΘΕΙΩΝ / ΥΠΗΡΕΣΙΩΝ / ΜΕΛΕΤΩΝ,ΠΡΟΜΗΘΕΙΑ ΕΝΟΣ «ΜΕΤΑΧEΙΡΙΣΜΕΝΟΥ ΦΟΡΤΗΓΟΥ ΑΝΑΤΡΕΠΟΜΕΝΟΥ» (Αρ. Διακ.:13/2020),,,,,,,,https://diavgeia.gov.gr/doc/9ΝΨΠΟΡΥΑ-ΣΞ9
proc:f4cc7b94ef2c,50449,2021,6,6ΘΒΝΟΡΥΑ-ΙΧΝ,2021-06-30,ΚΑΝΟΝΙΣΤΙΚΗ ΠΡΑΞΗ,Έγκριση σχεδίου προγραμματικής σύμβασης «ΥΛΟΠΟΙΗΣΗ ΠΙΛΟΤΙΚΟΥ ΠΡΟΓΡΑΜΜΑΤΟΣ ΚΥΚΛΙΚΗΣ ΔΙΑΧΕΙΡΗΣΗΣ ΑΣΤΙΚΩΝ ΥΓΡΩΝ ΑΠΟΒΛΗΤΩΝ ΣΤΙΣ Π.Ε. ΚΟΖΑΝΗΣ ΚΑΙ ΦΛΩΡΙΝΑΣ»,,,,,,,,https://diavgeia.gov.gr/doc/6ΘΒΝΟΡΥΑ-ΙΧΝ
proc:b22249ac56e3,50449,2021,6,Ψ956ΟΡΥΑ-ΚΨ0,2021-06-30,ΚΑΝΟΝΙΣΤΙΚΗ ΠΡΑΞΗ,Έγκριση παράτασης σύμβασης Σ61/2019 προμήθειας υποχλωριώδους νατρίου.,,,,,,,,https://diavgeia.gov.gr/doc/Ψ956ΟΡΥΑ-ΚΨ0
proc:ea60c4c795a1,50449,2021,6,ΨΜ0ΡΟΡΥΑ-ΠΨΥ,2021-06-30,ΠΕΡΙΛΗΨΗ ΔΙΑΚΗΡΥΞΗΣ,ΠΡΟΜΗΘΕΙΑ ΔΙΑΛΥΜΑΤΩΝ: «Α. ΥΠΟΧΛΩΡΙΩΔΟΥΝ ΝΑΤΡΙΟΥ ΚΑΙ Β. ΔΙΣΘΕΝΟΥΣ ΣΙΔΗΡΟΥ ΓΙΑ  ΤΙΣ ΑΝΑΓΚΕΣ ΤΗΣ ΔΕΥΑ ΚΟΖΑΝΗΣ ΓΙΑ ΔΥΟ ΧΡΟΝΙΑ 2021-2023»  (Αρ. Διακ.: 7/2021),,,,,,,,https://diavgeia.gov.gr/doc/ΨΜ0ΡΟΡΥΑ-ΠΨΥ
proc:6ac8ae8cb120,50449,2021,6,ΨΦΨ4ΟΡΥΑ-Φ4Ν,2021-06-30,ΚΑΝΟΝΙΣΤΙΚΗ ΠΡΑΞΗ,Έγκριση σύναψης σύμβασης  για τη διέλευση αγωγών ύδρευσης υπογείως και κάτω από τις υποδομές της Εγνατίας οδού   στο πλαίσιο του έργου: «ΝΕΟ ΕΞΩΤΕΡΙΚΟ ΔΙΚΤΥΟ ΥΔΡΕΥΣΗΣ ΟΙΚΙΣΜΩΝ Δ.Ε. ΕΛΛΗΣΠΟΝΤΟΥ ΤΟΥ ΔΗΜΟΥ ΚΟΖΑΝΗΣ».,,,,,,,,https://diavgeia.gov.gr/doc/ΨΦΨ4ΟΡΥΑ-Φ4Ν
proc:5a81141a22e2,50449,2021,7,6ΔΣ5ΟΡΥΑ-3ΥΙ,2021-07-02,ΚΑΤΑΚΥΡΩΣΗ,ΣΥΜΒΑΣΗ (Σ52/2021)ΠΡΟΜΗΘΕΙΑ ΜΗΧΑΝΗΜΑΤΟΣ ΕΛΕΓΧΟΥ ΔΙΑΡΡΟΩΝ ΥΔΡΕΥΣΗΣ,,,,,,,,https://diavgeia.gov.gr/doc/6ΔΣ5ΟΡΥΑ-3ΥΙ
proc:1977ae526a4c,50449,2021,7,6Κ5ΥΟΡΥΑ-ΦΝΨ,2021-07-02,ΚΑΤΑΚΥΡΩΣΗ,ΣΥΜΒΑΣΗ Σ54/2021 ΠΡΟΜΗΘΕΙΑΣ ΥΓΡΩΝ ΚΑΥΣΙΜΩΝ ΚΙΝΗΣΗΣ (ΑΡ. ΔΙΑΚ.: 6/2021),,,,,,,,https://diavgeia.gov.gr/doc/6Κ5ΥΟΡΥΑ-ΦΝΨ
proc:3750058c5caa,50449,2021,7,9ΚΨΧΟΡΥΑ-87Σ,2021-07-02,ΚΑΤΑΚΥΡΩΣΗ,Σ53-2021 ΚΥΡΙΑ ΣΥΜΒΑΣΗ ΣΥΝΕΡΓΑΣΙΑΣ (ΠΥ ΦΥΛΑΞΗΣ ΤΗΣ ΔΕΥΑΚ),,,,,,,,https://diavgeia.gov.gr/doc/9ΚΨΧΟΡΥΑ-87Σ
proc:14391712ce61,50449,2021,7,ΩΤΖΓΟΡΥΑ-Ψ3Τ,2021-07-06,ΛΟΙΠΕΣ ΑΤΟΜΙΚΕΣ ΔΙΟΙΚΗΤΙΚΕΣ ΠΡΑΞΕΙΣ,"ΣΥΜΒΑΣΗ
«ΠΡΟΜΗΘΕΙΑ ΕΞΑΡΤΗΜΑΤΩΝ ΓΙΑ ΤΗΝ ΣΥΝΤΗΡΗΣΗ ΤΩΝ ΚΥΡΙΩΝ ΑΝΤΛΗΤΙΚΩΝ ΣΥΓΚΡΟΤΗΜΑΤΩΝ ΜΕΤΑΦΟΡΑΣ & ΔΙΑΝΟΜΗΣ ΤΗΣ ΕΓΚΑΤΑΣΤΑΣΗΣ ΤΗΛΕΘΕΡΜΑΝΣΗΣ ΚΟΖΑΝΗΣ ΓΙΑ ΤΗΝ ΠΕΡΙΟΔΟ ΛΕΙΤΟΥΡΓΙΑΣ 2021/2022» 
 - Αριθμός Αναφοράς: ΤΘ 0414/2021",,,,,,,,https://diavgeia.gov.gr/doc/ΩΤΖΓΟΡΥΑ-Ψ3Τ
proc:d15b4b2a598f,50449,2021,7,Ω2ΨΡΟΡΥΑ-ΞΚΩ,2021-07-07,ΑΝΑΛΗΨΗ ΥΠΟΧΡΕΩΣΗΣ,ΠΡΟΜΗΘΕΙΑ ΕΞΟΠΛΙΣΜΟΥ & ΛΟΓΙΣΜΙΚΟΥ ΓΙΑ ΤΟΝ ΕΚΣΥΓΧΡΟΝΙΣΜΟ ΤΟΥ ΥΠΑΡΧΟΝΤΟΣ ΣΥΣΤΗΜΑΤΟΣ ΤΗΛΕΕΛΕΓΧΟΥ - ΤΗΛΕΧΕΙΡΙΣΜΟΥ ΤΩΝ ΕΓΚΑΤΑΣΤΑΣΕΩΝ ΥΔΡΕΥΣΗΣ,,,,,,,,https://diavgeia.gov.gr/doc/Ω2ΨΡΟΡΥΑ-ΞΚΩ
proc:a0831a866303,50449,2021,7,Ψ7ΠΓΟΡΥΑ-8Ο0,2021-07-13,ΠΕΡΙΛΗΨΗ ΔΙΑΚΗΡΥΞΗΣ,"Προμήθεια α) Υλικών χυτοσιδηρών, β) Σωλήνες και ειδικά τεμάχια, γ) Ειδικά εξαρτήματα. (Αρ. Διακ.: 4/2021)",,,,,,,,https://diavgeia.gov.gr/doc/Ψ7ΠΓΟΡΥΑ-8Ο0
proc:c63c4fb11ad8,50449,2021,7,66ΦΗΟΡΥΑ-ΘΧ4,2021-07-15,ΚΑΝΟΝΙΣΤΙΚΗ ΠΡΑΞΗ,"Έγκριση 1ης παράτασης: «Προμήθεια και εγκατάσταση συστήματος διαχείρισης πίεσης, παρακολούθησης και αυτόματου ελέγχου των υδραυλικών παραμέτρων του εσωτερικού δικτύου ύδρευσης πόλης Κοζάνης».",,,,,,,,https://diavgeia.gov.gr/doc/66ΦΗΟΡΥΑ-ΘΧ4
proc:b366b200b1e1,50449,2021,7,9ΙΣΣΟΡΥΑ-7Τ3,2021-07-15,ΚΑΝΟΝΙΣΤΙΚΗ ΠΡΑΞΗ,Έγκριση ανάθεσης αποστολής λογαριασμών ύδρευσης & τηλεθέρμανσης Δ.Ε.Υ.Α. ΚΟΖΑΝΗΣ,,,,,,,,https://diavgeia.gov.gr/doc/9ΙΣΣΟΡΥΑ-7Τ3
proc:5a169165d491,50449,2021,7,ΩΜΡΛΟΡΥΑ-ΘΕ6,2021-07-15,ΛΟΙΠΕΣ ΑΤΟΜΙΚΕΣ ΔΙΟΙΚΗΤΙΚΕΣ ΠΡΑΞΕΙΣ,"ΣΥΜΒΑΣΗ  (Σ55/2021)
ΠΑΡΟΧΗΣ ΥΠΗΡΕΣΙΩΝ ΕΠΙΣΚΕΥΩΝ ΜΗΧΑΝΟΛΟΓΙΚΟΥ ΕΞΟΠΛΙΣΜΟΥ",,,,,,,,https://diavgeia.gov.gr/doc/ΩΜΡΛΟΡΥΑ-ΘΕ6
proc:bcdd90361295,50449,2021,7,Ψ539ΟΡΥΑ-ΓΘΑ,2021-07-22,ΚΑΤΑΚΥΡΩΣΗ,ΣΥΜΒΑΣΗ (Σ56/2021) ΠΡΟΜΗΘΕΙΑ ΔΙΑΦΟΡΩΝ ΟΙΚΟΔΟΜΙΚΩΝ ΥΛΙΚΩΝ ΥΔΡΕΥΣΗΣ,,,,,,,,https://diavgeia.gov.gr/doc/Ψ539ΟΡΥΑ-ΓΘΑ
proc:26d374f3d298,50449,2021,7,6ΕΛ1ΟΡΥΑ-ΗΑΦ,2021-07-26,ΣΥΜΒΑΣΗ,"ΜΝΗΜΟΝΙΟ ΣΥΝΕΡΓΑΣΙΑΣ ΓΙΑ ΤΗ ΔΙΕΝΕΡΓΕΙΑ 
ΑΡΧΑΙΟΛΟΓΙΚΩΝ ΕΡΕΥΝΩΝ ΚΑΙ ΕΡΓΑΣΙΩΝ
ΣΤΟ ΠΛΑΙΣΙΟ ΤΟΥ ΕΡΓΟΥ: «ΝΕΟ ΕΞΩΤΕΡΙΚΟ ΔΙΚΤΥΟ ΥΔΡΕΥΣΗΣ ΟΙΚΙΣΜΩΝ Δ.Ε. ΕΛΛΗΣΠΟΝΤΟΥ ΤΟΥ ΔΗΜΟΥ ΚΟΖΑΝΗΣ»",,,,,,,,https://diavgeia.gov.gr/doc/6ΕΛ1ΟΡΥΑ-ΗΑΦ
proc:168d0e29604f,50449,2021,7,6ΧΠΩΟΡΥΑ-ΝΔΟ,2021-07-26,ΣΥΜΒΑΣΗ,ΙΔΙΩΤΙΚΟ ΣΥΜΦΩΝΗΤΙΚΟ Σ60/2021 ΔΙΕΛΕΥΣΗ ΑΓΩΓΩΝ ΥΔΡΕΥΣΗΣ ΥΠΟΓΕΙΩΣ ΚΑΙ ΚΑΤΩ ΑΠΟ ΤΙΣ ΥΠΟΔΟΜΕΣ ΕΓΝΑΤΙΑΣ ΟΔΟΥ,,,,,,,,https://diavgeia.gov.gr/doc/6ΧΠΩΟΡΥΑ-ΝΔΟ
proc:919aecdc3bb2,50449,2021,7,ΨΥΨ7ΟΡΥΑ-ΦΚ1,2021-07-28,ΠΕΡΙΛΗΨΗ ΔΙΑΚΗΡΥΞΗΣ,"«ΠΡΟΜΉΘΕΙΑ  ΘΕΡΜΙΚΩΝ ΥΠΟΣΤΑΘΜΩΝ ΚΑΤΑΝΑΛΩΤΩΝ ΤΗΛΕΘΕΡΜΑΝΣΗΣ ΚΟΖΑΝΗΣ ΓΙΑ ΤΑ ΕΤΗ 2021 & 2022»  – (Αριθμός αναφοράς : ΤΘ 0410/2021),",,,,,,,,https://diavgeia.gov.gr/doc/ΨΥΨ7ΟΡΥΑ-ΦΚ1
proc:e73ab0a972ae,50449,2021,7,ΩΦ19ΟΡΥΑ-ΨΩ2,2021-07-30,ΚΑΤΑΚΥΡΩΣΗ,ΣΥΜΒΑΣΗ (Σ58/2021) ΠΡΟΜΗΘΕΙΑ ΣΤΑ ΠΛΑΙΣΙΑ ΤΗΣ ΠΡΑΞΗΣ: «ΕΞΥΠΝΗ ΠΛΑΤΦΟΡΜΑ ΔΙΑΔΙΚΤΥΟΥ-ΤΩΝ-ΠΡΑΓΜΑΤΩΝ ΔΙΑΧΕΙΡΙΣΗΣ ΚΑΙ ΑΞΙΟΠΟΙΗΣΗΣ ΑΝΑΚΥΚΛΟΥΜΕΝΟΥ ΝΕΡΟΥ ΒΙΟΛΟΓΙΚΟΥ ΚΑΘΑΡΙΣΜΟΥ ΓΙΑ ΑΡΔΕΥΣΗ ΣΕ ΚΑΛΛΙΕΡΓΕΙΕΣ ΣΤΗ ΓΕΩΡΓΙΑ ΑΚΡΙΒΕΙΑΣ (ΑΥΓΕΙΑΣ),,,,,,,,https://diavgeia.gov.gr/doc/ΩΦ19ΟΡΥΑ-ΨΩ2
proc:2113808a3e83,50449,2021,8,67Ψ4ΟΡΥΑ-ΜΩΡ,2021-08-05,ΚΑΝΟΝΙΣΤΙΚΗ ΠΡΑΞΗ,Έγκριση 1ου και 2ου πρακτικού ηλεκτρονικού ανοικτού διαγωνισμού με τίτλο «Προμήθεια διαλυμάτων Α. Υποχλωριώδους Νατρίου και Β. Δισθενούς Σιδήρου για τις ανάγκες της ΔΕΥΑ Κοζάνης για δύο (2) χρόνια 2021-2023» (Αρ. Διακ. 7/2021).,,,,,,,,https://diavgeia.gov.gr/doc/67Ψ4ΟΡΥΑ-ΜΩΡ
proc:80cef2eeffe1,50449,2021,8,Ω1ΕΚΟΡΥΑ-3ΘΜ,2021-08-19,ΑΝΑΛΗΨΗ ΥΠΟΧΡΕΩΣΗΣ,ΠΡΟΜΗΘΕΙΑ,,,,,,,,https://diavgeia.gov.gr/doc/Ω1ΕΚΟΡΥΑ-3ΘΜ
proc:56898a602628,50449,2021,8,6ΝΧΩΟΡΥΑ-7ΧΤ,2021-08-27,ΑΝΑΛΗΨΗ ΥΠΟΧΡΕΩΣΗΣ,ΠΡΟΜΗΘΕΙΑ ΑΝΤΑΛΛΑΚΤΙΚΩΝ ΗΛΕΚΤΡΙΚΩΝ ΚΙΝΗΤΗΡΩΝ ΔΙΚΛΕΙΔΩΝ Θ/Υ Τ/Θ,,,,,,,,https://diavgeia.gov.gr/doc/6ΝΧΩΟΡΥΑ-7ΧΤ
proc:e3d8820d0aad,50449,2021,8,ΨΕΝΝΟΡΥΑ-5Η5,2021-08-27,ΑΝΑΛΗΨΗ ΥΠΟΧΡΕΩΣΗΣ,ΠΡΟΜΗΘΕΙΑ ΛΙΠΑΝΤΙΚΩΝ ΓΙΑ ΤΟ ΤΜΗΜΑ ΒΙΟΛΟΓΙΚΟΥ ΚΑΘΑΡΙΣΜΟΥ,,,,,,,,https://diavgeia.gov.gr/doc/ΨΕΝΝΟΡΥΑ-5Η5
proc:97f24ee9b418,50449,2021,9,ΨΥ16ΟΡΥΑ-ΩΦΚ,2021-09-01,ΑΝΑΛΗΨΗ ΥΠΟΧΡΕΩΣΗΣ,ΠΡΟΜΗΘΕΙΑ ΥΔΡΑΥΛΙΚΟΥ ΕΞΟΠΛΙΣΜΟΥ ΓΙΑ ΣΥΝΤ/ΣΗ ΕΞΩΤΕΡΙΚΩΝ ΔΙΚΤΥΩΝ ΤΟΜΕΑ Η/Μ ΣΥΝ/ΣΗΣ,,,,,,,,https://diavgeia.gov.gr/doc/ΨΥ16ΟΡΥΑ-ΩΦΚ
proc:e21f36d7e3c5,50449,2021,9,ΩΑΒ4ΟΡΥΑ-Ε3Η,2021-09-02,ΑΝΑΛΗΨΗ ΥΠΟΧΡΕΩΣΗΣ,ΠΡΟΜΗΘΕΙΑ ΔΙΑΦΟΡΩΝ ΕΙΔΩΝ ΓΙΑ ΤΗ ΛΕΙΤΟΥΡΓΙΑ ΤΟΥ ΕΡΓΑΣΤΗΡΙΟΥ ΤΟΥ ΓΡΑΦΕΙΟΥ ΠΟΙΟΤΙΚΟΥ ΕΛΕΓΧΟΥ,,,,,,,,https://diavgeia.gov.gr/doc/ΩΑΒ4ΟΡΥΑ-Ε3Η
proc:1d93c9e50764,50449,2021,9,6ΧΝΤΟΡΥΑ-Κ4Η,2021-09-03,ΚΑΝΟΝΙΣΤΙΚΗ ΠΡΑΞΗ,Έγκριση Απευθείας Ανάθεσης Προμήθειας με τίτλο «Προμήθεια Εξοπλισμού & Λογισμικού για τον Εκσυγχρονισμού του Υπάρχοντος Συστήματος Τηλεελέγχου - Τηλεχειρισμού των Εγκαταστάσεων Ύδρευσης».,,,,,,,,https://diavgeia.gov.gr/doc/6ΧΝΤΟΡΥΑ-Κ4Η
